job_id,source,job_title,company,location,description,skills,careers_required,date_posted,url,career_tag,soft_skills_detected,extraction_date
90a06bf3d9e1da2e80fcf338a8bf661b,jooble,SOFTWARE & COMPUTER VISION DEVELOPER,Fine Foods & Pharmaceuticals N.T.M. S.p.A.,"Houston, TX","&nbsp;...analisi dati.
Conoscenza avanzata delle Librerie/framework di computer vision (ES: OpenCV e Halcon).
Conoscenza avanzata in campo <b>matematico.</b>
Conoscenza base della lingua inglese.
Creatività.
Si offre inquadramento e retribuzione commisurati in base all'esperienza...&nbsp;",[],Matemática,2025-07-16T00:00:00.0000000,https://jooble.org/jdp/-5426337015547077182,,[],2025-07-18
