job_id,source,job_title,company,location,description,skills,careers_required,date_posted,url,career_tag,soft_skills_detected,extraction_date
3680725d2ee90e9ad26cc13eb19208b2,jooble,Manipulador de materiales,McGrath,"Livermore, CA","&nbsp;...para compartir ideas y opiniones y el resultado final es que “USTED” es importante!


""Un Día en La Vida""
 Como manipulador de <b>materiales,</b> cargará y descargará material dentro de un almacén o instalación de almacenamiento. Utilice carretillas de mano, montacargas u...&nbsp;",[],[],2025-06-06T00:00:00.0000000,https://jooble.org/away/-8955334960783956359,,[],2025-06-11
81f7b0927dc0ce74fb9065fad81eb6f3,jooble,Manipulador de materiales,NFI Industries,"Chino, CA","Resumen

El Manipulador de <b>materiales </b>es responsable de mover materiales, suministros y productos terminados manualmente o en camiones de mano a los lugares designados en las instalaciones o en camiones. El puesto generalmente informa al supervisor o líder del almacén....&nbsp;",[],[],2025-06-11T00:00:00.0000000,https://jooble.org/jdp/6476225590686448118,,[],2025-06-11
5ad2096c37b3d82cc83f7652b516e212,jooble,Manejador de Materiales / Operador de Máquina,Connect Staffing,"Waco, TX","&nbsp;...Job Description 
 Job Description  DEBE TENER AL MENOS 6 MESES DE EXPERIENCIA RECIENTE COMO MANEJADOR DE <b>MATERIALES </b>O OPERADOR DE MÁQUINA 

 Connect Staffing está buscando un  Manejador de Materiales / Operador de Máquina Bilingüe  para unirse a una empresa líder en...&nbsp;",[],[],2025-05-30T00:00:00.0000000,https://jooble.org/away/215683442726440644,,[],2025-06-11
021c160b8150f9ba1a7f6d6a1917e1ea,jooble,Manipulador de Materiales (New Albany),Loeb Electric,"Columbus, OH","&nbsp;...equipo dinámico: 
 Recibe el material y las auditorías para verificar la exactitud, verificando la cantidad y la descripción de los <b>materiales </b>recibidos mediante la verificación de la mercancía con la lista de empaque. 
 Carga y descarga camiones de reparto cuando sea...&nbsp;",[],[],2025-06-05T00:00:00.0000000,https://jooble.org/away/-4758321021344684698,,[],2025-06-11
5aaae6499d576f44a3ece8be38592d6a,jooble,Material Sorter- Refuse and Recycling (Clasificador de Materiales - basura y reciclaje),Rite Rug Flooring,"Whitehall, OH","&nbsp;...a background check and drug test. 
 Be a self-started and be able to work independently. 

 Responsabilidades: 
 Clasificar <b>materiales:</b> clasificar a mano los materiales reciclables y poder clasificarlos con precisión y organizarlos. Limpiar el área dentro y alrededor...&nbsp;",[],[],2024-11-21T00:00:00.0000000,https://jooble.org/away/-775048949085848296,,[],2025-06-11
d9503c1522cb55874113b1661b61b0bc,jooble,Instalador,H & H Solar LLC,Puerto Rico,"&nbsp;...con las normativas de seguridad y los procedimientos establecidos en el lugar de trabajo. 
∙ Asistir en la carga y descarga de <b>materiales </b>y equipos en el lugar de la instalación. 
∙ Reportar cualquier anomalía o problema detectado durante la instalación al Sublíder...&nbsp;",[],[],2025-05-28T00:00:00.0000000,https://jooble.org/away/7754413445162954601,,[],2025-06-11
ed27c35371b3e8d2e0597873305f9f58,jooble,Electricista,Genera PR LLC,Puerto Rico,"&nbsp;...comunicación, baterías de almacenamiento, y trabajar con sistemas eléctricos de altos voltajes. 
 Apoya la adquisición de gestión de <b>materiales,</b> como cotizaciones, solicitudes de propuestas, contratos de servicios, comparaciones de ofertas, solicitudes de compra y órdenes...&nbsp;",[],[],2025-05-28T00:00:00.0000000,https://jooble.org/away/57808554832975097,,[],2025-06-11
269d9a3271caf1917f8c3a9f4f126331,jooble,HANDYMAN,Executive Homesearch and Realty Services Inc,Puerto Rico,"&nbsp;...pintura. Mantener las herramientas y el equipo de trabajo en buen estado. Cumplir con el procedimiento de control de inventario de <b>materiales,</b> herramientas y equipo. Asistir en el mantenimiento de las áreas verdes cuando sea necesario. Limpiar y brillar los pisos, áreas...&nbsp;",[],[],2025-05-30T00:00:00.0000000,https://jooble.org/away/-8146051198327540920,,[],2025-06-11
51bb91f224f89c9e980a1b68ec76c173,jooble,Carpenter,RQ Construction,Puerto Rico,"&nbsp;...prepara los sitios, cava zanjas, coloca abrazaderas para soporte, levanta andamios, limpia escombros y escombros y retira otros <b>materiales </b>de desecho no peligrosos. Además, este puesto puede operar uno o varios tipos de equipos de construcción de energía, así como reparar...&nbsp;",[],[],2025-06-08T00:00:00.0000000,https://jooble.org/away/2569869527948856408,,[],2025-06-11
428935874cd9ba361a089c71407ba82a,jooble,WAREHOUSE TRAINER,Plaza Food Systems,Puerto Rico,"&nbsp;...implementación y la mejora continua de los programas de adiestramiento, incluidas las oportunidades de educación continua. 
• Evaluar los <b>materiales </b>de capacitación existentes para revisar y crear cursos de capacitación. 
• Junto al Supervisor/Gerente llevar a cabo una...&nbsp;",[],[],2025-05-27T00:00:00.0000000,https://jooble.org/away/-7519769215782531749,,[],2025-06-11
98bb07b7acbfa1b11c3a8675436bc7a7,jooble,PACKAGING OPERATOR,Millicent Puerto Rico LLC,Puerto Rico,"&nbsp;...Preparar, cargar y operar maquinaria de producción según instrucciones aprobadas. 
 Verificar el correcto pesaje y adición de <b>materiales.</b> 
 Controlar parámetros de proceso (tiempo, temperatura, presión, etc.). 
 Documentar de forma precisa en registros de producci...&nbsp;",[],[],2025-06-10T00:00:00.0000000,https://jooble.org/away/8507788941610525496,,[],2025-06-11
537aee7bb005cacd8f01b9fbf5046cd6,jooble,Mantenimiento Facilidades,ADRIEL barra,Puerto Rico,"&nbsp;...siguientes tareas. 
 Resumen de tareas: 
 Limpieza general dentro y fuera de las facilidades 
 Mantener los baños limpios y suplir los <b>materiales </b>que falten. (jabón de manos, papel higiénico, papel secante). 
 Limpieza de pisos. 
 Limpieza de cristales. 
 Mantener las...&nbsp;",[],[],2025-06-09T00:00:00.0000000,https://jooble.org/away/-699493538285824622,,[],2025-06-11
421ea0a24a480121bd59310e2ab9b67e,jooble,Recepcionista - Bayamón,NUC University,Puerto Rico,"&nbsp;...trato y les hace sentir cómodos 
 Dirige a los visitantes al departamento correspondiente o a los Oficiales de Admisiones 
 Ordena <b>materiales </b>de oficina cuando sea necesario en coordinación con el Director de Admisiones 
 Toma mensajes para el personal del Departamento...&nbsp;",[],[],2025-06-10T00:00:00.0000000,https://jooble.org/away/-5224910468149010109,,[],2025-06-11
d052737eefb19244d5bee9bbf8713af5,jooble,Conductor Comercial,QXO,"Ogden, UT","&nbsp;...pedir que brinde ayuda para levantar, empujar o mover productos según sea necesario. 
 Inspeccionar previamente el camión, cargar <b>materiales </b>y verificar que la carga sea correcta. 
 Configurar los parámetros de trabajo e inspeccionar el sitio para garantizar que el...&nbsp;",[],[],2025-06-11T00:00:00.0000000,https://jooble.org/jdp/-4668154149029327719,,[],2025-06-11
f59246f487263820d2290ccbbeb170db,jooble,Community Educator,APS Health Care PR,Puerto Rico,&nbsp;...asiste a las reuniones de los grupos de trabajo para el mantenimiento del rendimiento de la calidad y proporciona actividades y <b>materiales </b>educativos relacionados con la Mejora de la Calidad (QI). El Educador Comunitario se dedica plenamente a las tareas del Departamento...&nbsp;,[],[],2025-05-22T00:00:00.0000000,https://jooble.org/away/6331239812430336930,,[],2025-06-11
87f568781bb937eb7297b385811a90bb,jooble,Mantenimiento General,La Parrilla Argentina,Puerto Rico,"&nbsp;...una variedad de condiciones ambientales que requieren una fuerza de moderada a mxima, como levantar objetos, caminar y manipular <b>materiales.</b> 
 Rapidez y eficiencia- Capacidad para trabajar en un entorno de ritmo rpido y mantener la calma bajo presin, realizando su trabajo...&nbsp;",[],[],2025-05-24T00:00:00.0000000,https://jooble.org/away/-5457724106624054951,,[],2025-06-11
64b86e99fc7be3f9868229d51e208fb9,jooble,Licensed Electrician,AG Group Inc,Puerto Rico,"&nbsp;...Determinar la localización de los cables y equipos de acuerdo al código eléctrico (NEC). 
 Proveer unos costos estimados de los <b>materiales </b>y equipos. 
 Inspeccionar el sistema eléctrico, el equipo y los componentes para identificar algún peligro, defecto, o la necesidad...&nbsp;",[],[],2025-05-23T00:00:00.0000000,https://jooble.org/away/1150106061486792586,,[],2025-06-11
d1fc2dc41f7eee9635a4fa94bc70e81a,jooble,Handyman,Liga Puertorriquena Contra el Cáncer,Puerto Rico,"&nbsp;...electricidad de menor grado, plomería, jardinería,  Gypsum Board  , etc. Realiza movimiento de equipo del Hospital, tales como recogido de <b>materiales </b>y mudanzas. 

 Requisitos Básicos del Puesto: 
 Cuarto año de escuela superior. 
 Habilidad para leer y comprender...&nbsp;",[],[],2025-05-14T00:00:00.0000000,https://jooble.org/away/-5672894358530092376,,[],2025-06-11
805855ddde1d8400e7813e63010ac0a9,jooble,Coder,Provider Network Solutions,Puerto Rico,"&nbsp;...cumplimiento. 
 Educar a proveedores y personal médico para optimizar primas y mejorar resultados. 
 Analizar datos, desarrollar <b>materiales </b>educativos y coordinar reuniones estratégicas. 
 Participar en evaluaciones anuales y diseñar planes de acción enfocados en la...&nbsp;",[],[],2025-05-19T00:00:00.0000000,https://jooble.org/away/-6534717519767872508,,[],2025-06-11
b206f166d56241e3037c59124a9d0ad9,jooble,Receiving Management,AMERICA'S FRESH FOODS,Puerto Rico,"&nbsp;...Description 
# Resumen general del puesto 

 Responsable de dirigir y supervisar el área de recibo de mercancías, productos, <b>materiales,</b> artículos, entre otros. Garantiza que la mercancía entrante se reciba correctamente, se procese de manera oportuna, eficientemente...&nbsp;",[],[],2025-05-22T00:00:00.0000000,https://jooble.org/away/-1545405301582873215,,[],2025-06-11
7ab939f93379cee8e011a314ad13fee9,jooble,JANITOR,Plaza Food Systems,Puerto Rico,"&nbsp;...pesados 
 Conocimiento de suministros y productos químicos de limpieza 
 Familiaridad con las fichas de datos de seguridad de <b>materiales </b>
 Integridad 
 Licencia de Conducir Vigente de PR 
 Patrono con igualdad de oportunidad en el empleo OE/Acción Afirmativa para...&nbsp;",[],[],2025-05-12T00:00:00.0000000,https://jooble.org/away/1518963414909881378,,[],2025-06-11
c7e75d7b9693e266a3f18bfc31353617,jooble,Empleado de Almacén,QXO,"Tacoma, WA","&nbsp;...valiosas certificaciones. 
#BenK 
 Lo que harás:: 
 Operar montacargas y otros equipos pesados para cargar, descargar y mover <b>materiales </b>en el almacén y el patio. 
 Trabajar al aire libre con exposición a todas las condiciones climáticas. 
 Verificar el contenido...&nbsp;",[],[],2025-06-11T00:00:00.0000000,https://jooble.org/jdp/-8351338045742292412,,[],2025-06-11
386e602e650276af779a31bce2359b0e,jooble,Despachador,"Mr. Rooter, A Neighborly Company","Deerfield Beach, FL","&nbsp;...hacerlo bien, la primera vez.
Operando de manera eficiente: mantenemos la productividad con nuestro tiempo y usamos cuidadosamente los <b>materiales </b>para evitar el desperdicio.
Alta satisfacción del cliente: recopilamos comentarios de los clientes a través de encuestas y reseñ...&nbsp;",[],[],2025-06-09T00:00:00.0000000,https://jooble.org/jdp/8980147264863194102,,[],2025-06-11
674c18decf7196465974d37872e6675d,jooble,Obrero,Alloy,"Tampa, FL","&nbsp;...varias herramientas manuales de forma segura y eficaz, herramientas motorizadas, dispositivos de elevación y transportadores de <b>materiales.</b> 
 Debe poder viajar a lugares de trabajo. 

 Calificaciones requeridas y requisitos de educación 
 Experiencia en la industria...&nbsp;",[],[],2025-06-02T00:00:00.0000000,https://jooble.org/away/3439622395275928714,,[],2025-06-11
d9aea187122d1d885ad6dbc6669446b7,jooble,Electrician I,MasTec Communications Group,"Houston, TX","&nbsp;...inspeccion y aceptacion del trabajo realizado por proveedores y recursos de la empresa, incluida la calidad de los servicios, equipos y <b>materiales,</b> documentos de ingenieria y otros entregables de proyectos necesarios
Implementar y lograr la Politica de Cero Defectos de la...&nbsp;",[],[],2025-06-11T00:00:00.0000000,https://jooble.org/jdp/5553952238332937950,,[],2025-06-11
ce37571ca6fe56ce76ad8f354180b862,jooble,Carpenter,The Walsh Group,"Mcdonough, GA","&nbsp;...McDonough, Georgia.

El Carpintero construye, construye e instala estructuras de madera, madera contrachapada, paneles de pared y otros <b>materiales </b>utilizando herramientas manuales de carpintería, herramientas eléctricas y máquinas para trabajar la madera en sitios de trabajo,...&nbsp;",[],[],2025-06-09T00:00:00.0000000,https://jooble.org/jdp/-2048018255824324199,,[],2025-06-11
551098584f8eec8930536f4c9ed0df15,jooble,Ensamblador,Griswold Industries dba Cla-Val,"Costa Mesa, CA","&nbsp;...agacharse, inclinarse, alcanzar objetos y estirarse para ensamblar varias válvulas y piezas;
Capacidad para levantar, cargar y mover <b>materiales </b>y piezas que pesen 25 libras o menos;
Habilidad en el uso de los dedos de la mano y para agarrar y maniobrar las piezas,...&nbsp;",[],[],2025-06-10T00:00:00.0000000,https://jooble.org/jdp/280950174257995387,,[],2025-06-11
78cfa9ee9d0333ad53812c6171d59e65,jooble,Laborer,Eco Material Technologies,"Pomona, CA","&nbsp;...Technologies según sea necesario
Realizar mantenimiento general de equipos de construcción
Asistir en la carga y descarga de equipos y <b>materiales
</b>Avistamiento para operadores de equipos
Tener una asistencia regular, puntualidad y flexibilidad de horario
CONOCIMIENTOS,...&nbsp;",[],[],2025-06-08T00:00:00.0000000,https://jooble.org/jdp/7626348872114947384,,[],2025-06-11
de2577cf0f0f7c65f71ca3022afa3ec3,jooble,Laborer,JT Wimsatt Contracting Company Inc,"Los Angeles, CA","&nbsp;...trincheras, usar palas, Jack Hammers, depojamiento y limpieza de formas de madera despues de averse usado, cargando y descargando <b>materiales </b>de construccion I identificando toda classe de materiales, herramientas para hacer distribuidos a las diferentes locations de la...&nbsp;",[],[],2025-06-10T00:00:00.0000000,https://jooble.org/jdp/-6699779753746065263,,[],2025-06-11
36277b5e33b1c07fd49d5a5b073b177f,jooble,Techador,Innovative Cleaning Services,"Cincinnati, OH","&nbsp;...capacidad de seguir instrucciones. Hbil en el uso de todas las herramientas necesarias para cortar, moldear y suavizar la madera y otros <b>materiales </b>de acuerdo con las mediciones. Exactitud tomando mediciones y calculando el tamao y la cantidad de material necesario para un...&nbsp;",[],[],2025-06-08T00:00:00.0000000,https://jooble.org/jdp/1235739839659402080,,[],2025-06-11
6b0ef06bd25770bd2d4466c32c370cfa,jooble,Albail,Aireko,Puerto Rico,"Coloca y une <b>materiales </b>de construccin, como ladrillo, baldosa estructural, bloque de hormign, bloque de cemento, bloque de vidrio y bloque de terracota, con mortero y otras sustancias para construir o reparar muros, tabiques, arcos, alcantarillas y otras estructuras....&nbsp;",[],[],2025-06-08T00:00:00.0000000,https://jooble.org/jdp/5711207789172440393,,[],2025-06-11
754a5f9ae100b679bfbd304d72b38162,jooble,Subgerente,Little Caesars,"Benton, AR","&nbsp;...de antecedentes penales. 
 Se prefieren referencias para experiencia de gestión previa 
 La capacidad de comprender todos los <b>materiales </b>de capacitación y practicar procedimientos operativos estándar. 
 La capacidad de aprobar con éxito los programas de capacitació...&nbsp;",[],[],2025-06-08T00:00:00.0000000,https://jooble.org/jdp/7724363057020959845,,[],2025-06-11
fae3cc9c0094121b081eb1eb9f5f2209,jooble,Painter,Mentor Technical Group,Puerto Rico,"&nbsp;...interpretar planos, especificaciones tcnicas o instrucciones del cliente para garantizar el acabado requerido. 
 Mezclar pinturas y <b>materiales </b>segn proporciones especficas para obtener colores y texturas deseadas. 
 Proteger reas que no deban ser pintadas (encintado,...&nbsp;",[],[],2025-06-09T00:00:00.0000000,https://jooble.org/jdp/3066654819775330749,,[],2025-06-11
a79d6fc60957d6baa1591927cf692451,jooble,Welder,JGM,"Reading, PA","&nbsp;...calidad en las soldaduras y realice las correcciones necesarias para cumplir con los estndares AWS y AISC. 
 Manipule de forma segura <b>materiales </b>pesados utilizando gras areas, montacargas y otros equipos. 
 Inspeccione y mantenga el equipo de soldadura, informando...&nbsp;",[],[],2025-06-02T00:00:00.0000000,https://jooble.org/away/3570601936248238610,,[],2025-06-11
964eb97b8b4096734eb7096f9eef2d8b,jooble,Pipefitter,The Walsh Group,"American Fork, UT","&nbsp;...sistemas de tuberas de vaco, lneas de drenaje y alcantarillado (laterales) desde los edificios hasta el punto de fijacin 
 Mueve <b>materiales </b>y equipos para ser utilizados por fontaneros, instaladores de tuberas y instaladores de vaporizador. 

 CALIFICACIONES 
~3-5...&nbsp;",[],[],2025-06-07T00:00:00.0000000,https://jooble.org/jdp/3059840128570143126,,[],2025-06-11
f334a140d9827d9754c938c389957840,jooble,Dishwasher,Trattoria Bruno's Inc.,"Brea, CA","&nbsp;...seguridad de los empleados. 
 Gestión de recursos: capacidad para obtener y apropiarse del uso adecuado de equipos, instalaciones y <b>materiales.</b> 
 Ético: capacidad de demostrar una conducta conforme a un conjunto de valores y estándares aceptados. 
 Toma de decisiones:...&nbsp;",[],[],2025-05-30T00:00:00.0000000,https://jooble.org/away/578073092915838641,,[],2025-06-11
d96dd95d7dfd117ad44113067fae8f46,jooble,Tripulante,Little Caesars,"Little Rock, AR","&nbsp;...que sirven están satisfechos. 
 El miembro de la tripulación recibe instrucciones del equipo de administración del restaurante y <b>materiales </b>de capacitación de Little Caesars para realizar su trabajo de manera efectiva. Los miembros de la tripulación practicarán los...&nbsp;",[],[],2025-06-08T00:00:00.0000000,https://jooble.org/jdp/-7497039453595638315,,[],2025-06-11
86022a9563cdeaeb502736879119b7c5,jooble,Varillero,Aireko,Puerto Rico,"Brindar apoyo a los carpinteros desempeando tareas de menor destreza. Las tareas incluyen utilizar, facilitar o sostener <b>materiales </b>o herramientas y limpiar el rea y equipo de trabajo. 
 Responsabilidades: 
•Limpiar reas de trabajo, mquinas o equipos, para mantener el...&nbsp;",[],[],2025-06-10T00:00:00.0000000,https://jooble.org/jdp/-2777668298791486323,,[],2025-06-11
be03c82b5d9d3544857fbc882b62b17f,jooble,Cocinar,Dairy Queen,"Stuarts Draft, VA","&nbsp;...salud del restaurante. Quién cocinaría, ensamblaría y envolvería buenos artículos, almacenaría todos los productos necesarios y <b>materiales </b>de preparación de una manera limpia y segura.  Un buen candidato para este trabajo es una persona con atención al detalle que puede...&nbsp;",[],[],2025-06-09T00:00:00.0000000,https://jooble.org/jdp/2487986965279684312,,[],2025-06-11
3fe0b4b970b6f89c51a35ad6529920de,jooble,Busser,Trattoria Bruno's Inc.,"Brea, CA","&nbsp;...seguridad de los empleados. 
 Gestión de recursos: capacidad para obtener y apropiarse del uso adecuado de equipos, instalaciones y <b>materiales.</b> 
 Ético: capacidad de demostrar una conducta conforme a un conjunto de valores y estándares aceptados. 
 Toma de decisiones:...&nbsp;",[],[],2025-05-27T00:00:00.0000000,https://jooble.org/away/-2975155922925353158,,[],2025-06-11
8ed39f906417485df3abed2a5e04b109,jooble,Harvester,Wise Staffing Group,"Madisonville, TX","&nbsp;...), regar las paredes y los pisos, cosechar productos de hongos del sustrato de crecimiento (bolsa) , organizar los hongos en los <b>materiales </b>de embalaje de acuerdo con las órdenes del día, ayudar en la limpieza de las áreas de cultivo, indicar al departamento de cultivo...&nbsp;",[],[],2025-06-06T00:00:00.0000000,https://jooble.org/away/-1310900248982419061,,[],2025-06-11
a5cdac814426ec0b646cd337683f82bd,jooble,Assembler Layup,Belcan,"Sylmar, CA","&nbsp;...Colocar capas de acrlico en parabrisas. 
* Cumplir con el protocolo de sala limpia. 
* Verificar la calidad de las piezas y los <b>materiales.</b> 
* Seguir los procedimientos y directrices de la empresa. 
* Mantener las herramientas utilizadas para crear productos. 
*...&nbsp;",[],[],2025-06-11T00:00:00.0000000,https://jooble.org/jdp/4962884122402291510,,[],2025-06-11
d806668536661e04acdee3bbcf732216,jooble,Handyman,CPM Builders,"Miami, FL","&nbsp;...equipo de gestin del proyecto. 
 Manteniendo el lugar de construccin limpio y organizado, desechando residuos, escombros y otros <b>materiales.</b> 
 Ayudando en la manipulacin, transporte y almacenamiento de materiales y equipos de construccin. 
 Identificando posibles...&nbsp;",[],[],2025-05-22T00:00:00.0000000,https://jooble.org/away/3917867979948547895,,[],2025-06-11
96951fa7f189642dfd789543a5fe3e29,jooble,Machinist Senior,Belcan,"Camarillo, CA","&nbsp;...piezas), como cortar, dar forma, desbarbar, formar, perforar y escariar piezas. 
* Realiza operaciones de mquina en las que los <b>materiales,</b> las herramientas y la secuencia de operaciones se han planificado y establecido previamente. 
* Realiza los ajustes necesarios...&nbsp;",[],[],2025-06-07T00:00:00.0000000,https://jooble.org/jdp/8876082537256295659,,[],2025-06-11
2a6abf3359ca3f6a3f734782182e869f,jooble,Crane Operator,The Walsh Group,"Mesquite, TX","&nbsp;...dirigir y ayudar con el aparejo. 
 Debe tener conocimiento de los procedimientos operativos en respecto a a la carga y descarga de <b>materiales.</b> 
 Puede aplicar aceite, grasa, servicio y hacer ajustes de mantenimiento normales en el equipo; realiza controles diarios de...&nbsp;",[],[],2025-06-09T00:00:00.0000000,https://jooble.org/jdp/598418513762512596,,[],2025-06-11
28da5d95307d28303bf6b35ff22d1b10,jooble,Pipefitter Helper,The Walsh Group,"Flowery Branch, GA","&nbsp;...sistemas de tuberías de vacío, líneas de drenaje y alcantarillado (laterales) desde los edificios hasta el punto de fijación

Mueve <b>materiales </b>y equipos para ser utilizados por fontaneros, instaladores de tuberías y instaladores de vaporizador

CALIFICACIONES

2-5 años de...&nbsp;",[],[],2025-06-07T00:00:00.0000000,https://jooble.org/jdp/-5355663163399976211,,[],2025-06-11
9b3d3693ed13fffdb288c7349645796d,jooble,CNC Programmer,Belcan Corporation,"Irvine, CA","&nbsp;...programa original para garantizar la precisión de las instrucciones de la máquina.
* Analiza los cambios propuestos en los métodos y <b>materiales </b>y contribuye a la mejora continua y a las actividades clave de manufactura/producción eficiente.
* Recomienda oportunidades de...&nbsp;",[],[],2025-06-07T00:00:00.0000000,https://jooble.org/jdp/-5124949116414480544,,[],2025-06-11
7a0d2d4a34cfed39605462e07ad66146,jooble,Load Builder I,Builders FirstSource,"Pensacola, FL","&nbsp;...combination of education and experience. Forklift Certification required.
Bajo supervision general, realizar cargas y descargas de <b>materiales </b>de rutina dentro del lugar o sitio de trabajo; montar paquetes de carga en el camion para entregar en los sitios de trabajo del...&nbsp;",[],[],2025-06-07T00:00:00.0000000,https://jooble.org/jdp/3342693749593891232,,[],2025-06-11
5064acbd53c3be38ea03a6f412ccf79d,jooble,Bakery Associate,Fresco y Ms,"Tampa, FL","&nbsp;...equipos de limpieza, equipo de oficina general, caja registradora, pistola de precios, balanzas, escner, diversos equipos de manejo de <b>materiales,</b> como estantes, carros, transpaletas, carritos de compras 
 Equipo requerido especfico del departamento  : Equipo de corte...&nbsp;",[],[],2025-06-07T00:00:00.0000000,https://jooble.org/jdp/7797154950245924749,,[],2025-06-11
5c4e9eb6ca2d36da61415f66596bccb5,jooble,Compounder,Kelly Services,Puerto Rico,"&nbsp;...\n- Manejar y mantener el control de inventario de todos los productos químicos, enviando informes semanales al Departamento de <b>Materiales.</b> 
\n- Utilizando WMS (Sistema de Gestión de Almacenes) para reportar el pesaje de materias primas y gestionar movimientos de materiales...&nbsp;",[],[],2025-06-05T00:00:00.0000000,https://jooble.org/away/1240684522882451929,,[],2025-06-11
30c0ecb86a65373603f45c0fbdf1ac1e,jooble,Production Assembler,Belcan,"Sylmar, CA","&nbsp;...Responsabilidades 
* Sigue instrucciones tcnicas, interpreta planos de ingeniera y trminos tcnicos. 
* Discernir la calidad de las piezas y <b>materiales </b>utilizados en la produccin. 
* Inventario de piezas y herramientas utilizadas en el proceso de montaje. 
* Sigue los...&nbsp;",[],[],2025-06-10T00:00:00.0000000,https://jooble.org/jdp/4336720482139362199,,[],2025-06-11
6dd0b7d9a1ed38a5086d42fde1f5d0c0,jooble,CDL Driver,The Walsh Group,"Salem, VA","&nbsp;...Conductor de Camión Volquete conducirá un camión volquete con una capacidad de al menos tres toneladas para transportar mercancías o <b>materiales </b>y descargar cargas.

Nuestros empleados están hechos para tener éxito. Los empleados tienen la oportunidad de trabajar en todo...&nbsp;",[],[],2025-06-09T00:00:00.0000000,https://jooble.org/jdp/6061992849371538959,,[],2025-06-11
1bf6ff569087c1c07bc2e0277c715a32,jooble,Truck Driver,Crowder Construction,"Charlotte, NC","&nbsp;...reportar cuando se requiera mantenimiento/reparacion al despachador.
Asegurar que las cargas que se transportan esten seguras y los <b>materiales/</b>equipos sin danos al llegar a su destino.
Asistir en la carga y descarga del material transportado .

Habilidades, Conocimientos,...&nbsp;",[],[],2025-06-09T00:00:00.0000000,https://jooble.org/jdp/-6913952203165896075,,[],2025-06-11
