job_id,source,job_title,company,location,description,skills,careers_required,date_posted,url,career_tag,soft_skills_detected,extraction_date
7a711f5798ce0201ab93dc503ece114f,jooble,Asistente de Almacen,Sunwave Energy Llc,"Orlando, FL","&nbsp;...de tareas, incluyendo entregas, recogidas, gestin de inventario y operacin de un montacargas para garantizar el flujo continuo de <b>materiales </b>dentro y fuera del almacn. Si tienes experiencia conduciendo un montacargas, una gran atencin al detalle y disfrutas trabajar en...&nbsp;",[],[],2025-05-27T00:00:00.0000000,https://jooble.org/away/7274763833365456048,,[],2025-06-11
3140981e543f2ec673ec9f07ff47681f,jooble,Landscaper,"SFM Services, Inc.","Miami, FL","&nbsp;...Fsicos 
 Debe poder trabajar en y alrededor de varios entornos de jardinera, incluyendo contacto directo con diversas plantas y <b>materiales </b>de paisajismo, y exposicin a varias condiciones de polvo, ruido y clima. 
 Capacidad para levantar y/o mover hasta 50 libras....&nbsp;",[],[],2025-06-11T00:00:00.0000000,https://jooble.org/jdp/7102800694802446022,,[],2025-06-11
18077ade5caa1017e94843fa7fc81478,jooble,Landscape Crew Leader,Environmental Management Inc,"Plain City, OH","&nbsp;...operación del equipo y el cumplimiento de los procedimientos de seguridad establecidos por EMI. Deben tener conocimientos básicos de <b>materiales </b>de plantas y paisajes, técnicas de construcción relacionadas con el paisaje comercial y residencial y la instalación de paisajes...&nbsp;",[],[],2025-05-29T00:00:00.0000000,https://jooble.org/away/-6668040339488512038,,[],2025-06-11
b512eb25d7707571bae7a28baf735824,jooble,Terminador de Concreto,Lunar Companies,"Noblesville, IN","&nbsp;...equipos y asegure el lugar de trabajo todos los días para eliminar posibles peligros. 
 Carga y descarga camiones y acarrea y eleva <b>materiales.</b> 
 Garantiza que se sigan los procedimientos adecuados de notificación de incidentes y seguridad. Trae los problemas a la atenci...&nbsp;",[],[],2025-05-26T00:00:00.0000000,https://jooble.org/away/184519111397351037,,[],2025-06-11
6bccf9f6b66d434edca22a118d708c65,jooble,Obrero,Garney Construction,"Fort Collins, CO","&nbsp;...compactadores, sierras para hormigón, sierras tronzadoras, martillos neumáticos y zanjadoras manuales. 
• Levantar, transportar y sostener <b>materiales </b>de construcción, herramientas y suministros. 
• Unir, envolver, sellar y encamar secciones de tuberías subterráneas y...&nbsp;",[],[],2025-06-11T10:04:08.1370000,https://jooble.org/jdp/-6295300510272442033,,[],2025-06-11
af07bc1754f333d79fcb6be9c8be5ca7,jooble,Purchasing,AppleOne,Puerto Rico,"&nbsp;...Realizar órdenes aéreas o de emergencia a suplidores para atender pedidos de ventas. 
· Realizar las compras y coordinaciones de los <b>materiales </b>necesarios para todos los almacenes de la empresa. 
· Preparar, revisar y rastrear órdenes de compra y cambios de precios. 
·...&nbsp;",[],[],2025-06-11T05:50:34.8634854+00:00,https://jooble.org/jdp/-7803213808532300642,,[],2025-06-11
1e8b52cd06097541e69108ba9f00b0d1,jooble,Field Service Manager,Environmental Management Inc,"Columbus, OH","&nbsp;...ón de pruebas e inspecciones de productos, servicios o procesos para evaluar la calidad o el rendimiento. 
 Gestión de Recursos <b>Materiales-</b> Obtención y procuración del uso adecuado de equipos, instalaciones y materiales necesarios para realizar ciertos trabajos. 
 Gesti...&nbsp;",[],[],2025-05-29T00:00:00.0000000,https://jooble.org/away/-7612200233703922146,,[],2025-06-11
47f63aea963056a5c59cd61352ae8ad4,jooble,Lider de grupo,Envirovac,"West Memphis, AR","&nbsp;...reconocimiento de peligros con el objetivo de que estos sean eliminados en el lugar de trabajo. 
 Supervisa al personal asignado, equipos, <b>materiales </b>y subcontratistas que hayan sido asignados a un trabajo especfico. 
 Asegura que el desempeo del trabajo sea planificado y...&nbsp;",[],[],2025-06-08T00:00:00.0000000,https://jooble.org/jdp/-2746643355586908022,,[],2025-06-11
6367fdfaeb69f5214a43e50631bb85c3,jooble,IMPIEGATO/ A UFFICIO ACQUISTI,JR Italy,Alabama,"&nbsp;...componenti in gomma un IMPIEGATO/A UFFICIO ACQUISTI .
La risorsa si occuperà di:
Gestione autonoma del processo di acquisizione del <b>materiale;</b>
Definizione di strategie di acquisto;
Ricerca di nuovi fornitori;
Attività di reportistica;
Gestione della parte operativa degli...&nbsp;",[],[],2025-06-08T00:00:00.0000000,https://jooble.org/jdp/-160831087340580945,,[],2025-06-11
e15787d25f5d1d5272abda6e78d1d3b9,jooble,Electrician for Solar company,ZipRecruiter,"Orlando, FL","&nbsp;...ambiente de trabajo limpio, organizado y seguro.

Interpretar planos, bocetos o esquemas para determinar los requisitos elctricos y los <b>materiales </b>necesarios.

Instalar, reparar y mantener sistemas elctricos, asegurando el cumplimiento de los estndares de la industria....&nbsp;",[],[],2025-06-08T00:00:00.0000000,https://jooble.org/jdp/-1322965753350180105,,[],2025-06-11
eab94860aef2fbc64f60bcef92b75200,jooble,Trabajador de Asbestos,Snyder Environmental,"North Little Rock, AR","&nbsp;...14, 2022
 Propsito de Puesto de Trabajo 
 De manera segura y eficiente identifica, remueve, empaca y transporta o desecha los <b>materiales </b>contaminados incluyendo asbestos, pintura a base de plomo, aceites usados, gasolina, aceites de transmisin, materiales radioactivos...&nbsp;",[],[],2025-06-08T00:00:00.0000000,https://jooble.org/jdp/-6138161442501206064,,[],2025-06-11
927bc471a4709f6bb6beffebc47c30a2,jooble,Receiving Specialist FT,Fresco y Más,"Tampa, FL","&nbsp;...limpieza, equipo de oficina en general, registro, pistola de fijacin de precios, bsculas, escner, diversos equipos de manejo de <b>materiales,</b> como estantes, carros, transpaletas, carritos de compras Equipo preferido: empacadora/compactadora, cortadora de cajas Equipo de...&nbsp;",[],[],2025-06-08T00:00:00.0000000,https://jooble.org/jdp/5956864664470974996,,[],2025-06-11
95abf8db950e773047a03c5aebda4b3a,jooble,Director (a) de IT,Best Option Healthcare Puerto Rico Inc,Puerto Rico,"&nbsp;...al usuario enfocados en calidad, tiempo de respuesta, resolución efectiva y satisfacción. 
 c. Desarrolla recursos de autoayuda, <b>materiales </b>formativos y sesiones de entrenamiento para mejorar el uso de herramientas tecnológicas por parte de los usuarios. 
 d. Fomenta...&nbsp;",[],[],2025-06-06T00:00:00.0000000,https://jooble.org/away/-4590505748671765530,,[],2025-06-11
37f93aa8781ea49c0bc9ab37018f1ec0,jooble,SUPERVISOR DE INGENIERIA,Pan Pepin,Puerto Rico,"&nbsp;...de las plantas. 
~ Coordina y supervisa trabajos de calibración e instrumentación de las plantas. 
~ Realiza requisiciones de <b>materiales </b>y/o servicios para los trabajos de mantenimiento. 
~“Trouble shooting” de los equipos de producción. 
~ Atiende situaciones de...&nbsp;",[],[],2025-05-30T00:00:00.0000000,https://jooble.org/away/-4486217387213959573,,[],2025-06-11
326773abc4a7d494b2ea4ac9d9ee5ab1,jooble,Asistente de Cocina,Urban Strategies LLC,Puerto Rico,"&nbsp;...raciones a ser servidas 
 Responsable de manejar adecuadamente los recursos que estén a su cargo (alimentos, equipo, detergentes, <b>materiales)</b> 
 Gestionar, administrar y organizar los documentos relacionados con el ámbito de trabajo. 
 Recibir las compras de alimentos....&nbsp;",[],[],2025-06-02T00:00:00.0000000,https://jooble.org/away/7262456632001671765,,[],2025-06-11
1847b292b25ce8d9b16f408b75680fea,jooble,Asistente Administrativo Ejecutivo,Para la Naturaleza,Puerto Rico,"&nbsp;...supervisando personal. 
~ Experiencia manejando calendarios a nivel ejecutivo. 
~ Experiencia coordinando reuniones, preparando <b>materiales,</b> agendas y tomando minutas. 
~ Conocimiento de sistema operativo MAC y Outlook es preferible. 
~ Dominio de procesador de...&nbsp;",[],[],2025-05-29T00:00:00.0000000,https://jooble.org/away/-1388172924668734557,,[],2025-06-11
af187406ba6c7812d2724ea2e4c20c51,jooble,Instructor(a) de Técnico(a) de Construcción,NUC University,Puerto Rico,"&nbsp;...(Handyman) o 
 Diploma de Cuarto Año y certificaciones de: 
 Patrones por empleos 
 Empresas dirigidas a la venta de equipo, <b>materiales </b>o herramientas 

 Cursos de educación continua en las siguientes áreas: Gypsum Board, soldadura, construcción, albañilería, seguridad...&nbsp;",[],[],2025-05-16T00:00:00.0000000,https://jooble.org/away/-6372556668160973110,,[],2025-06-11
a35449394b8b274fb6262a489f0bf5b8,jooble,Técnico de Mantenimiento,COSVI,Puerto Rico,"&nbsp;...servicio de los clientes internos y externos. Realizar tareas de reparaciones livianas de las facilidades y equipos. Suplir los <b>materiales </b>de las áreas comunes. Realizar trabajos de mudanza de equipos y materiales. 
 Requisitos: 
~ Diploma de Escuela Superior, ademá...&nbsp;",[],[],2025-05-22T00:00:00.0000000,https://jooble.org/away/7558716998123485045,,[],2025-06-11
cf7cbc345d38be25aa49b40d53cd06f0,jooble,Técnico de Almacén,Mate LLC,Puerto Rico,"&nbsp;...ía. 
 Garantiza la organización del almacén por artículo. 
 Se comunica, coordina o monitorea las entregas. 
 Inspecciona los <b>materiales </b>utilizados para el montaje de un evento y se asegura que regresaron sin daños o desperfectos. Documenta si sufrieron daños y canaliza...&nbsp;",[],[],2025-05-20T00:00:00.0000000,https://jooble.org/away/1398246546933785742,,[],2025-06-11
2bcc8d867f5fc8db01dd3bdb6eb24c9f,jooble,Director of General Education,NUC University,Puerto Rico,"&nbsp;...reuniones altamente relacionadas al programa académico bajo su liderato. Asesora al Decano sobre la adecuacidad de los equipos, <b>materiales,</b> libros y colección bibliográfica de su programa académico. 
 Acreditaciones: Colabora en los procesos de acreditación y otros proyectos...&nbsp;",[],[],2025-05-29T00:00:00.0000000,https://jooble.org/away/7330906122712832109,,[],2025-06-11
ce4a35c0ad478e248b79dbb736c97a3c,jooble,MV01-060325 QA Technician I,Validation & Engineering Group,Puerto Rico,"&nbsp;...cedulación del tiempo de retención establecido para los procedimientos haciendo uso de los requisitos de seguridad de desperdicios de <b>materiales </b>biológicos potencialmente dañinos. 
 Documentar las inspecciones describiendo lo observado en un informe escrito de a cuerdo a...&nbsp;",[],[],2025-06-03T00:00:00.0000000,https://jooble.org/away/1321977027360904522,,[],2025-06-11
d5a79c6f9ad611b970c68ee5f0a39cc6,jooble,Instaladores de Tuberas (Pipefitter),Bermudez Longo Diaz-Masso LLC,Puerto Rico,"&nbsp;...Esta posicin es responsable de instalar, ensamblar, alterar y reparar tuberas o sistemas de tuberas de diferentes tamaos y <b>materiales,</b> que transportan agua, vapor, aire u otros lquidos o gases en proyecto de soldadura para tuberas de utilidades en farmacutica....&nbsp;",[],[],2025-06-03T00:00:00.0000000,https://jooble.org/away/-9182755061762678479,,[],2025-06-11
2737f7efae431097ac0ccb753ac6c004,jooble,Operador/a De Maquinas,Aerotek,"Leesburg, FL","&nbsp;...solución de problemas y cambios de formato. 
 Limpiar y desinfectar el equipo antes y después de su uso. 
 Cargar y descargar <b>materiales,</b> así como preparar la maquinaria. 
 Realizar inspecciones visuales y con herramientas para asegurar la calidad del producto....&nbsp;",[],[],2025-06-06T00:00:00.0000000,https://jooble.org/away/3804823005316444210,,[],2025-06-11
f663673c5542eeb9fb6a9daa178c064d,jooble,Cocinero & Empleado General,Caminito,Puerto Rico,"&nbsp;...una variedad de condiciones ambientales que requieren una fuerza de moderada a mxima, como levantar objetos, caminar y manipular <b>materiales.</b> 
 Diplomacia- Empata y cortesa en el trato con los clientes y compaeros de trabajo. 
 Imagen- Pulcra y discreta (buenos hbitos...&nbsp;",[],[],2025-05-15T00:00:00.0000000,https://jooble.org/away/4790934283431105932,,[],2025-06-11
7729009c1308a0ce334ef7cfa622b307,jooble,Instructor(a) de Handyman,NUC University,Puerto Rico,"&nbsp;...Bachillerato en Educación Industrial o Diploma de cuarto año y certificaciones de: patronos por empleos, empresas de ventas de equipos, <b>materiales </b>o herramientas, cursos de educación continua en las siguientes áreas: “Gypsum Board” o Soldadura, construcción y albañilería....&nbsp;",[],[],2025-05-13T00:00:00.0000000,https://jooble.org/away/-2170435339947908022,,[],2025-06-11
dbe4a9b09581d117c9be12ab9bde7044,jooble,Field Service Technician (Plomero),H & H Solar LLC,Puerto Rico,"&nbsp;...manejo efectivo del tiempo 
 Autonomía y responsabilidad 
 Resolución de problemas técnicos 
 Ética en el manejo de equipos y <b>materiales </b>
 Excelentes habilidades de comunicación y servicio 
 Demandas Físicas 
 Capacidad para levantar y mover equipos que pueden pesar...&nbsp;",[],[],2025-05-27T00:00:00.0000000,https://jooble.org/away/-2496681050743551819,,[],2025-06-11
1de1dfc57b414de10684f4ed1ea31c15,jooble,Oficial de Telemercadeo - Arecibo,NUC University,Puerto Rico,"&nbsp;...de toda información de prospectos de acuerdo al procedimiento establecido. 
 Mantener al día y en orden su equipo asignado y los <b>materiales </b>de promoción necesarios para cubrir las actividades que le sean asignadas. 
 Complementar TODA la información que se solicita en...&nbsp;",[],[],2025-05-23T00:00:00.0000000,https://jooble.org/away/7229305656403346144,,[],2025-06-11
76167fc8b60cb4e67997295a7c0ede6d,jooble,Cocinero/Parrillero Rio Bayamon,La Parrilla Argentina,Puerto Rico,"&nbsp;...una variedad de condiciones ambientales que requieren una fuerza de moderada a mxima, como levantar objetos, caminar y manipular <b>materiales.</b> 
 Rapidez y eficiencia- Capacidad para trabajar en un entorno de ritmo rpido y mantener la calma bajo presin, realizando su trabajo...&nbsp;",[],[],2025-05-24T00:00:00.0000000,https://jooble.org/away/6473742625475249766,,[],2025-06-11
a10e7f83c0b491b55a399d682034ddfd,jooble,Parts Representative,F40 LLC,Puerto Rico,"&nbsp;...realizar estimados de piezas a los clientes. Debe mantener el control y buen manejo del inventario. Responsable del despacho de <b>materiales </b>y piezas a clientes. 
 Requisitos 
 Grado Escolar-Cuarto Año/Equivalencia o Grado asociado en general 
 Conocimiento en piezas...&nbsp;",[],[],2025-06-04T00:00:00.0000000,https://jooble.org/away/6593681581162325799,,[],2025-06-11
f767909808cfb804f605e1e117bd91d4,jooble,TUTOR DE MATEMATICAS,Universidad Politecnica de Puerto Rico,Puerto Rico,"&nbsp;...matemáticas y otras materias de ingeniería, según corresponda a su plaza. Estará encargado(a) de preparar informes alusivos a su posición. Preparará <b>materiales </b>educativos para utilizarse de forma presencial o en la modalidad en línea. Participar en adiestramientos....&nbsp;",[],[],2025-05-18T00:00:00.0000000,https://jooble.org/away/8521968081708375527,,[],2025-06-11
de064f5f1f6ed83d0da78c8e18a01978,jooble,ADMINISTRADOR/A,ExecutiveHome Search and Realty Services Inc,Puerto Rico,&nbsp;...transferencias y aumentos de renta del proyecto. Realizar inspecciones de mantenimiento preventivas y anuales. Gestionar las requisiciones de <b>materiales </b>y equipos necesarios para la operación del proyecto. Revisar las áreas comunales y los servicios necesarios para mantener...&nbsp;,[],[],2024-07-01T00:00:00.0000000,https://jooble.org/away/-9172959164764180901,,[],2025-06-11
5a343448d9af56127f89bfd11cf04a1c,jooble,Mantenimiento,F40 LLC,Puerto Rico,&nbsp;...almacenamiento y superficies de trabajo que estén ordenadas y organizadas. Colaborar en la disposición adecuada de mobiliario y <b>materiales </b>para facilitar la limpieza y el flujo de trabajo. Evitar los cambios de ubicación o la reorganización frecuente de los materiales...&nbsp;,[],[],2024-12-07T00:00:00.0000000,https://jooble.org/away/8765699340854874560,,[],2025-06-11
2148656ef20e3ae6842d6bd883bbded3,jooble,Líder de Operaciones de Almacén,NFI,"Tracy, CA","&nbsp;...productos.

Dirige las asignaciones de trabajo a los empleados.

Brinda apoyo práctico diario en las responsabilidades de manejo de <b>materiales </b>y montacargas.

Impulsa el cumplimiento de los objetivos de seguridad, calidad y productividad en apoyo de los objetivos del...&nbsp;",[],[],2025-06-11T00:00:00.0000000,https://jooble.org/jdp/2549293745962097991,,[],2025-06-11
813c498cf9dadae7b2f2798b7fbde059,jooble,Pasantía en Contenido de Productos,Gao Tek Inc,"New York, NY","&nbsp;...calidad y requisitos normativos.

Agregar precios y detalles relevantes a los productos para mejorar la información del producto y los <b>materiales </b>de marketing.

Requisitos:

Estás estudiando o tienes un título universitario en Ingeniería, Computación, Ciencias o algún campo...&nbsp;",[],[],2025-06-10T00:00:00.0000000,https://jooble.org/jdp/49343563349732341,,[],2025-06-11
f0d8b595a5bf931cab5ff753d1a3b8a7,jooble,Jefe de Operaciones (Ciudad de Córdoba),Acento Recursos Humanos,"San Diego, CA","&nbsp;...Responsabilidades:
Brindar un servicio de entrega al cliente de excelencia.
Planificar el programa de compras de insumos, servicios, <b>materiales,</b> maquinarias, etc., para la empresa con la mayor eficacia y economía, cumpliendo los criterios definidos por el directorio....&nbsp;",[],[],2025-06-09T00:00:00.0000000,https://jooble.org/jdp/2560519072469005479,,[],2025-06-11
306e8d2362061413746e4f47995a4027,jooble,Forklift Operator Waitlist,Connect Staffing,"Stanton, CA","&nbsp;...Beneficios de Cal-Savers 
 Programa de referencias 

 Las responsabilidades pueden incluir: 
 Levantar, transportar y mover <b>materiales,</b> productos o equipos. 
 Preparar productos para su envío, lo que puede incluir empaquetado, etiquetado y paletizado. 
 Cargar y...&nbsp;",[],[],2025-05-31T00:00:00.0000000,https://jooble.org/away/-743613293256333012,,[],2025-06-11
eef049939ab05fc032463ce3318809e0,jooble,General Construction Laborer,Blueprint Skilled Services,"Johnstown, CO","&nbsp;...experience and knowledge, safety trained in PPE use and minded. 
(Experiencia Privilegiado:)
( Experiencia en carga y descarga de <b>materiales </b>de construcción, demolición, nivelación, eliminación de materiales de construcción del lugar de trabajo, experiencia y...&nbsp;",[],[],2025-05-31T00:00:00.0000000,https://jooble.org/away/6821283569223518035,,[],2025-06-11
0187148fba406cfe5d9a11c9824140bb,jooble,Heavy Equipment Operator,The Walsh Group,"Atlanta, GA","&nbsp;...limitan a:

Opera una variedad de equipos para completar tareas tales como limpiar terrenos, podar relleno y mover y/o transportar <b>materiales </b>tales como tierra, rocas y otros tipos de agregados.

Debe tener conocimiento de los procedimientos operativos relacionados con...&nbsp;",[],[],2025-06-10T00:00:00.0000000,https://jooble.org/jdp/4650957010205717945,,[],2025-06-11
07fc0a620983152d7c16e63797379300,jooble,Procurement Junior Specialis,Ambar Construction Technologies LLC,"Miami, FL","&nbsp;...adquisiciones para unirse a nuestro equipo. El ideal será bilingüe (inglés y español) y tendrá conocimientos en la adquisición de <b>materiales </b>de construcción, especialmente materiales mecánicos, eléctricos, de plomería (MEP) , paneles de yeso y estructuras.

Requisitos:...&nbsp;",[],[],2025-06-09T00:00:00.0000000,https://jooble.org/jdp/-8157102158910263470,,[],2025-06-11
25afd28fbb1d4355c1c77de0b0c59f93,jooble,Representante de Ventas Interno,QXO,"Glenolden, PA","&nbsp;...cliente 
 Lo que traerás:: 
 Experiencia previa en ventas y atención directa al cliente 
 Contar con experiencia en el sector de <b>materiales </b>de construcción es una ventaja 
 Tener dominio bilingüe de español es una ventaja 
 Capacidad para comunicarse y mantener la...&nbsp;",[],[],2025-06-11T00:00:00.0000000,https://jooble.org/jdp/-4805526435891344781,,[],2025-06-11
3c2facc185aa09ae9b1f491dec7d537f,jooble,Fitter/Fabricator,JGM,"Reading, PA","&nbsp;...carbono aire, las amoladoras, los sopletes de corte, y los tractores de soldadura, con competencia. 
 Precaliente y prepare los <b>materiales </b>segn sea necesario para cumplir con los estndares de soldadura y fabricacin. 
 Utilice gras areas, montacargas y otros equipos para...&nbsp;",[],[],2025-06-02T00:00:00.0000000,https://jooble.org/away/8162552767523660322,,[],2025-06-11
7abcd15a0fccb1fe0ecd2998b6309f68,jooble,Asociadoes de Produccion,LM Manufacturing,"Detroit, MI","&nbsp;...esfuerzos de mejora continua 
 Cumplir con todas las políticas y procedimientos 
 Inspeccionar equipos, herramientas, estructuras o <b>materiales </b>para identificar necesidades de reparación u otros defectos. 
 La capacidad de rotar y lograr todas las tareas asociadas a las...&nbsp;",[],[],2025-05-28T00:00:00.0000000,https://jooble.org/away/-409214606255455244,,[],2025-06-11
335e947ac3b67fdaf20522879644857f,jooble,Dispatch and Warehouse Associate,IMMERSIVE SCENIC STUDIOS LLC,"Orlando, FL","&nbsp;...sustitucin o reparacin de suelos en las zonas de almacn, segn sea necesario. 
 Ayudar al jefe de almacn a recoger, preparar y enviar <b>materiales </b>para diversos proyectos. 
 Conducir ocasionalmente un camin de caja para recoger o entregar materiales y herramientas en funcin...&nbsp;",[],[],2025-05-29T00:00:00.0000000,https://jooble.org/away/2844728289671774455,,[],2025-06-11
8524f34206e6c4a0d50f632788e17082,jooble,Laborer & Material Handler,"Excel Cabinets, Inc","Corona, CA","&nbsp;...mitigating evidence, or challenge the accuracy of the background report. 
 

 ESPAÑOL (Ingles arriba)
 Obrero y Manipulador de <b>Materiales </b>Factoría 
 Los manipuladores de mano de obra y materiales suelen recibir entrenamiento cruzada y ser rotados dentro de la fá...&nbsp;",[],[],2025-05-29T00:00:00.0000000,https://jooble.org/away/2969452459801506390,,[],2025-06-11
f3da2ee7c91bdd66db3e9b70e6641c73,jooble,Drywall Carrier Delivery,Builders FirstSource,"East Hartford, CT","&nbsp;...y descargarlos con ayuda de una carretilla mecnica o montacargas utilizando su conocimiento sobre cargas para garantizar que los <b>materiales </b>se transporten de forma segura. Requisitos: ttulo secundario o ttulo de educacin general (GED, por sus siglas en ingls) o experiencia...&nbsp;",[],[],2025-06-08T00:00:00.0000000,https://jooble.org/jdp/6812172080573149823,,[],2025-06-11
61beb3a2ccba2056b47d0d987b992ceb,jooble,Ejecutivo de Calidad,Çimsa Çimento Sanayi ve Ticaret,"Houston, TX","&nbsp;...análisis de residuos y colaborar con otros departamentos.
Liderar proyectos de materias primas y sostenibilidad, evaluando nuevos <b>materiales </b>y combustibles.
Planificar e informar sobre el rendimiento de los aditivos químicos en la producción de cemento.
Aplicar...&nbsp;",[],[],2025-06-11T00:00:00.0000000,https://jooble.org/jdp/970288134856744483,,[],2025-06-11
7a069dc7a336df5f433c5b77f91c45a6,jooble,Welder,BLY CON,"Missouri City, TX","&nbsp;...prolongados mientras realiza tareas.
Trabajar en un entorno de ritmo rpido para cumplir con los requisitos de produccin.
Preparar <b>materiales </b>para soldadura y fabricacin.
Trabajar en un entorno de taller (es Texas... as que hace calor y hmedo).
Una mentalidad creativa es...&nbsp;",[],[],2025-06-08T00:00:00.0000000,https://jooble.org/jdp/-7601088057817969538,,[],2025-06-11
5fe37674c61468aab8d6e2d04552f021,jooble,Roofer,The Walsh Group,"Rapid City, SD","&nbsp;...de instalar, reparar y mantener diversos tipos de sistemas de techado, incluyendo tejas asflticas, tejas, metal, caucho y otros <b>materiales.</b> El candidato ideal debe tener una slida tica de trabajo, conocimiento de las tcnicas de techado y un compromiso con la seguridad...&nbsp;",[],[],2025-06-10T00:00:00.0000000,https://jooble.org/jdp/8408205743333491228,,[],2025-06-11
2de24423561335e38028b679f79bc5d0,jooble,Tcnico/a de Postventa,proffetional,North Carolina,"&nbsp;...aos. 
 Cuentas con  disponibilidad para viajar y reubicarte  a diferentes ubicaciones geogrficas. 
 Posees  conocimientos  sobre <b>materiales </b>y procesos de construccin. 
 Tienes conocimientos en  Autocad y/o Project  y manejo intermedio de paquete  Office  . 
 Eres una...&nbsp;",[],[],2025-05-26T00:00:00.0000000,https://jooble.org/away/-3383647658766305278,,[],2025-06-11
4aa9e7ba09868b283fb7133791eefc97,jooble,REPRESENTANTE EN VENTAS,Sunwave Energy Llc,"Tampa, FL","&nbsp;...Oportunidad de crecimiento profesional  en una industria en auge. 
 Horarios flexibles  para que organices tu da. 
 Apoyo constante  : <b>materiales </b>de marketing y equipo profesional a tu disposicin. 
 Qu buscamos en ti?

 Experiencia en ventas (deseable, pero no...&nbsp;",[],[],2025-05-27T00:00:00.0000000,https://jooble.org/away/-1070243013851130842,,[],2025-06-11
d68531db22995d377a6661c3aeb42298,jooble,Commercial Management Coordinator,AppleOne,Puerto Rico,"&nbsp;...reuniones para su supervisor. 
• Canaliza, transmite y ofrece seguimiento a los casos referidos. 
• Mantiene un inventario de los <b>materiales </b>de oficina. 
• Digitaliza y/o fotocopia diversos documentos y encuaderna los mismos. 
• Realiza trabajos relacionados al...&nbsp;",[],[],2025-06-09T00:00:00.0000000,https://jooble.org/away/-6844609435988231839,,[],2025-06-11
b7706a88b8c90ee94b82020ca17c7b59,jooble,Operador de almacen,Kelly Services,Puerto Rico,"&nbsp;...oportunidad. 
\n 
\n  Salario/Tasa de Pago/Compensación: 
\n$15.66
\n 
\n  Por qué deberías postularte para ser un Manipulador de <b>Materiales:</b> 
\n• Únete a una empresa farmacéutica líder con un fuerte compromiso con la seguridad y el cumplimiento. 
\n• Trabaja en un...&nbsp;",[],[],2025-06-03T00:00:00.0000000,https://jooble.org/away/-2675560791034163086,,[],2025-06-11
