job_id,source,job_title,company,location,description,skills,careers_required,date_posted,url,career_tag,soft_skills_detected,extraction_date
7983f1f83881437a22993c2c33bab89a,jooble,Quality Auditor,Copeland,Pennsylvania,"&nbsp;...Contencin de material no conforme 
 Liberacin de Material de empaque 
 Inspeccin de materia prima contra dibujo y billete de <b>materiales </b>
 Inspeccin de la herramienta en piso 
 Retorno de material 
 Auditorias de producto 
 Realizacin de graficas de fallas elctricas...&nbsp;",[],[],2025-06-07T00:00:00.0000000,https://jooble.org/jdp/-3084011140011637655,,[],2025-06-11
5bdbb79456d6686d8de1b508bc436cf6,jooble,Health Safety and Environmental Manager,Orbia group,"Aspen, CO","&nbsp;...gira alrededor de temas que definen cómo la gente vivirá y prosperará mañana: el futuro de las ciudades, edificios, agricultura y <b>materiales.</b> Orbia Advance Corporation cuenta con cinco grupos de negocio que ofrecen soluciones innovadoras a lo largo de múltiples...&nbsp;",[],[],2025-06-09T00:00:00.0000000,https://jooble.org/jdp/8043727649894576930,,[],2025-06-11
a190ac044aaa2218502c4c11a115e42c,jooble,Production Assembler,Belcan,"Fort Worth, TX","&nbsp;...Montar/probar según los estándares del cliente y/o de la industria

Realizar retoques o pintura de superficie completa de piezas con <b>materiales </b>de acabado como pintura, laca, esmalte, etc.

Mezclar pintura y limpiar piezas.

Participa activamente en iniciativas lean...&nbsp;",[],[],2025-06-07T00:00:00.0000000,https://jooble.org/jdp/7464795347198966955,,[],2025-06-11
6b9c4d16d54b0e26e2a3d1afcb689a2a,jooble,Project Engineer,MH Civil Constructors Inc,"Amarillo, TX","&nbsp;...del proyecto asignado.

Colabora con el personal del proyecto para crear un plan de acción estratégico y estimaciones de costos de <b>materiales,</b> tiempo, mano de obra y otros recursos necesarios para completar el proyecto.

Facilita y contribuye al desarrollo de planes y...&nbsp;",[],[],2025-06-08T00:00:00.0000000,https://jooble.org/jdp/6106226759891142308,,[],2025-06-11
5c9c092b9e1cba0d37572e789c018152,jooble,Marketing Coordinator,BMA Group,"Miramar, FL","&nbsp;...creación de contenido para redes sociales, campañas de email marketing y otros canales digitales.

• Asistir en la elaboración de <b>materiales </b>de marketing como folletos, presentaciones y publicaciones de vacantes.

• Coordinar la publicación de ofertas laborales en...&nbsp;",[],[],2025-06-08T00:00:00.0000000,https://jooble.org/jdp/5674043699689601740,,[],2025-06-11
027ed4866b3c8700009795c3c0186752,jooble,Forklift Operator,NFI Industries,"Winchester, VA","Resumen:
El operador del montacargas es responsable de operar el equipo de manejo de <b>materiales </b>con el fin de mover, ubicar, reubicar, apilar y contar la mercancía. El Operador es responsable de la operación segura y eficiente del montacargas y también se le puede solicitar...&nbsp;",[],[],2025-06-02T00:00:00.0000000,https://jooble.org/jdp/4423079106134870967,,[],2025-06-11
df96f7695f19471509f7f26111abc571,jooble,Experienced Cabinet Installer Journeyperson,"Excel Cabinets, Inc","Corona, CA","&nbsp;...Requisitos físicos:  levantar, empujar, tirar y transportar hasta 80 libras; subir escaleras cargando entre 40 y 60 libras; transportar <b>materiales </b>a múltiples pisos y distancias; operar herramientas de sierra, manuales y neumáticas; utilizar la visión cercana y del color;...&nbsp;",[],[],2025-06-04T00:00:00.0000000,https://jooble.org/away/-6884513463332604662,,[],2025-06-11
3c43a6afcf764d783e79fc27d18342cd,jooble,Aplicacion para de Capataz,Ezetop LLC,"Milan, TN","&nbsp;...del trabajo (Slack).
Control de Calidad.
Gestión del Tiempo para los equipos.
Entrada de Datos de Tarjetas de Crédito.
Gestión de <b>materiales </b>necesarios.
Gestión de requisitos de mano de obra.
Gestión de necesidades de alquiler de equipos.
Asistir a reuniones en el lugar...&nbsp;",[],[],2025-06-08T00:00:00.0000000,https://jooble.org/jdp/6669457312688803264,,[],2025-06-11
d207792b578754ca807aa168fd0ec0db,jooble,Líder de Operaciones de Almacén,NFI,"Smyrna, TN","&nbsp;...productos.
Dirige las asignaciones de trabajo a los empleados.
Brinda apoyo práctico diario en las responsabilidades de manejo de <b>materiales </b>y montacargas.
Impulsa el cumplimiento de los objetivos de seguridad, calidad y productividad en apoyo de los objetivos del...&nbsp;",[],[],2025-06-08T00:00:00.0000000,https://jooble.org/jdp/-3243273849047296762,,[],2025-06-11
7a40dea98efea10967421b66e2194a0a,jooble,Ensamblador de Manufactura,BRIMAR INDUSTRIES INC,"Garfield, NJ","&nbsp;...inventario, acelere los pedidos de suministros cuando los niveles de inventario sean bajos. 
 Minimizar los residuos conservando <b>materiales </b>y recursos. 
 Capacidad para manejar materiales frágiles. 
 Comuníquese de forma clara y eficiente con sus supervisores y compa...&nbsp;",[],[],2025-05-14T00:00:00.0000000,https://jooble.org/away/-3490951806272750004,,[],2025-06-11
2be230f02a300b3ba526492d75bfa967,jooble,Subcontratista de Pintura Residencial,CertaPro Painters of Cedar Rapids IA,"Kansas City, MO","&nbsp;...Identification Number) registrado 
 Tener  seguro de responsabilidad general mnimo de $2,000,000
 Experiencia en la gestin de  cuadrillas, <b>materiales,</b> equipos y cronogramas de trabajo 
 Fuertes habilidades de liderazgo y comunicacin 
 Disposicin para mudarse temporal o...&nbsp;",[],[],2025-06-10T00:00:00.0000000,https://jooble.org/away/-1408011948453367954,,[],2025-06-11
9ca3390cdad1aae90c29bed3bceac26c,jooble,Warehouse Associate,Belcan,"Hauppauge, NY","&nbsp;...transportista o el plano.

Establecer las dimensiones y ubicaciones exactas de las piezas para su identificación.

Preparar las piezas o <b>materiales </b>para garantizar un manejo seguro para el envío, incluyendo la cumplimentación de la documentación y los registros de envío...&nbsp;",[],[],2025-06-08T00:00:00.0000000,https://jooble.org/jdp/-488196448977024170,,[],2025-06-11
44a687b3d412d723fcbdbbd88460f3c9,jooble,CDL Groundsperson,"SFM Services, Inc.","Miami, FL","&nbsp;...hasta 55 libras. 
 Debe poder trabajar en diversos entornos de jardinería, incluyendo contacto directo con diferentes plantas y <b>materiales </b>de jardinería, así como exposición a polvo y ruido. 
 Capacidad para trabajar al aire libre en todas las condiciones climáticas....&nbsp;",[],[],2025-06-11T00:00:00.0000000,https://jooble.org/jdp/-3048795212918754100,,[],2025-06-11
45587673f46f67934c7ee5665cd68644,jooble,Porteador/Mantenimiento a Tiempo Parcial,Culver's,"Shawano, WI","&nbsp;...organización 
~ Fiabilidad 
~ Ser capaz de subir y bajar una escalera a una altura de 25 pies. 
~ Barre, trapea y restriega con <b>materiales </b>de limpieza. 
~ Ser capaz de levantar y cargar con frecuencia hasta 75 libras. 
~ Capaz de trabajar de forma independiente. 
~...&nbsp;",[],[],2025-06-09T00:00:00.0000000,https://jooble.org/jdp/8386491389782337098,,[],2025-06-11
32cd268dfebd89cea6229152084496a7,jooble,SOCIAL INTEGRATION FACILITATOR,Boys & Girls Club,Puerto Rico,"&nbsp;...los participantes y equipos, y modifica las actividades según sea necesario. 
# Mantiene en excelentes condiciones los equipos, <b>materiales </b>y ambiente de trabajo de educación y recreación. 
# Dirige las actividades deportivas y educativas para mantener los estándares...&nbsp;",[],[],2025-05-24T00:00:00.0000000,https://jooble.org/away/7808706335484944168,,[],2025-06-11
fc92d00715bfb2716d7d889d67623b59,jooble,Obrero | Laborer,HEI Civil - Colorado,"Denver, CO","&nbsp;...Levantar cargas pesadas de hasta 70 libras. 
 Excavar pozos, zanjas y cimientos. 
 Retirar y desechar adecuadamente escombros y <b>materiales </b>de desecho. 
 Cargar y descargar suministros de camiones, ya sea manualmente o mediante el uso de equipo. 
 Realizar todas las...&nbsp;",[],[],2025-05-30T15:16:58.6070000,https://jooble.org/jdp/4207030161861073707,,[],2025-06-11
680ec6361c8f01f0efbc2714c6d3dc65,jooble,Obrero | Laborer,HEI Civil - Texas,"Austin, TX","&nbsp;...equipos y asegura el sitio de trabajo cada día para eliminar posibles peligros. 
 Realiza la manipulación y el almacenamiento de <b>materiales.</b> 
 Carga y descarga camiones y transporta y levanta materiales. 
 Asegura que se sigan los procedimientos adecuados de informes...&nbsp;",[],[],2025-05-30T15:12:54.1070000,https://jooble.org/jdp/1043883678789386526,,[],2025-06-11
097aa7c72c469526fb23a54683e79fec,jooble,Production Worker,Westlake Corporation,"Brookshire, TX","&nbsp;...elevadora para ayudar con las pausas y los cambios. 
 Samples  : Responsable de seleccionar, etiquetar y empaquetar los azulejos/<b>materiales </b>que se enviarn a los clientes. Debe estar familiarizado con el color y las mezclas de colores para poder seleccionar las muestras...&nbsp;",[],[],2025-06-07T00:00:00.0000000,https://jooble.org/jdp/-2163576555674529270,,[],2025-06-11
5a9e59f304e55723a7e1397a25681934,jooble,Laborer/Obrero,Royal Oaks Country Club,"Houston, TX","&nbsp;...maquinaria antes y después de cada uso
Informa de problemas de maquinaria/equipo al administrador de equipos
Carga y descarga los <b>materiales
</b>Recoge escombros en el campo de golf diariamente
Rellena pedazos de pasto extraído según las indicaciones
Excavar zanjas para...&nbsp;",[],[],2025-06-07T00:00:00.0000000,https://jooble.org/jdp/5788286921479380038,,[],2025-06-11
2f268106df7adf1ae7ca02814380eff3,jooble,Forklift Operator,Manpower Group Inc.,"Swedesboro, NJ","&nbsp;...de pie, sentado y transpaletas eléctricas requeridos.

Conocimiento de escáneres RF.

Conocimiento de varios equipos de manejo de <b>materiales </b>es un activo.

Competente en matemáticas.

Comprensión de las regulaciones de OSHA.

¿Qué hay para mí?

Oportunidad de trabajar...&nbsp;",[],[],2025-06-08T00:00:00.0000000,https://jooble.org/jdp/9220623785072698340,,[],2025-06-11
483d78bbc2fab251fd1f7804b92ef484,jooble,Operadores de Manufactura,5TH HQ,"Hollywood, FL","&nbsp;...y eficiente. 
 Clasificar, apilar y mover productos dentro del almacén o área de distribución. 
 Utilizar equipo de manejo de <b>materiales,</b> como carretillas elevadoras, transpaletas o montacargas, según sea necesario. 
 Mantener un entorno de trabajo limpio y organizado...&nbsp;",[],[],2025-05-15T00:00:00.0000000,https://jooble.org/away/-1275510802029974570,,[],2025-06-11
4247be61edfaefb6de876fde095f2079,jooble,POST SECONDARY ADVISOR,Boys & Girls Club,Puerto Rico,"&nbsp;...razones o hechos subyacentes de la información al desglosar la información o los datos en partes separadas. 
 Monitorear procesos, <b>materiales </b>o alrededores: monitorear y revisar información de materiales, eventos o el entorno, para detectar o evaluar problemas. 
 Guiar,...&nbsp;",[],[],2025-05-26T00:00:00.0000000,https://jooble.org/away/317052448905212617,,[],2025-06-11
0c6f35678d3337fc1965008ad042dbf3,jooble,Capataz de mantenimiento de jardines,Greenscape,"Durham, NC","&nbsp;...calidad al cliente. El capataz es responsable de cumplir con todas las horas del presupuesto y utilizar la cantidad correcta de <b>materiales </b>en los trabajos asignados, este puesto es responsable de toda la seguridad, el cuidado del equipo y el desempeño de los empleados...&nbsp;",[],[],2025-06-09T00:00:00.0000000,https://jooble.org/jdp/2302790108376460364,,[],2025-06-11
3b3d72d41744df4bbe0d84ff4d106a4c,jooble,Aplicación de Fabricación General,Jackson Furniture Ind.,"Cleveland, TN",&nbsp;...sillones y sillas.  Resumen de Funciones Laborales Esenciales: -Introducir materias en la maquinaria de producción.-Suministrar <b>materiales </b>a otros departamentos / miembros del equipo-Ensamblar muebles en líneas de producción-Utilizar herramientas para ensamblar / fabricar...&nbsp;,[],[],2025-05-23T00:00:00.0000000,https://jooble.org/away/3756922722824100994,,[],2025-06-11
7036ed3fdfba95c7bf4cb34c5d3fb396,jooble,Dozer Operator,The Walsh Group,"Decatur, GA","&nbsp;...limitan a:

Opera una hoja topadora para completar tareas como limpiar la tierra, recortar el relleno y mover y / o transportar <b>materiales </b>como tierra, rocas y otros tipos de agregados

Debe tener conocimiento de los procedimientos operativos relacionados con la carga...&nbsp;",[],[],2025-06-07T00:00:00.0000000,https://jooble.org/jdp/-5881386142585651242,,[],2025-06-11
7b35323ce6cad230894b91e2bb2305d1,jooble,Diseñador/a Gráfico/a,trabajito,"Santa Cruz, CA","&nbsp;...Organización, atención al detalle y rapidez. 
 Conocimientos en herramientas de IA aplicadas al diseño. 
 Funciones 
 Diseñar <b>materiales </b>gráficos (digitales e impresos). 
 Editar y animar contenido para redes sociales. 
 Incorporar herramientas de IA en procesos creativos...&nbsp;",[],[],2025-05-29T17:14:51.2013410+00:00,https://jooble.org/jdp/3623699384498004680,,[],2025-06-11
058f8298c872cef6e1558785f28d48ba,jooble,Room Attendant,Sage Hospitality,"Boulder, CO","&nbsp;...huésped que estén limpios e higiénicos.
Repone las toallas, los jabones y todas las amenidades de la habitación y reabastece los <b>materiales </b>impresos que el huésped anterior se llevó o que están manchados o rotos para asegurarse que hay un suministro adecuado para los siguientes...&nbsp;",[],[],2025-06-11T00:00:00.0000000,https://jooble.org/jdp/5887597745279894045,,[],2025-06-11
de8bed86aaa87e7dfb13d45cb06dc4dd,jooble,Ayudante de Cocina,Cidrines Ashford,Puerto Rico,"&nbsp;...variado, cambiante y exigente. 
 Este puesto no está expuesto a áreas confinadas ni a condiciones ambientales adversas, tampoco a <b>materiales </b>o productos peligros. 
 Este puesto utiliza instrumentos y equipo común de una barra o salón del restaurante. 

 Demandas Fí...&nbsp;",[],[],2025-05-21T00:00:00.0000000,https://jooble.org/away/-9085482660507744589,,[],2025-06-11
233ddfe0ddb3095d6cf7aebe26741c83,jooble,Materials Planner,Belcan,"North Hollywood, CA","&nbsp;...For more information, please visit our website at Belcan.com
EOE/F/M/Disability/Veterans

Título profesional: Planificador de <b>materiales</b>
Salario: $40- $45 / hora
Ubicación: North Hollywood, CA
Código de área: 213
Código Postal: 91605
Fecha de inicio: inmediatamente...&nbsp;",[],[],2025-05-27T10:44:16.9770000,https://jooble.org/jdp/6443316714402622596,,[],2025-06-11
8ad08b25d59893f616faad77d9afedb0,jooble,Ndt Technician,Belcan,"Simi Valley, CA","&nbsp;...destructivas para determinar la existencia de fallas, discontinuidades, fugas, contaminación, anomalías térmicas o imperfecciones en los <b>materiales,</b> componentes o ensamblajes de aeronaves sin afectar la integridad o función del componente inspeccionado. * Realiza actividades...&nbsp;",[],[],2025-05-27T10:44:17.4830000,https://jooble.org/jdp/2377720639394844342,,[],2025-06-11
43ec1f798549898d28deb6b57426c7f8,jooble,Trabajador de Línea de Producción,FreshLine Produce LLC,"Mahwah, NJ","&nbsp;...etiqueta de fecha correcta y esté empaquetado correctamente. 
# Mueva el producto y el inventario usando un gato de mano. 
# Reportar <b>materiales </b>defectuosos o condiciones cuestionables al supervisor del departamento 
# Mantener el área de trabajo y el equipo en condiciones...&nbsp;",[],[],2025-05-21T00:00:00.0000000,https://jooble.org/away/6960738574479234248,,[],2025-06-11
1dbabb931fc9231048fa8beda73852ee,jooble,Trabajo en concreto,Crookham Construction,"Tonganoxie, KS","&nbsp;...superficies utilizando herramientas manuales y equipos eléctricos. 
 Reforzar la Excelencia: Ayudar a instalar barras de refuerzo y otros <b>materiales </b>de refuerzo según las especificaciones del proyecto. 
 Seguridad Primero: Seguir los protocolos y directrices de seguridad,...&nbsp;",[],[],2025-05-13T00:00:00.0000000,https://jooble.org/away/8926779716401549929,,[],2025-06-11
df9acff3c18eb59d5dcd7ba77e3480ed,jooble,Clerk Manufacturing,Hubbell,"New Germany, MN","&nbsp;...matemática tales como: suma, resta, multiplicación y división de números enteros.
Experiencia previa, en funciones de manejo de <b>materiales </b>y entrada de datos, preferible.
Conocimiento y experiencia práctica en el uso de sistemas computadorizados tales como: Windows®,...&nbsp;",[],[],2025-06-08T00:00:00.0000000,https://jooble.org/jdp/6293176601016660401,,[],2025-06-11
e959b5e92f8fefa041508d290a6ed895,jooble,Gerente de Proyectos - Proyectos Nacionales,Loeb Electric,"Columbus, OH","&nbsp;...establecer el alcance del proyecto. 
 Coordina con los clientes internos, tales como: compras, logística, equipo de proyectos de <b>materiales,</b> envíos y contratistas durante todo el proyecto, para proporcionar pronósticos de materiales de manera proactiva, establecer...&nbsp;",[],[],2025-05-22T00:00:00.0000000,https://jooble.org/away/-7876818077743201830,,[],2025-06-11
88a3a11831d12d052d0c62555b409d62,jooble,Administrador de Apoyo a Proyectos,Loeb Electric,"Columbus, OH","&nbsp;...requisitos del cliente. 
 Ayudar en la organización y compilación de la información de la oferta relacionada con la iluminación y los <b>materiales </b>eléctricos. 
 Apoyar los esfuerzos de recopilación de datos para cumplir con las expectativas de los clientes, ayudando con la...&nbsp;",[],[],2025-05-22T00:00:00.0000000,https://jooble.org/away/3789691746857951246,,[],2025-06-11
80a17441730658e7c9f5a5b3beea773f,jooble,HVAC conducto de trabajo Fabricator,Sistemas Mecánicos,"Memphis, TN","&nbsp;...de HVAC y te gusta trabajar en el mismo lugar, ¡nos gustaría saber de ti!
 Función principal del puesto:  Fabricar y ensamblar <b>materiales </b>para conductos de HVAC, medir materiales para la fabricación de conductos y cortar, doblar y enrollar chapas metálicas. Operar las...&nbsp;",[],[],2025-06-08T00:00:00.0000000,https://jooble.org/away/1224058214336006719,,[],2025-06-11
a98896388d5f5d394ac80074dbbc6a03,jooble,"Laborer, Albañileria - Roaring Fork Valley",Gallegos Corporation,"Rifle, CO","&nbsp;...ladrillo, bloque o piedra. 
 Limpiar, organizer y mantener todas las herramientas y equipos en los sitios de trabajo. 
 Stocks <b>materiales </b>para albaniles. 
 Participa en reunions diarias y practica la seguridad como una prioridad en todos los sitios de trabajo. 
 Modela...&nbsp;",[],[],2025-06-04T00:00:00.0000000,https://jooble.org/away/2922176822670468490,,[],2025-06-11
bf862cf3f4a507d6c44913a386b633af,jooble,Aprendiz Universitario de Diseño Gráfico,WSP Global Inc.,"Denver, CO","&nbsp;...atractivo y efectivo que contribuya a la comunicación interna y externa de la organización.
Asistir en la creación y edición de <b>materiales </b>gráficos para documentos organizacionales, boletines internos y comunicados.
Colaborar en la conceptualización y desarrollo de proyectos...&nbsp;",[],[],2025-06-07T00:00:00.0000000,https://jooble.org/jdp/5833116628642843532,,[],2025-06-11
a442391e60cc2838887c0dec826212c6,jooble,Carpintero de Formas,Garney Construction,"Jacksonville, FL","&nbsp;...experimentado que se enorgullece de su trabajo y busca precisión y eficiencia. Construirá, instala  rá y reparará estructuras hechas de <b>materiales </b>que incluyen, madera, acero y concreto. 
 REQUISITOS 
 
 Como Carpintero de Formas, construirá una variedad de estructuras y...&nbsp;",[],[],2025-06-11T10:04:08.4500000,https://jooble.org/jdp/2975245279199954265,,[],2025-06-11
22e41778f002e92dd4f939d5f0a1609a,jooble,Ayudantes Bilingües de Ensamblaje,"AmeriTech Staffing, Inc.","Stafford, TX","&nbsp;...operaciones diarias de producción en un ambiente de trabajo dinámico y rápido. 
 
 RESPONSIBILITIES: 
· Ayudar con el ensamblaje de <b>materiales </b>y productos metálicos. 
· Operar herramientas manuales y equipo básico según sea necesario. 
· Comunicarse eficazmente con los...&nbsp;",[],[],2025-06-05T00:00:00.0000000,https://jooble.org/away/2261188457759124798,,[],2025-06-11
78430b54f2319c09dfa40919f4d63c10,jooble,Obrero | Laborer,HEI Civil - Carolinas,"Charlotte, NC","&nbsp;...de trabajo manual en proyectos de construcción de servicios subterráneos. 
 Cargar y esparcir tierra, concreto, asfalto y otros <b>materiales </b>de construcción. 
 Excavar y rellenar zanjas y fosas. 
 Mantener el área de trabajo limpia, recogiendo y organizando herramientas...&nbsp;",[],[],2025-05-30T15:17:23.3330000,https://jooble.org/jdp/2951103348972592392,,[],2025-06-11
e39f311a8466ab0e3b13b0a098b2a0d4,jooble,Operador de máquina,Rolling Tissue,"Opa Locka, FL","&nbsp;...nuestro equipo de última generación. 
 Visítanos en: 
 RESPONSABILIDADES 
 Preparar las máquinas y asegurarse de que todos los <b>materiales </b>de producción estén disponibles. 
 Operar y monitorear el equipo, realizar reinicios, reabastecer y resolver problemas en el á...&nbsp;",[],[],2025-06-08T00:00:00.0000000,https://jooble.org/away/-686421472420040741,,[],2025-06-11
0e5a57d33795eb26a2819c72643c3180,jooble,Trabajadores de produccion,5TH AVENUE RECRUTING LLC,"Fort Lauderdale, FL","&nbsp;...o llámenos al (***) ***-****
 Ubicación: Davie, Florida 
 Salario: $14- $16 hr 
***DESCRIPCIÓN DEL TRABAJO***
 Pesar o medir <b>materiales,</b> ingredientes o productos para garantizar la conformidad con los requisitos. 
 Mezzclar ingredientes compuestos, procesados o colorantes...&nbsp;",[],[],2025-06-10T00:00:00.0000000,https://jooble.org/away/-188682276764571457,,[],2025-06-11
b1b1c61fda3b2dce5682a229a8a36ea1,jooble,Aprendiz de Electricista,CROWN CAPITAL MGMT LLC,"Fort Myers, FL","&nbsp;...electricistas jornaleros y otros profesionales experimentados para apoyarlos en diversas tareas. Esto incluye llevar herramientas y <b>materiales,</b> realizar instalaciones eléctricas básicas y ayudar en actividades de mantenimiento y reparación bajo supervisión. 
• Seguridad...&nbsp;",[],[],2025-06-09T00:00:00.0000000,https://jooble.org/away/-3301075076042043839,,[],2025-06-11
db39b0c1b5758580e8a78074f9f810fb,jooble,Operador de Maquina- Primer Turno,Peninsula Plastics Company Inc,"Pontiac, MI","&nbsp;...Manejar maquinaria y equipos de acuerdo con las instrucciones y los procedimientos establecidos. 
 Cargar y descargar equipos y <b>materiales.</b> 
 Reportar problemas al supervisor y/o a los jefes de equipo. 
 Cumplir con todas las reglamentaciones de seguridad y salud....&nbsp;",[],[],2025-05-31T00:00:00.0000000,https://jooble.org/away/-369949569761851186,,[],2025-06-11
e1bf44baa8d3a63d16b8f6caab34630c,jooble,Enfermero/a,trabajito,"Santa Cruz, CA","&nbsp;...dicas. 
 Conocimiento de normativas de salud ocupacional y seguridad en el trabajo. 
 Capacidad para manejar equipos médicos y <b>materiales </b>de primeros auxilios. 
 Conocimiento básico de legislación en salud laboral y prevención de riesgos. 
 Buenas habilidades de comunicaci...&nbsp;",[],[],2025-05-14T17:17:19.0261825+00:00,https://jooble.org/jdp/1063261023230176417,,[],2025-06-11
54b24a6746ebea1399c3ad340e75194a,jooble,Commercial Cleaning Manager/Supervisor,Office Pride of Indianapolis-Carmel,"Carmel, IN","&nbsp;...operaciones diarias de limpieza 
 Delegar tareas y gestionar los horarios del personal 
 Administrar la adquisicin e inventario de <b>materiales </b>y equipos de limpieza para garantizar la eficiencia operativa 
 Realizar inspecciones regulares para mantener los estndares de...&nbsp;",[],[],2025-05-23T00:00:00.0000000,https://jooble.org/away/-8584729408296883359,,[],2025-06-11
9db5ea1d6e0c8d143fd74efd35372ee5,jooble,Costurero/a desde Casa URGENTE,AXL Advanced,"Wylie, TX","&nbsp;...independiente (opcin de 1099 o W9 Negocio a Negocio)
 Requisitos y Responsabilidades: 
 Capaz de ensamblar diferentes tipos de <b>materiales </b>textiles en un producto terminado usando mquinas de coser industriales de aguja nica. 
 Cumplir con los plazos, ser puntual para...&nbsp;",[],[],2025-05-27T00:00:00.0000000,https://jooble.org/away/8777072496855237210,,[],2025-06-11
3c4115ad028f4b336286d229ae65aa05,jooble,Machine Operator,Belcan,"Naples, FL","&nbsp;...de máquina (incluyendo piezas de reelaboración) como cortar, dar forma, desbarbar, formar, perforar y escariar piezas, donde los <b>materiales,</b> herramientas y secuencia de operaciones han sido planificados y establecidos previamente.
* Realiza los ajustes necesarios de la...&nbsp;",[],[],2025-05-22T16:45:25.6800000,https://jooble.org/jdp/8153059400375565104,,[],2025-06-11
93ea8c5aeb83a350acd8092882971bc2,jooble,Landscape Construction Team Lead,Refined Gardens,"Tempe, AZ","&nbsp;...del valle. 

 Responsabilidades 

 Supervisar las operaciones diarias del equipo de paisajismo. 
 Coordinar el equipo y los <b>materiales </b>necesarios para cada proyecto. 
 Supervisar y formar a los miembros de la cuadrilla en tcnicas de instalacin, funcionamiento del...&nbsp;",[],[],2025-05-20T00:00:00.0000000,https://jooble.org/away/3905205636542701563,,[],2025-06-11
a39926ddb2f34817b08ca4a614732281,jooble,Trabajadores Auxiliares de Construccin- MOCA,"Nexo Tecnico, Corp",Puerto Rico,"&nbsp;...manuales, elctricos y motorizadas. 
 Conducir vehculos de la compaa si es necesario. 
 Cargas y descargar equipos, herramientas y <b>materiales.</b> 
 Transportacin para llegar al lugar de trabajo a diario. 
 Debe ser capaz de levantar al menos 47 libras. 
 Cualificaciones...&nbsp;",[],[],2025-05-29T00:00:00.0000000,https://jooble.org/away/7118597309902846546,,[],2025-06-11
09f4cadcf9108e71f4ceb57419cc1560,jooble,Técnico de Producción y Montaje,Mate LLC,Puerto Rico,"&nbsp;...que se puedan cumplir todos los requisitos del evento del cliente y brinda opciones en caso de requerirlo. 
 Confecciona piezas, <b>materiales </b>de promoción y eventos según sea requerido. 
 Cualquier otra tarea que le asigne la gerencia. 

 REQUISITOS 

 Cuarto de año...&nbsp;",[],[],2025-05-30T00:00:00.0000000,https://jooble.org/away/2353498399531448595,,[],2025-06-11
