job_id,source,job_title,company,location,description,skills,careers_required,date_posted,url,career_tag,soft_skills_detected,extraction_date
44e531e299cf671359f9e04ad7c9650b,jooble,General Laborer | Obrero General,"Casey Construction Group, LLC","Cary, NC","&nbsp;...seguro 
 Ayudar a los mecnicos / acabados de paneles de yeso y tcnicos de nivelacin de pisos en el sitio 
 Manejar y transportar <b>materiales </b>y equipos 
 Siga las instrucciones de los supervisores para realizar tareas de trabajo manual 
 Reportar condiciones inseguras...&nbsp;",[],[],2025-06-04T00:00:00.0000000,https://jooble.org/away/-8222819563031071024,,[],2025-06-11
41a8a460944a9b15311cb95e43b525f3,jooble,Production Lead,"SIP Manufacturing, LLC","Lake Elsinore, CA","&nbsp;...Ayudar al supervisor a abordar los problemas diarios de producción, incluidas las necesidades de personal, la disponibilidad de <b>materiales </b>y el estado del equipo. 
• Asistir al Supervisor con el flujo de productos y la organización en la línea de producción. 
• Seguir...&nbsp;",[],[],2023-02-10T00:00:00.0000000,https://jooble.org/away/-8284636635201455022,,[],2025-06-11
31c935aa724ffdb9c2dd413934de5fa0,jooble,Landscape Crew Member / Acting Crew Lead,Mohar Brothers Landscaping,"Raleigh, NC","&nbsp;...mochila y otras herramientas de dos tiempos 
 Conducir camiones con remolques entre sitios de trabajo 
 Cargar y descargar equipos y <b>materiales </b>
 Limpiar sitios de trabajo y recoger escombros ligeros 
 Revisar el estado del césped y reportar problemas 
 Tomar el rol de...&nbsp;",[],[],2025-05-27T00:00:00.0000000,https://jooble.org/away/4844597794039957065,,[],2025-06-11
336089cf06f8b5607011fa6b751f75d9,jooble,Técnicos en Reparación de Electrodomésticos,Mr. Appliance,"Farmington, MN","&nbsp;...el cliente para asegurarse de que entienden los servicios necesarios. 
 · Ordenar repuestos y asegurar el uso eficiente de los <b>materiales </b>de la empresa. 
 · Cobrar el pago por el trabajo realizado. 

 Para tener éxito en este rol como técnico de reparación de electrodom...&nbsp;",[],[],2025-06-07T00:00:00.0000000,https://jooble.org/away/-3426467977268497881,,[],2025-06-11
ff178b7415e3dfb3ff224fb76e8a6fca,jooble,Labor,Joe Bland Construction LLC,"Austin, TX","&nbsp;...construcción. Como obrero, será responsable de ayudar con diversas tareas en el lugar de trabajo, que incluyen, entre otras, transportar <b>materiales,</b> cavar zanjas y operar maquinaria. Su objetivo principal será garantizar que el lugar de trabajo sea seguro, limpio y eficiente....&nbsp;",[],[],2024-10-06T00:00:00.0000000,https://jooble.org/away/-6149968834094790697,,[],2025-06-11
895e0d2a9311adf04cd313c8f080a4f1,jooble,Asociado de Almacén,Corporate Support & Fulfillment LLC,"Katy, TX","&nbsp;...requisitos del cliente. 
 Manejar equipos de almacén, como transpaletas o carretillas elevadoras (si están certificadas), para mover <b>materiales </b>de forma eficiente. 
 Mantener registros de inventario precisos mediante recuentos físicos y actualizaciones del sistema....&nbsp;",[],[],2025-05-12T00:00:00.0000000,https://jooble.org/away/-3248109771785520454,,[],2025-06-11
d7a027e3b5ef195d585b65dcd7695ce4,jooble,Gerente de Distrito,Teva Pharmaceutical Industries Ltd.,Delaware State,"&nbsp;...asegurando el cumplimiento de las buenas prácticas promocionales. 
•    Ejecución y manejo eficiente de los recursos financieros, <b>materiales </b>y recurso humano bajo su responsabilidad. 
•    Logro de ventas (sell out) de cada ruta bajo su gestión, contribuyendo con la...&nbsp;",[],[],2025-05-29T07:25:11.6913369+00:00,https://jooble.org/jdp/3378856575747792207,,[],2025-06-11
d9df58d0ab7f42bec7ef54850dad728f,jooble,Pasante de Marketing,trabajito,"Santa Cruz, CA","&nbsp;...canales, incluyendo redes sociales, correos electrónicos y eventos del sector. 
 Colaborar con el equipo de comercial para crear <b>materiales </b>promocionales y campañas dirigidas a segmentos específicos del mercado. 
 Gestión De Relaciones 
 Establecer y mantener...&nbsp;",[],[],2025-05-30T17:14:51.1838316+00:00,https://jooble.org/jdp/4365440045964226168,,[],2025-06-11
c8ff42bccf3bef7f059984d2a3df1d23,jooble,Clamp / Stand up / Stand Up Reach / EPJ Certified,It's Caliber,"Ontario, CA","&nbsp;...MONTACARGAS CROSSDOCK 4/10 3/12 para unirse a nuestro equipo! Su puesto se contrará en el movimiento seguridad y eficiente de productos y <b>materiales.</b> 
 Turno A (6:00 AM- 4:30 PM) de Martes a Viernes 
 Turno B (5:30 PM - 4:00 AM) Miércoles - Sábado 
 Turno C Domingo (6:00 AM...&nbsp;",[],[],2025-06-09T00:00:00.0000000,https://jooble.org/away/-2307523300553770760,,[],2025-06-11
3e52a997df29a112cade11dbc2ad70e1,jooble,Manager Warehouse and Shipping Operations,Belcan,"Vista, CA","&nbsp;...externos para las agencias reguladoras, según sea necesario.
* Mantiene y define, según las necesidades operativas, el flujo de <b>materiales,</b> las áreas de trabajo del almacén y coordina el mantenimiento de los equipos.

Requisitos:
* Se prefiere licenciatura o experiencia...&nbsp;",[],[],2025-06-11T14:08:21.7800785+00:00,https://jooble.org/jdp/7127230908307790470,,[],2025-06-11
68698dd9f60f24ad81fff2ab339cf1ef,jooble,Técnico de Aplicación de Césped,J.F.D. Landscapes Inc,"Chagrin Falls, Geauga County, OH","&nbsp;...cnico de Aplicación de Césped dedicado para unirse a nuestro equipo. En este puesto, operará equipos de cuidado del césped, aplicará <b>materiales </b>a jardines y jardines, y ayudará a mantener la calidad y la apariencia de las propiedades de nuestros clientes. Esta es una...&nbsp;",[],[],2025-06-11T15:24:00.0901901+00:00,https://jooble.org/jdp/3239193726678603547,,[],2025-06-11
197401583f9c213db9296384d7918ebc,jooble,Profesional de Ventas Bilingüe (Español),Karl Malone Plaza Cycle,"Salt Lake City, UT","&nbsp;...teléfono, mensaje de texto y correo electrónico 
 Ayudar a que los clientes estén informados mediante la preparación y envío de <b>materiales </b>promocionales antes de las citas programadas 
 Requisitos 
 Se prefiere experiencia previa en ventas minoristas o servicio al cliente...&nbsp;",[],[],2025-06-02T00:00:00.0000000,https://jooble.org/jdp/-9152622059181496274,,[],2025-06-11
aa96f121edd447d797a8b5fc54c3cbdc,jooble,Paletizador / Food Production Palletizer,Connect Staffing,"Los Alamitos, CA","&nbsp;...fabricación de galletas o productos de panadería. 
 Experiencia trabajando con maquinaria de paletizado y equipos de manipulación de <b>materiales.</b> 
 Capacidad para trabajar en un ambiente rápido y dinámico. 
 Conocimiento y cumplimiento de normas de seguridad alimentaria....&nbsp;",[],[],2025-05-17T00:00:00.0000000,https://jooble.org/away/-3595179709297476487,,[],2025-06-11
47cc8ebaa473e57684a1c4cb3741d8bc,jooble,Jefe de turno,Five Guys,"Lexington, KY","&nbsp;...ocasionalmente en condiciones cálidas 
 Temperaturas. También es probable que se produzca un levantamiento generalizado de suministros y <b>materiales </b>y una 
 a ruidos fuertes. Se requiere el uso de manos y brazos para alcanzar, agarrar y manipular objetos. 
 Es posible que se...&nbsp;",[],[],2025-05-08T00:00:00.0000000,https://jooble.org/jdp/5700971637622323522,,[],2025-06-11
f3ba7932ecbce0e861820e18b1fede33,jooble,Representante de Cuentas con Entrega de Productos,Rent-A-Center,"Ponce Inlet, FL","&nbsp;...guante blanco"" con corazón de servicio. Completar acuerdos de renta y buscar nuevos negocios mediante telemercadeo y distribución de <b>materiales </b>impresos.

Manejo de Cuentas: Revisar cuentas vencidas, comunicarse con clientes para promover pagos a tiempo, y cumplir con...&nbsp;",[],[],2025-06-11T00:00:00.0000000,https://jooble.org/jdp/4201398309060861552,,[],2025-06-11
cc68fa99e54e422c9cbfe43911f1fa84,jooble,Loader Operator - 2nd Shift (1st Posting),Forsman Farms / Nordsyn,"Maple Plain, Hennepin County, MN","&nbsp;...Supervise el funcionamiento del equipo y solucione los problemas de manera oportuna; Escale problemas más complejos si es necesario
<b>Materiales </b>de monitoreo; Asegúrese de que el material sucio se dirija a los robots de lavado
Trabaje en estrecha colaboración con los té...&nbsp;",[],[],2025-06-08T00:00:00.0000000,https://jooble.org/jdp/5941714738594651568,,[],2025-06-11
e7cb6da94022b627a89ed070a7f0a46b,jooble,Técnico de conserjería de tienda - Americana at Brand,H&M Group,"Glendale, CA","&nbsp;...problemas.
Este puesto se desarrolla en un entorno de tienda con exposición a ruidos fuertes, suciedad y polvo, olores, humos y <b>materiales </b>peligrosos.
Debe ser capaz de trabajar en un horario flexible, incluyendo noches y fines de semana.
Por qué te encantará trabajar...&nbsp;",[],[],2025-06-07T00:00:00.0000000,https://jooble.org/jdp/-1122174076323230279,,[],2025-06-11
8563142dbc1f9ee6b200583589b6df67,jooble,Field Supervisor,Universal Maintenance,"San Leandro, CA","&nbsp;...Proporcionar entrenamiento regularmente a todos los trabajadores para las normas de seguridad OSHA y correcto manejo de todos los <b>materiales </b>de limpieza 
~ Mantener todas las MSDS y documentación de seguridad actualizada en conjunto con el administrador de seguridad de...&nbsp;",[],[],2025-04-08T00:00:00.0000000,https://jooble.org/away/4051819687899270563,,[],2025-06-11
09ced30a6d082d4aa36108a182dbf03d,jooble,Noches de miembros de la tripulación,Little Caesars,"Cedar Springs, MI","&nbsp;...calidad de manera consistente siguiendo las recetas, especificaciones y procedimientos de Little Caesars como se describe en los <b>materiales </b>de C.A.R.D.S. y como se muestra en los ayudantes de trabajo de la estación. 
 Muestra la imagen adecuada como se describe en el...&nbsp;",[],[],2025-05-27T00:00:00.0000000,https://jooble.org/jdp/-7538001939349863606,,[],2025-06-11
e1649eb74ac776fc0edbbadaa6454cc8,jooble,Commercial Grounds Maintenance Crew Member (SPN),Bland Landscaping Company,"Apex, NC","&nbsp;...aspectos del manejo de reas verdes. 
•Cavar, plantar, rastrillar, regar y limpiar paisajes. 
•Cargar y descargar equipos pesados y <b>materiales </b>de plantacin de camiones. 
•Recoger el equipo y las herramientas de la empresa al final del da. 
•Puede ser solicitado para...&nbsp;",[],[],2025-06-09T00:00:00.0000000,https://jooble.org/jdp/-2356112902895522680,,[],2025-06-11
60fa84c8a39c3e590489399076db90ec,jooble,Liquor Store Associate FT,Fresco y Ms,"Miami, FL","&nbsp;...equipos de limpieza, equipo de oficina general, caja registradora, pistola de precios, bsculas, escner, diversos equipos de manejo de <b>materiales,</b> como estantes, carros, transpaletas, carritos de compras Equipo preferido: empacadora / compactadora, cortador de cajas...&nbsp;",[],[],2025-06-09T00:00:00.0000000,https://jooble.org/jdp/-1450821749854531432,,[],2025-06-11
144b754589db05ef3263fb07cc5d16c7,jooble,Gerente de Servicios de HVAC,Aire Serv,"Raleigh, NC","&nbsp;...coordinar el envío, la finalización del trabajo y la facturación, revise las tarjetas de tiempo, las facturas y los inventarios de <b>materiales,</b> realice recorridos técnicos e inspeccione vehículos y herramientas para garantizar el cumplimiento de los estándares y procesos...&nbsp;",[],[],2025-05-15T00:00:00.0000000,https://jooble.org/away/-465940113043975376,,[],2025-06-11
a91583c22868c9569ad271a0e40c868c,jooble,"Mantenimiento, Mejoría e Irrigación",Allied Landscape,California,"&nbsp;...equipo y ser servicial y cortés con los clientes. 
 Ayudar con la carga y descarga diaria de equipos eléctricos, herramientas, <b>materiales </b>y escombros de jardinería de los vehículos de la empresa. Mantener niveles adecuados de combustible, aceite y refrigerante del radiador...&nbsp;",[],[],2025-06-11T00:00:00.0000000,https://jooble.org/jdp/-7386790392890946062,,[],2025-06-11
35ce880f0861df3b1d0d27f376ccc2d2,jooble,Técnico de servicio,CROWN CAPITAL MGMT LLC,"Pompano Beach, FL","&nbsp;...harás: 
???? Asistir en reparaciones, instalaciones y recubrimientos de techos 
???? Cargar, descargar y preparar herramientas y <b>materiales </b>
???? Preparar, limpiar y mantener los sitios de trabajo y el equipo 
⚠️ Seguir todos los protocolos de seguridad y protección...&nbsp;",[],[],2025-04-29T00:00:00.0000000,https://jooble.org/away/795735026200985133,,[],2025-06-11
7cec34f4b22ee5094bee7d2f5a3a9bd7,jooble,Albail Diestro en Construccin,Ram Jack,"San Juan, TX","&nbsp;...manuales, elctricos y motorizadas. 
 Conducir vehculos de la compaa si es necesario. 
 Cargas y descargar equipos, herramientas y <b>materiales.</b> 
 Transportacin para llegar al lugar de trabajo a diario. 
 Debe ser capaz de levantar al menos 47 libras. 
 Cualificaciones...&nbsp;",[],[],2025-06-08T00:00:00.0000000,https://jooble.org/jdp/-4856246505436629504,,[],2025-06-11
f0edb52f7b769bff7485096569b8a06c,jooble,Gerente de Proyecto APRE,"Auberge Resorts, LLC","Lincoln, NE","&nbsp;...alcances y contratos firmados con la empresa constructora o parte ejecutora del proyecto.
Supervisa la calidad del proceso, el uso de <b>materiales </b>correctos.
Seguimiento puntual del cumplimiento de calendario de obra
Coordina entre la constructora, propietarios y la operadora...&nbsp;",[],[],2025-06-11T00:00:00.0000000,https://jooble.org/jdp/-3180742476506337274,,[],2025-06-11
147f9d51ee33df98c787c944ea3fa3e4,jooble,Supervisor (de habla Español),Envirovac,"Osceola, AR","&nbsp;...sobre el reconocimiento de remover todos los peligros en el lugar de trabajo. 
 Supervisa al personal de trabajo, los equipos, <b>materiales </b>y subcontratistas le fueron asignados para trabajar. 
 Asegura que el desempeño del trabajo sea planificado y coordinado conforme...&nbsp;",[],[],2025-06-06T00:00:00.0000000,https://jooble.org/away/6344596736898351452,,[],2025-06-11
5636e317fb0fef1a1133bb3d38b8868c,jooble,Warehouse/Forklift Operator/CDL Class A,Hood Distribution,"Apopka, FL","&nbsp;...equipo. Esta es una posición de turno en el dia, trabajando de lunes a viernes con algunos sábados. Realice el manejo general de <b>materiales,</b> recepción, recepción a granel y / o carga y descarga de camiones. Realizar actividades del centro de distribución. Se requiere experiencia...&nbsp;",[],[],2025-06-10T00:00:00.0000000,https://jooble.org/jdp/6756609948508997654,,[],2025-06-11
06c05e312fa73aec2002bc6a31cc656f,jooble,Seasonal Maintenance Mechanic - La Crema Winery,Jackson Family Wines,"Windsor, CA","&nbsp;...mantenimiento predictivo en equipos de bodega. 
 Realizar mantenimiento correctivo en equipos de bodega. 
 Ayudar en el traslado de <b>materiales </b>y equipos segn sea necesario. 
 Operar un montacargas. 
 Asegurar el cumplimiento de las normas de seguridad conforme a los...&nbsp;",[],[],2025-06-09T00:00:00.0000000,https://jooble.org/jdp/-6234894367159367711,,[],2025-06-11
91e59fed91164fa51aeac8ae1569516a,jooble,Material Handling Technician,NFI Industries,"Orlando, FL","Resumen:
Bajo la supervisión directa del supervisor de taller o técnico principal, el técnico de manejo de <b>materiales </b>es responsable de realizar mantenimiento, reparación, reemplazo y resolución de problemas periódicos en varios modelos de equipos de manejo de materiales...&nbsp;",[],[],2025-05-20T18:49:06.3270000,https://jooble.org/jdp/8990833167051183988,,[],2025-06-11
60ef0824bf7af04532d4da932263b478,jooble,Lista de espera para Operadores de Maquinaria,Connect Staffing,"Stanton, CA","&nbsp;...producción, configurando y supervisando los equipos para la fabricación de bienes. 
 Operar prensas para formar, moldear o cortar <b>materiales </b>como metal, plástico o papel. 
 Operar máquinas de moldeo por inyección para producir piezas de plástico inyectando plástico...&nbsp;",[],[],2025-05-31T00:00:00.0000000,https://jooble.org/away/-8736025750049086590,,[],2025-06-11
3205693705a0dc372f87f14f7aa9a230,jooble,Forklift Driver (1st Shift),Lululemon,"Groveport, OH","&nbsp;...recogepedidos, carretilla retrctil, gato de conductor sentado, montacargas de conductor sentado) para recoger, entregar o mover mercancas y <b>materiales </b>en una ubicacin de bodega o centro de distribucin (distribution center, DC). 
 Opera maquinaria para empujar, retirar, levantar,...&nbsp;",[],[],2025-06-08T00:00:00.0000000,https://jooble.org/jdp/2736578161671282247,,[],2025-06-11
cecbacf8296941bfac81d2edcbcaeeac,jooble,Delineante de Interiorismo - Proyectos Ejecutivos,proffetional,North Carolina,"&nbsp;...Ests familiarizado con carpintera, tanto en la revisin de detalles de diseo como en la ejecucin de planos tcnicos y eleccin de <b>materiales.</b> 
 Tienes conocimientos de distintos gremios relacionados con los proyectos de interiorismo para desarrollo de documentacin y soluciones...&nbsp;",[],[],2025-05-16T00:00:00.0000000,https://jooble.org/away/-1294417414418500779,,[],2025-06-11
6cf37110126180d0eef831b71ec69fe1,jooble,Construction Planner (PV Plant),COBRA INDUSTRIAL ACTIVITIES INC,"Dallas, TX","&nbsp;...presupuestarias y coordinar estrategias correctivas con la direccin del proyecto. 
 Coordinar con el rea de compras para evaluar costos de <b>materiales </b>y servicios, asegurando su optimizacin. 
 Controlar y analizar el flujo de caja del proyecto. 
 Garantizar el cumplimiento de...&nbsp;",[],[],2025-06-06T00:00:00.0000000,https://jooble.org/away/5903240848202937771,,[],2025-06-11
4672ebfbdb7cf6d3938aecb61fb3046e,jooble,Machine Operator Skid Steer,The Walsh Group,"Harleyville, SC","&nbsp;...un Minicargadora es opera un cargador de direccin deslizante para completar tareas como cavar, excavar y mover y / o transportar <b>materiales </b>como tierra, rocas y otros tipos de agregados; Tambin se espera que los operadores de equipos ayuden en otras tareas alrededor del...&nbsp;",[],[],2025-06-10T00:00:00.0000000,https://jooble.org/jdp/-8051109159797347123,,[],2025-06-11
0f9ef7c051ed6b7b41a5e170ddda0815,jooble,Lista de espera para Empacadores,Connect Staffing,"Los Alamitos, CA","&nbsp;...limpio y ordenado, cumpliendo con las normas de higiene y seguridad alimentaria. 
 Controlar y registrar inventarios de productos y <b>materiales </b>necesarios para el empaque. 
 Reportar cualquier irregularidad en la producción, calidad o seguridad al supervisor. 
 Cumplir...&nbsp;",[],[],2025-05-22T00:00:00.0000000,https://jooble.org/away/-6212655547944139647,,[],2025-06-11
6d498aeaeb625009aaff19de7f70d73e,jooble,Operador de Montacargas - Forklift Driver- Afternoon,Falcon Farms,"Coppell, TX","&nbsp;...cada cliente con el que trabajamos obtenga la mejor experiencia que podamos brindar!

Descripción del trabajo:

Cargar y descargar <b>materiales </b>y mercancías de los vehículos entrantes y/o del área de producción y apilarlos en los lugares asignados de acuerdo con las polí...&nbsp;",[],[],2025-06-09T00:00:00.0000000,https://jooble.org/jdp/7558428673014465919,,[],2025-06-11
89a5b473042ec977de3cad792c12845e,jooble,4/10-Production Worker,Belcan,"Milwaukie, OR","&nbsp;...entorno de trabajo seguro.
* Mantiene la calidad y el mantenimiento de los equipos del almac?n, incluyendo la maquinaria.
* Traslada <b>materiales </b>o productos y paquetes terminados a las ubicaciones establecidas.

Educaci?n y experiencia:
*Diploma de bachillerato/GED
*De...&nbsp;",[],[],2025-06-02T18:36:24.7100000,https://jooble.org/jdp/-8956348399299526571,,[],2025-06-11
7e3e85a0240c079a122a05bec159567e,jooble,Secretario de operaciones de almacn,NFI Industries,"Fargo, ND","&nbsp;...relacionados con las actividades de envo.   
 Ayudar a resolver cualquier discrepancia.   
 Asiste en las tareas de manejo de <b>materiales,</b> como la recepcin, el almacenamiento, la seleccin, el embalaje o la carga.   
 Supervisa activamente la capacidad del remolque y...&nbsp;",[],[],2025-06-11T00:00:00.0000000,https://jooble.org/jdp/8322123093718501410,,[],2025-06-11
e74454c323e910691e0d2b95cb4e78a5,jooble,Forklift Driver,Maleko Personnel,"Las Vegas, NV","&nbsp;...trabajo 
 Los  operadores de montacargas  son responsables de operar y administrar vehículos industriales para cargar y descargar <b>materiales </b>y entregas y moverlos hacia y desde áreas de almacenamiento, máquinas y muelles de carga o instalaciones de almacenamiento....&nbsp;",[],[],2024-11-12T00:00:00.0000000,https://jooble.org/away/5406695624246951719,,[],2025-06-11
eb9c9dc8bcc7e609beb024774a746adc,jooble,Coordinador de Marketing - Houston TX,Sales and Merchandising Services,"Houston, TX","&nbsp;...campaas y preparar reportes de desempeo. 
 Apoyar en la coordinacin con agencias de publicidad, diseadores grficos y proveedores de <b>materiales.</b> 
 Monitorear tendencias de mercado y competencia, y compartir hallazgos con el equipo de marketing. 
 Preparar reportes sobre...&nbsp;",[],[],2025-05-15T00:00:00.0000000,https://jooble.org/away/8513958646391397720,,[],2025-06-11
80eb80fa21b0bb15fefe1e58817f47b7,jooble,Technical Artist - Mid/Senior,Univrse,"Los Angeles, CA","&nbsp;...cnicos relacionados con arte y animación, trabajando de cerca con los equipos de arte y programación
-Crear y optimizar shaders, <b>materiales </b>y sistemas de iluminación para entornos y personajes

Formarás parte de un equipo multifuncional más amplio y, dentro de él, colaborar...&nbsp;",[],[],2025-06-07T00:00:00.0000000,https://jooble.org/jdp/-5628102080839187256,,[],2025-06-11
cd221f36768b23e7c4e34d89fff50154,jooble,Obrero - CDL A - Reencarrilar,Cranemasters,"Candor, NC","&nbsp;...partir de $27.50 por hora más horas extras 
 Descripción: 
 Responsable de la carga, descarga y transporte seguro de equipos y/o <b>materiales </b>hacia/desde el lugar de trabajo, la operación de equipos en el lugar de trabajo (si está calificado) y brindar asistencia,...&nbsp;",[],[],2025-06-10T00:00:00.0000000,https://jooble.org/jdp/-4785809361499561066,,[],2025-06-11
07ca577d4a8fe60c6bea9a478b959b88,jooble,TÉCNICO MARKETING DIGITAL Y REDES SOCIALES,Lendan,"Miami, FL","&nbsp;...filosofía es clara: potenciar el cabello sin límites. Desde la tecnología más avanzada hasta el uso consciente de ingredientes y <b>materiales,</b> en Lendan transformamos la peluquería en una experiencia profesional que marca la diferencia.
Lendan forma parte de VMV Cosmetic...&nbsp;",[],[],2025-06-08T00:00:00.0000000,https://jooble.org/jdp/4646285661473988071,,[],2025-06-11
2c19ff3309c068c6c4f7d77e7f6d37c3,jooble,Agente de bienes raíces recién autorizado,Miami Life Realty,"Sunny Isles Beach, FL","&nbsp;...los mejores prospectos de la industria. 

 Beneficios que ofrecemos a nuestros agentes: 

 Soporte de primer nivel: Acceso a <b>materiales </b>de marketing y apoyo en ventas, con mentores y un equipo de liderazgo que te guiarán hacia el éxito. 
 Apoyo administrativo eficiente...&nbsp;",[],[],2025-05-27T00:00:00.0000000,https://jooble.org/away/-4586436813212575556,,[],2025-06-11
1a865cad18b797e3ecbab2a44eb0eb26,jooble,Machinist A- 1st shift,Belcan,"Devens, MA","&nbsp;...operaciones de máquina (incluyendo retrabajo de piezas), como corte, conformado, desbarbado, conformado, taladrado y escariado, donde los <b>materiales,</b> las herramientas y la secuencia de operaciones se han planificado y establecido previamente.
* Realiza los ajustes necesarios...&nbsp;",[],[],2025-05-27T10:44:17.3200000,https://jooble.org/jdp/-2475294624056554474,,[],2025-06-11
904ea4fe6b76a32ffe04a513211acbd3,jooble,Ayudante De Pasteleria,LAS CHICAS BAKERY & CAFE,"North Bergen, NJ","&nbsp;...y terminaciones y decoraciones como se le indique 
 Llevar control diario de stock existente y elaborado 
 Mantener el area y <b>materiales </b>de trabajo impecablemente limpio y desinfectado 
 Calificaciones 
 Experiencia en reposteria comercial 
 Buen ritmo de trabajo...&nbsp;",[],[],2025-05-20T07:49:52.3723584+00:00,https://jooble.org/jdp/1762883248657919502,,[],2025-06-11
06e90e1b9937a1fc64709cc840484ed3,jooble,JT001 - WAREHOUSE ASSOCIATE / EMPLEADO DE ALMACEN,Quality Consulting Group,Puerto Rico,"&nbsp;...buscamos recursos talentosos, altamente motivados que quieran unirse a nuestro equipo. 
 Responsabilidades: 
 Desempacan y reciben <b>materiales </b>en el almacn de clientes. 
 Clasifican, Paletizan e identifican el material descargado 
 Los materiales pueden incluir marcar...&nbsp;",[],[],2025-06-08T00:00:00.0000000,https://jooble.org/jdp/-5037338933991747673,,[],2025-06-11
d00ac2516b6386d172a4920fdbc964df,jooble,Lista de espera para Operadores de Maquinaria,Connect Staffing,"Dallas, TX","&nbsp;...producción, configurando y supervisando los equipos para la fabricación de bienes. 
 Operar prensas para formar, moldear o cortar <b>materiales </b>como metal, plástico o papel. 
 Operar máquinas de moldeo por inyección para producir piezas de plástico inyectando plástico...&nbsp;",[],[],2025-06-10T00:00:00.0000000,https://jooble.org/away/6717443359344940044,,[],2025-06-11
f7f5bfb3fa88e17f8c8781e757ba2131,jooble,Apartment Maintenance Technician,KDR Services LLC,"Olathe, KS","&nbsp;...registros de mantenimiento y reparación según sea necesario 
- Revisa las órdenes de trabajo asignadas. Calcula el tiempo y los <b>materiales </b>necesarios para completar la reparación. Solicita materiales y suministros necesarios para Completar todas las tareas. 
-Ayuda con...&nbsp;",[],[],2024-12-18T00:00:00.0000000,https://jooble.org/away/7551161914301183083,,[],2025-06-11
f2ac8cb3c2f00004548caf8db8c72118,jooble,Cargo Van Delivery Driver,NewVine Employment Group,"Miami, FL","&nbsp;...un almacén frío (36 °F). 
 Debe poder extraer, contar y cargar sus propios pedidos. 
 Realizar un seguimiento y registrar los <b>materiales </b>manipulados. 
 Cumplir con las políticas y los procedimientos de seguridad para la conducción comercial. 
 Debe estar dispuesto...&nbsp;",[],[],2025-05-25T07:00:42.2418793+00:00,https://jooble.org/jdp/9058641420520040707,,[],2025-06-11
