job_id,source,job_title,company,location,description,skills,careers_required,date_posted,url,career_tag,soft_skills_detected,extraction_date
b50edd0e6230d567ee2e74da6a133454,rapidapi1,Ingeniero I de Operaciones,ABM US,"San Diego, US","Detalles del resumen del puesto:

El ingeniero I de operaciones hace el mantenimiento programado, las inspecciones de seguridad y las reparaciones de varios tipos de equipo y reporta al ingeniero III de operaciones.

Información sobre los beneficios:

ABM ofrece un paquete completo de beneficios. Para obtener información sobre los beneficios de ABM, visite Beneficios para empleados de ABM | Miembros del equipo de primera línea (Programa de beneficios de ABM)
Requisitos básicos:

• Licenciatura en Ingeniería, o campo técnico relacionado o cinco (5) años de experiencia equivalente en ingeniería
• Debe tener una licencia de conducir vigente
• Debe tener licencia de ingeniería en la jurisdicción del estado, del condado o de la ciudad en la que se hará el trabajo

Requisitos preferidos:

• Con una licenciatura en Ingeniería, de preferencia tres (3) años de experiencia previa en el campo de la ingeniería
• Sin una licenciatura en Ingeniería, de preferencia siete (7) años de experiencia previa en el campo de la ingeniería

Responsabilidades:

• Seguir prácticas seguras y cumplir las normas de la compañía y reglamentarias
• Operar equipo de calefacción y ventilación, motores, turbinas, motores de combustión, bombas, compresores de aire, máquinas de hielo y refrigeración, unidades de aire acondicionado, ventiladores y sifones en el lugar asignado del cliente
• Colaborar con clientes internos y externos sobre problemas técnicos, recomendaciones de alcance de trabajo e investigaciones de fallas
• Dar soporte de ingeniería para una amplia gama de sistemas, programas de mantenimiento, motores, y funciones de ingeniería operativa
• Analizar y buscar soluciones para el diseño, el funcionamiento, el mantenimiento, el rendimiento o la reparación de vehículos/equipo y sus componentes
• Definir un programa o configuración de mantenimiento para solucionar problemas y asegurarse de que hay un funcionamiento seguro y legal
• Revisar los boletines de servicio (service bulletins, SB) de los fabricantes o de los fabricantes de los componentes
• Desarrollar soluciones y planes de implementación, justificación del proyecto, análisis de costo/beneficio y administración general de la implementación del proyecto y coordinar la recuperación de la garantía en los SB correspondientes
• Organizar y manejar las prioridades de las responsabilidades asignadas y lograr el proceso de trabajo para cumplir todos los entregables de los proyectos, y los cambios del programa de mantenimiento y las revisiones de las especificaciones técnicas
• Coordinar el trabajo con otros grupos operativos para asegurarse de la seguridad, el cumplimiento reglamentario, la confiabilidad y la eficiencia operativa

ABM es un empleador apto para militares y veteranos y anima a todos los veteranos y candidatos con experiencia militar a enviar su solicitud de empleo. Código de especialidad ocupacional militar: 91B, 91X, 91L, 94H, MM, EM, MK, 1341, 1169, 2A6X1, 3E0X1",[],Matemática Aplicada,,https://eiqg.fa.us2.oraclecloud.com/hcmUI/CandidateExperience/es/sites/CX_1001/job/114485?utm_campaign=google_jobs_apply&utm_source=google_jobs_apply&utm_medium=organic,,[],2025-07-18
9b5892354f99c1f8431111bb7afa830b,rapidapi1,Director de Investigación Clínica,Kelly Services,"Sioux Falls, US","Kelly's Science & Clinical está buscando un/a Director/a de Investigación Clínica para un puesto de contratación directa en un cliente de vanguardia en Souix Falls, SD. Si te apasiona dar vida a los últimos descubrimientos científicos y estás listo/a para dar el siguiente paso en tu carrera, confía en los expertos de Hiring Experts.

Director/a de Investigación Clínica - Oncología

Ubicación: Sioux Falls, SD

Principalmente durante el día con posibilidad de fines de semana/tardes/días festivos (Estados Unidos de América)

Una breve descripción general

Responsable de proporcionar liderazgo y supervisión para garantizar la implementación estratégica de alta calidad de la investigación sobre cáncer clínico, molecular y de ciencias básicas que ampliará el programa de investigación oncológica. Dirige y supervisa las actividades de investigación dentro del Instituto del Cáncer para proporcionar investigación de alta calidad para hacer crecer y respaldar la investigación en toda la línea de servicios de oncología y aumentar las referencias para estudios de investigación. Además, es responsable de las funciones de las áreas de investigación y del desarrollo/mejora de las relaciones con clientes internos/externos involucrados en la investigación que conducen a nuevas oportunidades de investigación para nuestro cliente.

Lo que harás
• Dirige y supervisa la investigación y apoya las actividades que incluyen, entre otras, todos los ensayos clínicos de fase, genómica del cáncer, bioinformática, ciencia de datos biomédicos y personal de apoyo administrativo.
• Directamente responsable y responsable de las operaciones/funciones principales de cada área en lo que se refiere a políticas, procedimientos y protocolos de investigación, cumplimiento normativo, mejora del rendimiento, planes de negocios, recaudación de fondos, gestión financiera/presupuestaria, orientación y competencia del personal. En colaboración con el Vicepresidente Clínico de Oncología y el Vicepresidente de Oncología, completa la planificación estratégica y operativa.
• Promueve el crecimiento de las operaciones de investigación que permiten a la organización expandir, enriquecer y avanzar en el campo de la investigación oncológica.
• Facilita personal y recursos para reforzar la visión del Instituto, el hospital y el sistema de salud. Como miembro del equipo de liderazgo, sirve como modelo a seguir de los principios de liderazgo, dando como resultado una comunicación positiva y la resolución de problemas. Se asegura de que las líneas de comunicación con el personal estén abiertas, promoviendo una alta moral de los empleados y un ambiente de trabajo profesional y saludable.
• Se desempeña como investigador clínico al identificar, diseñar, gestionar y dirigir ensayos clínicos oncológicos dirigidos por investigadores a través de colaboraciones positivas con médicos, personal de investigación, compañías farmacéuticas y otros grupos u organizaciones cooperativas.
• Administra el crecimiento de las relaciones entre el Instituto, los socios médicos, las instituciones académicas y otros colaboradores en los Estados Unidos y el mundo en el campo de la investigación a través de nombramientos académicos y profesionales.
• Se asocia con el liderazgo, los directores médicos y el personal científico para adquirir financiamiento externo en varios niveles para respaldar la investigación de alta calidad y la actividad de servicio.
• Trabaja en conjunto con la Fundación para desarrollar y ejecutar planes de recaudación de fondos para proyectos de investigación designados.
• Mantiene un conocimiento preciso y agudo de la industria regulaciones y estándares de cumplimiento. Conoce y aborda las leyes y reglamentaciones aplicables. Revisa y actualiza las políticas, protocolos y prácticas departamentales para reflejar las regulaciones actuales. En colaboración con Compliance, se asegura el desarrollo y mantenimiento del cumplimiento de la investigación con respecto a los protocolos. Mantiene afiliaciones profesionales y mejora el crecimiento y desarrollo profesional para mantenerse actualizado sobre las últimas tendencias en administración de investigación.
• Las responsabilidades incluyen entrevistar, contratar, desarrollar, capacitar y retener empleados; planificar, asignar y liderar el trabajo; evaluar el desempeño; recompensar y capacitar a los empleados; abordar quejas y resolver problemas.

Calificaciones esenciales

La persona debe poder trabajar las horas especificadas. Para realizar este trabajo con éxito, una persona debe poder realizar cada función esencial del trabajo satisfactoriamente, incluyendo tener una agudeza visual adecuada para realizar las tareas del puesto y la capacidad de comunicarse eficazmente con los demás, escuchar, comprender y distinguir el habla y otros sonidos. Estos requisitos y los enumerados anteriormente son representativos de los conocimientos, habilidades y capacidades requeridas para desempeñar las funciones esenciales del trabajo.",[],Matemática Aplicada,2025-07-07T00:00:00.000Z,https://www.mykelly.com/es/job/9881044-chief-clinical-research-officer-sioux-falls-sd-united-states/?utm_campaign=google_jobs_apply&utm_source=google_jobs_apply&utm_medium=organic,,[],2025-07-18
