job_id,source,job_title,company,location,description,skills,careers_required,date_posted,url,career_tag,soft_skills_detected,extraction_date
981deb9b87362e592df00ad020ad7416,rapidapi2,ESPECIALISTA GEOLOGIA (Geológa(o) Jr.) - PREFERENCIAL PARA MULHERES,AngloGold Ashanti Brasil,Brazil,"Conheça a AngloGold Ashanti. Somos uma das maiores produtoras de ouro em operação no mundo e a mais longeva do Brasil, com 190 anos de história. Temos unidades em Minas Gerais, Goiás e outros nove países. Aqui, a mineração desenvolve pessoas e a sociedade, guiada por valores como segurança, respeito, integridade, sustentabilidade, excelência e colaboração.” Propósito

Apoiar o planejamento e a execução das atividades geológicas diárias de produção, garantindo o controle de qualidade do minério e a integridade dos dados para suporte às decisões operacionais. Atuará em estreita colaboração com engenheiros de planejamento, supervisores de mina e equipes operacionais, com forte presença em campo e atenção à segurança.

Responsabilidades e atribuições

Cumprir e promover rigorosamente as normas de saúde, segurança e meio ambiente.
Realizar mapeamento geológico subterrâneo de frentes de lavra e desenvolvimento, identificando litologias, estruturas e mineralização.
Elaborar e atualizar seções e mapas geológicos para suporte ao planejamento de curto prazo.
Descrever e registrar testemunhos de sondagem (RC e DD), assegurando qualidade e consistência dos dados.
Monitorar diluição e recuperação de minério, propondo ações corretivas quando necessário.
Acompanhar perfurações e desmonte, avaliando a conformidade geológica com o plano de lavra.
Manter o banco de dados geológicos atualizado, garantindo integridade e rastreabilidade.
Auxiliar na comunicação técnica com a operação, incluindo orientações para equipe de mina.
Elaborar e atualizar modelos geológicos de curto prazo em bases semanais e mensais através de softwares 3D disponíveis.

Requisitos obrigatórios

Formação superior completa em Geologia ou Engenharia Geológica.
Registro ativo no CREA (ou elegível para registro).
Disponibilidade para atuação em ambiente subterrâneo e em regime de campo.
CNH categoria B.
Diferencial Inglês intermediário.

Desejável

Conhecimento em mapeamento geológico subterrâneo.
Noções de softwares de modelagem e estimativa de recursos (Leapfrog, Datamine, Vulcan ou similares).
Experiência em mina subterrânea de ouro ou demais metais básicos.
Conhecimento em equipamentos de mina subterrânea (perfuração, perfuração e sondagem).

Benefícios

Aqui, Quem Faz Nosso Presente e Futuro Conta Com Benefícios Que Cuidam Da Saúde, Bem-estar e Qualidade De Vida

Assistência Médica e Odontológica
Seguro de Vida
Auxílio Funeral
Vale Alimentação
Cesta de Natal
Transporte Fretado (unidades operacionais)
Vale Transporte
Previdência Privada
PPR – Participação nos Resultados
Auxílio Creche
Material Escolar
Programa Mais Viver
Vacina
Saúde Mental
Wellhub
Auxílio Autismo e Síndrome de Down

Inscrição e processo seletivo

Empregados(as) AGA: inscrição pela intranet (se tiver acesso) ou pelo site da empresa, marcando que já trabalha conosco.

Empregados(as) próprios(as) ou prestadores(as) de serviço: é obrigatório informar sua liderança imediata sobre a candidatura.

Nosso processo inclui: Inscrição, Triagem de currículos, Dinâmicas/Entrevistas, Avaliações técnicas e comportamentais e Exames médicos.
As comunicações são feitas por e-mail, telefone e WhatsApp. Fique atento(a)!

Diversidade, equidade e inclusão

Estamos transformando a mineração com uma cultura de equidade, inclusão e respeito. Valorizamos cada pessoa e acreditamos que a diversidade de histórias, ideias e perspectivas impulsiona nosso crescimento.

Todas as vagas são abertas a pessoas de diferentes raças, idades, identidades de gênero, orientações sexuais, pessoas com deficiência e reabilitados do INSS. Temos orgulho de iniciativas como o Programa Mulheres de Ouro, que fortalece a presença e liderança feminina em todas as áreas, contribuindo para transformar a empresa e a sociedade.

Desenvolvimento

Na AngloGold Ashanti, investimos continuamente no desenvolvimento de nossas pessoas, com foco em segurança, excelência e crescimento profissional. Oferecemos capacitações técnicas, treinamentos normativos e programas como Kaizen, Full People Potential e Zero Harm, que colocam os empregados no centro da transformação, estimulando aprendizado, inovação e desenvolvimento de competências no dia a dia.

Quer saber mais sobre a AnglodGold Ashanti?

Instagram: @anglogoldashantibr

Site: www.anglogoldashantibr

Acesse nosso site, inscreva-se e venha construir esse futuro com a gente.

#VemSerAGA #Diversidade #Mineração #Carreira #Oportunidades 
Show more Show less","['Geological Mapping', 'Data Integrity', 'Quality Control', 'Mineral Recovery', 'Geological Modeling', 'Technical Communication', 'Fieldwork', 'Health and Safety Compliance', 'Software Proficiency', 'Drilling Techniques', 'Geological Data Management', 'Team Collaboration', 'Problem Solving', 'Environmental Awareness', 'Mining Operations', 'Resource Estimation']",Geología,2025-08-28T11:16:16.127,https://br.linkedin.com/jobs/view/especialista-geologia-geol%C3%B3ga-o-jr-preferencial-para-mulheres-at-anglogold-ashanti-brasil-4290398809,,[],2025-08-28
22fffb485319662f10a60911e431563f,rapidapi2,AUXILIAR DE GEOLOGIA I,AngloGold Ashanti Brasil,"Crixás, Goiás, Brazil","Conheça a AngloGold Ashanti

Somos uma das maiores produtoras de ouro em operação no mundo e a mais longeva do Brasil, com 190 anos de história. Temos unidades em Minas Gerais, Goiás e outros nove países. Aqui, a mineração desenvolve pessoas e a sociedade, guiada por valores como segurança, respeito, integridade, sustentabilidade, excelência e colaboração. Na AngloGold Ashanti, nosso propósito é impulsionar o desenvolvimento das pessoas e da sociedade.

Se você se identifica com os valores de Segurança, Respeito, Integridade, Excelência, Sustentabilidade e Colaboração, venha construir o futuro com a gente.

Transforme sua carreira, transforme a mineração!

Confira Os Detalhes Dessa Oportunidade

PROPOSITO

Responsável por apoiar as operações de sondagem, com foco em qualidade e estrito cumprimento das normas de segurança. A posição exige proatividade, trabalho em equipe e atenção aos procedimentos técnicos operacionais.

RESPONSABILIDADES E ATRIBUIÇÕES

Cumprir as normas de segurança, Regras de Trabalho e Práticas-Padrão/PGR, estabelecidas pela empresa; 
Participar de reuniões de Diálogo Semanais de Segurança (DDS); 
Executar as atividades conforme as orientações e prioridades dos serviços determinados por seu superior imediato, utilizando adequadamente os uniformes e equipamentos de proteção individual (EPI’s) necessários, obedecendo às normas, procedimentos, aspectos de segurança e saúde ocupacional, meio ambiente, qualidade e responsabilidade social; 
Manter a qualidade do relacionamento pessoal e profissional dentro da equipe e entre as outras áreas; 
Manuseio manual de caixas de testemunhos de sondagem; 
Auxiliar no processo de instalação e desinstalação de sonda; 
Auxiliar em todo o processo da sondagem. 

REQUISITOS E QUALIFICAÇÕES

Ensino médio completo 

Desejável

CNH B

Local de trabalho: Mineração Serra Grande - Crixás, Goiás

Inscrição e processo seletivo

Empregados(as) AGA: inscrição pela intranet (se tiver acesso) ou pelo site da empresa, marcando que já trabalha conosco.

Empregados(as) próprios(as) ou prestadores(as) de serviço: é obrigatório informar sua liderança imediata sobre a candidatura.

Nosso processo inclui: Inscrição, Triagem de currículos, Dinâmicas/Entrevistas, Avaliações técnicas e comportamentais e Exames médicos.
As comunicações são feitas por e-mail, telefone e WhatsApp. Fique atento(a)!

Diversidade, equidade e inclusão

Estamos transformando a mineração com uma cultura de equidade, inclusão e respeito. Valorizamos cada pessoa e acreditamos que a diversidade de histórias, ideias e perspectivas impulsiona nosso crescimento.

Todas as vagas são abertas a pessoas de diferentes raças, idades, identidades de gênero, orientações sexuais, pessoas com deficiência e reabilitados do INSS. Temos orgulho de iniciativas como o Programa Mulheres de Ouro, que fortalece a presença e liderança feminina em todas as áreas, contribuindo para transformar a empresa e a sociedade.

Desenvolvimento

Na AngloGold Ashanti, investimos continuamente no desenvolvimento de nossas pessoas, com foco em segurança, excelência e crescimento profissional. Oferecemos capacitações técnicas, treinamentos normativos e programas como Kaizen, Full People Potential e Zero Harm, que colocam os empregados no centro da transformação, estimulando aprendizado, inovação e desenvolvimento de competências no dia a dia.

Quer saber mais sobre a AnglodGold Ashanti?

Instagram: @anglogoldashantibr

Site: www.anglogoldashantibr

Acesse nosso site, inscreva-se e venha construir esse futuro com a gente.

#VemSerAGA #Diversidade #Mineração #Carreira #Oportunidades Benefícios

Aqui, Quem Faz Nosso Presente e Futuro Conta Com Benefícios Que Cuidam Da Saúde, Bem-estar e Qualidade De Vida

Assistência Médica e Odontológica
Seguro de Vida
Auxílio Funeral
Vale Alimentação
Cesta de Natal
Transporte Fretado (unidades operacionais)
Vale Transporte
Previdência Privada
PPR – Participação nos Resultados
Auxílio Creche
Material Escolar
Programa Mais Viver
Vacina
Saúde Mental
Wellhub
Auxílio Autismo e Síndrome de Down
Show more Show less","['Safety Compliance', 'Teamwork', 'Attention to Detail', 'Operational Procedures', 'Manual Handling', 'Drilling Support', 'Quality Assurance']",Geología,2025-08-28T10:44:37,https://br.linkedin.com/jobs/view/auxiliar-de-geologia-i-at-anglogold-ashanti-brasil-4290700647,,[],2025-08-28
0e40d1ddeafa557178b54bea0435aa02,rapidapi2,ESPECIALISTA GEOLOGIA (Geóloga(o) Jr.) - PREFERENCIAL PARA MULHERES,AngloGold Ashanti North America,"Sabará, Minas Gerais, Brazil","A mineradora é a indústria mais longeva do país, com 190 anos de atuação, e uma das maiores produtoras de ouro do Brasil. Com cerca de 3 mil empregados diretos, as operações brasileiras estão entre as mais avançadas do mundo no campo da tecnologia de mineração, pela excelência dos equipamentos e processos utilizados e pelo desenvolvimento de soluções de engenharia foco em segurança e na prática de uma mineração responsável no subsolo.

Na AngloGold Ashanti, nosso propósito é impulsionar o desenvolvimento das pessoas e da sociedade.

Se você se identifica com os valores de Segurança, Respeito, Integridade, Excelência, Sustentabilidade e Colaboração, venha construir o futuro com a gente.

Transforme sua carreira, transforme a mineração!

Confira os detalhes dessa oportunidade: ESPECIALISTA GEOLOGIA - PREFERENCIAL PARA MULHERES 

Propósito 

Apoiar o planejamento e a execução das atividades geológicas diárias de produção, garantindo o controle de qualidade do minério e a integridade dos dados para suporte às decisões operacionais. Atuará em estreita colaboração com engenheiros de planejamento, supervisores de mina e equipes operacionais, com forte presença em campo e atenção à segurança.

Responsabilidades e atribuições

Cumprir e promover rigorosamente as normas de saúde, segurança e meio ambiente.
Realizar mapeamento geológico subterrâneo de frentes de lavra e desenvolvimento, identificando litologias, estruturas e mineralização.
Elaborar e atualizar seções e mapas geológicos para suporte ao planejamento de curto prazo.
Descrever e registrar testemunhos de sondagem (RC e DD), assegurando qualidade e consistência dos dados.
Monitorar diluição e recuperação de minério, propondo ações corretivas quando necessário.
Acompanhar perfurações e desmonte, avaliando a conformidade geológica com o plano de lavra.
Manter o banco de dados geológicos atualizado, garantindo integridade e rastreabilidade.
Auxiliar na comunicação técnica com a operação, incluindo orientações para equipe de mina.
Elaborar e atualizar modelos geológicos de curto prazo em bases semanais e mensais através de softwares 3D disponíveis.

Requisitos obrigatórios

Formação superior completa em Geologia ou Engenharia Geologica
Registro ativo no CREA (ou elegível para registro).
Noções de softwares de modelagem e estimativa de recursos (Leapfrog, Datamine, Vulcan ou similares).
Disponibilidade para atuação em ambiente subterrâneo e em regime de campo.
CNH categoria B

Desejável

Desejável conhecimento em mapeamento geológico subterrâneo. 
Noções de softwares de modelagem e estimativa de recursos (Leapfrog, Datamine, Vulcan ou similares).
Experiência em mina subterrânea de ouro ou demais metais básicos.
Conhecimento em equipamentos de mina subterrânea (perfuração, perfuração e sondagem).

Local de trabalho: Mina de Lamego. Sabará, MG.

Benefícios

Aqui, Quem Faz Nosso Presente e Futuro Conta Com Benefícios Que Cuidam Da Saúde, Bem-estar e Qualidade De Vida

Assistência Médica e Odontológica
Seguro de Vida
Auxílio Funeral
Vale Alimentação
Cesta de Natal
Transporte Fretado (unidades operacionais)
Vale Transporte
Previdência Privada
PPR – Participação nos Resultados
Auxílio Creche
Material Escolar
Programa Mais Viver
Vacina
Saúde Mental
Wellhub
Auxílio Autismo e Síndrome de Down

Inscrição e processo seletivo

Empregados(as) AGA: inscrição pela intranet (se tiver acesso) ou pelo site da empresa, marcando que já trabalha conosco.
Empregados(as) próprios(as) ou prestadores(as) de serviço: é obrigatório informar sua liderança imediata sobre a candidatura.
Nosso processo inclui: Inscrição, Triagem de currículos, Dinâmicas/Entrevistas, Avaliações técnicas e comportamentais e Exames médicos.
As comunicações são feitas por e-mail, telefone e WhatsApp. Fique atento(a)!

Diversidade, equidade e inclusão

Estamos transformando a mineração com uma cultura de equidade, inclusão e respeito. Valorizamos cada pessoa e acreditamos que a diversidade de histórias, ideias e perspectivas impulsiona nosso crescimento.

Todas as vagas são abertas a pessoas de diferentes raças, idades, identidades de gênero, orientações sexuais, pessoas com deficiência e reabilitados do INSS. Temos orgulho de iniciativas como o Programa Mulheres de Ouro, que fortalece a presença e liderança feminina em todas as áreas, contribuindo para transformar a empresa e a sociedade.

Desenvolvimento

Na AngloGold Ashanti, investimos continuamente no desenvolvimento de nossas pessoas, com foco em segurança, excelência e crescimento profissional. Oferecemos capacitações técnicas, treinamentos normativos e programas como Kaizen, Full People Potential e Zero Harm, que colocam os empregados no centro da transformação, estimulando aprendizado, inovação e desenvolvimento de competências no dia a dia.

Quer saber mais sobre a AnglodGold Ashanti?

Instagram: @anglogoldashantibr

Site: www.anglogoldashantibr

Acesse nosso site, inscreva-se e venha construir esse futuro com a gente.

#VemSerAGA #Diversidade #Mineração #Carreira #Oportunidades

A ANGLOGOLD ASHANTI

O grupo AngloGold Ashanti tem sede em Londres (Reino Unido), e atuação em nove países, com 10 operações. Empresa de capital aberto, suas ações são negociadas nas bolsas de Johannesburgo, Nova York, Austrália e Gana. No Brasil, a empresa possui minas e plantas metalúrgicas e de beneficiamento nos estados de Minas Gerais e Goiás.

Somos exemplo de cuidado ativo e de segurança, nosso primeiro valor. Trabalhamos com disciplina e excelência operacional, buscando a inovação e a melhoria contínua para manter nossas operações entre as mais avançadas no setor da mineração. O nosso trabalho é pautado na mineração responsável e no compromisso com as pessoas, com o meio ambiente e com o desenvolvimento sustentável.

Temos responsabilidade e orgulho de valorizar a multiplicidade de perspectivas e experiências que a diversidade proporciona, seja ela baseada em gênero, etnia, orientação sexual, deficiência, formação cultural, religião ou idade.

Acreditamos que podemos desenvolver, juntos, o potencial individual e coletivo.

Para saber mais sobre a AngloGold Ashanti, acesse www.anglogoldashanti.com.br. 
Show more Show less","['Geological Mapping', 'Data Integrity', 'Quality Control', 'Collaboration', 'Technical Communication', 'Software Proficiency', 'Mining Operations', 'Safety Compliance']",Geología,2025-08-28T03:04:56,https://br.linkedin.com/jobs/view/especialista-geologia-ge%C3%B3loga-o-jr-preferencial-para-mulheres-at-anglogold-ashanti-north-america-4292330570,,[],2025-08-28
d52025c685da71b5ab25c11550aeea63,rapidapi2,Estágio em Geologia e Planejamento de Mina (corporativo),Anglo American,Brazil,"Descrição da empresa

Seu talento pode transformar o futuro. Vem com a gente!

Na Anglo American, acreditamos no poder das pessoas para transformar o futuro. Estamos em busca de novos talentos que queiram aprender, crescer e fazer a diferença em um ambiente inovador, inclusivo e seguro.

Aqui, você terá a oportunidade de colocar seus conhecimentos em prática, desenvolver novas habilidades e trabalhar lado a lado com profissionais que inspiram e incentivam o aprendizado contínuo.

Valorizamos a diversidade, o respeito e o cuidado com as pessoas e com o meio ambiente. Queremos que cada estagiário e estagiária se sinta parte de um time que se preocupa com o bem-estar e o desenvolvimento de todos.

Se você é uma pessoa curiosa, comprometida e quer contribuir para um futuro melhor, inscreva-se e construa sua trajetória com a gente. O seu próximo passo pode começar agora

Descrição da vaga

Temos diversas oportunidades abertas em nosso escritório em Belo Horizonte!

Nessa vaga você atuará na área de Geologia e Planejamento de Mina (corporativo), envolvido(a) nas atividades rotineiras da área corporativa.

Aqui você terá a oportunidade real de conhecer e atuar no trabalho desenvolvido pela área, se envolvendo nas rotinas do dia a dia de uma multinacional.

Se você está buscando desenvolvimento e aprendizagem, essa oportunidade é para você!

Qualificações

O que você precisa para participar do Programa de Estágio Mina de Talentos:

Será necessário que esteja com matrícula ativa em uma instituição de ensino superior, no curso de Engenharia de Minas;

Ter previsão de formatura a partir de julho de 2027;

Ter disponibilidade para cumprir 6 horas diárias de estágio.

Isso faz sentido para você? Então não perde tempo e se inscreve! 😉

Informações adicionais

Nosso processo seletivo seguirá esse fluxo:

Inscrições até 19/09

Triagem de currículos e testes (comportamental e lógica) – setembro e outubro

Dinâmica de grupo e entrevistas individuais – setembro e outubro

Exame médico – outubro

Contrato de estágio – novembro

Admissão – dezembro

Temos os melhores benefícios para você:

Trilha de Desenvolvimento de Estagiários (treinamentos exclusivos para estagiários e estagiárias com temas como: Autoconhecimento, Gestão de Projetos, Comunicação e muito mais!).
Bolsa-auxílio R$ 1.400,00
Wellhub (Gympass);
Vale refeição;
Vale transporte; 
Plano de Saúde e Seguro de Vida;
Conexa (4 atendimentos de psicoterapia por mês pagos pela empresa – na plataforma Psicologia Viva);

E mais! Um ambiente de trabalho seguro:

Temos os padrões de segurança mais rigorosos do setor. Além disso, também estamos investindo continuamente em novas tecnologias que estão ajudando a tornar a mineração mais segura.

Um ambiente de trabalho inclusivo e diverso:

Acolhemos e celebramos todas as identidades de gênero, etnias, idades, espiritualidades, orientações sexuais, deficiências, classes sociais, estilos de vida e habilidades. E foi por isso que criamos os Grupos de Afinidades: espaços seguros para discutir, refletir e construir ações de inclusão e diversidade no âmbito da equidade de gênero, LGBTQIAP+, etnia, pessoas com deficiência e geracional.

Reforçamos que todas as vagas estão abertas para pessoas com deficiência (PcD) e reabilitados do INSS.

Atenção ao seu e-mail e telefone, é por lá que vamos te deixar por dentro de cada etapa!

E aí, vai se inscrever ou deixar essa oportunidade passar? 
Show more Show less","['Geology', 'Mining Engineering', 'Planning', 'Teamwork', 'Communication', 'Problem Solving', 'Adaptability', 'Curiosity']",Geología,2025-08-27T19:51:26,https://br.linkedin.com/jobs/view/est%C3%A1gio-em-geologia-e-planejamento-de-mina-corporativo-at-anglo-american-4290306979,,[],2025-08-28
cbf978f3211942a8f566d38af9229b78,rapidapi2,Analista Técnico - Geologia,Egis,"Rio de Janeiro, Rio de Janeiro, Brazil","Descrição da empresa

A Egis é uma multinacional com mais de 90 anos de história, referência global em engenharia, consultoria e operação de projetos sustentáveis. Presente em mais de 100 países, com forte atuação no Brasil há mais de 40 anos, desenvolve soluções inovadoras para infraestrutura, mobilidade urbana, meio ambiente e cidades inteligentes. Reconhecida como Top Employer, a Egis valoriza o desenvolvimento de seus talentos e oferece um ambiente colaborativo, inclusivo e cheio de oportunidades para crescer

Descrição da vaga

Controle e supervisão das atividades de campo, garantindo o cumprimento dos cronogramas e padrões técnicos exigidos.
Acompanhamento de equipes especializadas, incluindo topografia, sondagens (SP, ST, SM, SR), ensaios especiais, geofísica e locação de pontos.
Gestão de empresas terceiras, realizando tratativas técnicas, acompanhamento de entregas e alinhamento de demandas.
Elaboração e envio de Relatórios Diários de Obra (RDO), com registros detalhados das atividades executadas em campo.
Execução e apoio em mapeamentos geotécnicos e geológicos, conforme as exigências do projeto.
Garantir o cumprimento das normas de segurança, qualidade e meio ambiente nas atividades sob sua responsabilidade.


Qualificações

Ensino Superior Completo em Geologia.
Conhecimento técnico em investigações geotécnicas, incluindo:
Sondagens à percussão (SPT), sondagens mistas, trado manual;
Ensaios in situ e especiais (CPT, Vane Test, Pressiômetro, entre outros);
Técnicas de geofísica aplicadas à engenharia;
Deslocamento e locação de pontos em campo.
Experiência com mapeamento geotécnico, incluindo:
Taludes e encostas;
Áreas de jazidas e empreendimentos;
Identificação e delimitação de solos moles.
Boa comunicação interpessoal, com capacidade de alinhamento técnico com equipes de campo e terceiros.
Perfil organizado, com atenção aos detalhes e foco em controle de atividades técnicas.
Capacidade de trabalho em equipe, colaborando com diferentes áreas e perfis técnicos.
CNH categoria B – obrigatória.
Experiência comprovada em direção em rodovias, com prática de direção defensiva e segurança no deslocamento entre frentes de serviço.

Informações adicionais

Benefícios que valorizam você 🌟

Na Egis, acreditamos que um bom trabalho começa com um bom ambiente. Por isso, oferecemos um pacote completo de benefícios pensado para o seu bem-estar, desenvolvimento e qualidade de vida:

✔️ Salário compatível com o mercado – Reconhecimento justo pelo seu talento.

✔️ Convênio Médico e Odontológico – Cuidar da saúde é essencial, e aqui você tem esse suporte.

✔️ Vale Refeição ou Vale Alimentação – Flexibilidade para você escolher o que melhor atende sua rotina.

✔️ Vale Transporte – Comodidade para ir e vir com tranquilidade.

✔️ TotalPass – Bem-estar físico e mental com acesso a academias e atividades.

✔️ Reconhecimento no Aniversário – Um carinho especial no seu dia.

✔️ Day Off de Aniversário – Porque todo mundo merece folga para comemorar!

✔️ Seguro de Vida – Proteção e segurança para você e quem você ama.

✔️ Programa de Desenvolvimento – Aqui, seu crescimento profissional é levado a sério.

✔️ Ambiente colaborativo e inclusivo – Diversidade, respeito e oportunidades para todos. 
Show more Show less","['Geology', 'Geotechnical Investigations', 'Field Supervision', 'Mapping', 'Topography', 'Specialized Testing', 'Geophysics', 'Team Collaboration', 'Communication', 'Attention To Detail', 'Safety Compliance', 'Project Management', 'Driving Skills', 'Technical Alignment', 'Organizational Skills', 'Field Activities Control']",Geología,2025-08-26T18:42:35,https://br.linkedin.com/jobs/view/analista-t%C3%A9cnico-geologia-at-egis-4291642132,,[],2025-08-28
