job_id,source,job_title,company,location,description,skills,careers_required,date_posted,url,career_tag,soft_skills_detected,extraction_date
4df40fa0a491dea2cbfaf697c508ba81,rapidapi2,TÉCNICA(O) DE MINA E GEOLOGIA I – PERFURAÇÃO PARA DESMONTE – MINERAÇÃO - VAGA PREFERENCIAL PARA MULHERES,Vale,"Nova Lima, Minas Gerais, Brazil","Onde tem evolução, a Vale está.

TÉCNICA(O) DE MINA E GEOLOGIA I – PERFURAÇÃO PARA DESMONTE - MINERAÇÃO - VAGA PREFERENCIAL PARA MULHERES 

Quer conhecer a nossa oportunidade? 

N° do CD (Cargo disponível): CD 1088416 

N° de Vagas: 01

Formação: Técnica Completa em Mineração e/ou Geologia com registro ativo

Localidade : Nova Lima, Minas Gerais, Brasil

Horário de Trabalho: Escala 3x3 - 06:00 h as 18:00 h

Tipo de contrato: Indeterminado

Período de inscrição : de 22/08/2025 a 28/08/2025

Requisitos necessários: 

Formação Técnica em Mineração ou Geologia com registro ativo; 
Conhecimento das atividades de perfuração para desmonte; 
Conhecimento da praça de perfuração, e recursos necessários, para execução das atividades para desmonte; 
Conhecimento de leitura em Interpretação de desenhos topográficos; 
Carteira Nacional de Habilitação - CNH B; 
Conhecimento do Pacote Office - nível intermediário; 
Residência nas cidades: Nova Lima, Itabirito, Rio Acima, Raposos, Cachoeira do Campo, Ouro Preto, Belo Horizonte e/ou Contagem. 

Requisitos desejáveis :

Formação superior em Engenharia de Minas, Engenharia Civil, Engenharia de Produção e/ou áreas afins; 
Conhecimentos em topografia / uso de GPS e locação de furos; 
Disponibilidade para trabalho em escala de revezamento e disponibilidade de horário. 

Responsabilidades e atividades do cargo: 

Direcionar as equipes de trabalho para as atividades de perfuração para desmonte; 
Acompanhar as atividades de perfuração para desmonte garantindo o cumprimento das atividades. 
Acompanhar e garantir para que as atividades sejam realizadas de forma segura, e manter uma postura prevencionista de acordo com os procedimentos e normas de SSMA – saúde, segurança e meio ambiente; 
Acompanhar e garantir o atendimento de indicadores de desempenho visando o máximo aproveitamento dos equipamentos e atendimento do plano de trabalho. 
Disponibilizar insumos necessário a operação das perfuratrizes bem como os insumos necessários a praça de perfuração. 
Reportar de imediato e munir o supervisor com informações precisas para tomada de decisões relacionadas a perfuração para demonstre; 
Elaborar relatório de andamento de atividades. 
Atender de forma proativa as demandas de 5S, ferramentas da qualidade; 
Executar outras tarefas de mesma natureza e nível de complexidade associadas ao ambiente organizacional. 

Um pouco do que a Vale oferece para você: 

Previdência Privada: garantia de um futuro tranquilo, com segurança financeira para a aposentadoria. 
PLR - Programa de Participação nos Lucros e Resultados: reconhecimento pelos esforços de todos, com participação nos lucros da empresa 
Assistência Médica e Hospitalar, Odontológica: Cuidados de saúde completos para empregados e seus dependentes, prezando por aquilo que é prioritário em garantia: Saúde e qualidade de vida; 
Reembolso Creche ou Auxílio Babá: apoio para conciliar o retorno ao trabalho com a chegada de um filho - até os 6 anos dos dependentes; 
PASA - Planos de saúde para familiares ou para o próprio empregado, em caso de aposentadoria ou desligamento; 
Vale alimentação: suporte financeiro para compras de itens de mercado; 
Vale refeição ou Refeições no trabalho: benefício para facilitar a rotina e promover hábitos saudáveis na alimentação diária; 
Apoiar - Programa de Assistência ao Empregado e Dependentes: suporte emocional e social especializados para empregados e suas famílias; 
Cartão Presente de Natal para Dependentes: um gesto de carinho no final do ano - para dependentes até 10 anos; 
Transporte fretado ou Vale transporte: garantias de deslocamento diário de nossos empregados para o ambiente de trabalho; 
Passagens de trem de passageiros na Estrada de Ferro Vitória a Minas (EFVM) e/ou na Estrada de Ferro Carajás (EFC). Destinadas para uso pessoal, viabilizando mais uma opção logística para viagens dos empregados; 
Incentivo à atividade física - Wellhub: promoção de saúde física e bem-estar com programas de atividade física; 
Programa Bem-Estar: cuidados integrais para melhorar a qualidade de vida dos empregados; 
Clube de Vantagens: Descontos e benefícios exclusivos para compras em estabelecimentos parceiros. 

Entre outros ...

Nossa transformação cultural: 

A Vale é uma mineradora que busca acelerar a transição para um mundo mais sustentável, que coloca a segurança no centro de tudo o que faz e trabalha para construir soluções para os desafios da humanidade - transformando, hoje, o futuro. Aprendemos juntos, e seguimos comprometidos com a nossa transformação cultural para gerar, com as pessoas, valor e impacto positivo por meio das nossas atividades. Avançando a cada dia, nos sentimos prontos para cultivar relações sólidas e estabelecer sempre o diálogo aberto com a sociedade.

#vemcomavale

Conheça mais do nosso propósito: 

https://www.youtube.com/watch?v=MUpLjGKLmSc

https://www.vale.com/pt/home

Por que vagas preferenciais para mulheres? 

A Vale está em uma jornada de transformação, na busca de se tornar uma empresa mais diversa, equitativa e inclusiva. Além disso, acreditamos que o avanço em equidade de gênero contribui para a construção de um futuro melhor para todos. Queremos aumentar a representatividade de todas as mulheres: pretas, brancas, com qualquer identidade de gênero e orientação sexual ou que tenham algum tipo de deficiência.

Entendemos que iniciativas com foco em vagas exclusivas contribuem para avanços na criação de um ambiente cada vez mais colaborativo, inovador e atrativo para novos talentos. Por isso, valorizamos em diferentes ações e processos seletivos a participação de todos os diferentes perfis de candidatos e candidatas, nas diferentes dimensões de grupos que integram a agenda de Diversidade, Equidade e Inclusão.

O processo seletivo para essa posição segue o mesmo formato dos outros programas de atração de talentos da empresa.

Como é trabalhar na Vale? 

Na Vale, contribuímos para a formação de futuros. Da mineração, do planeta e o seu. Oferecemos oportunidades para diversas áreas e objetivos profissionais. Aqui, nossos talentos constroem juntos um ambiente colaborativo e inclusivo que valoriza a pessoa como ela é: sua individualidade, seu protagonismo e comprometimento.

Na Vale, aprendemos juntos. Acreditamos na riqueza das experiências do dia a dia e na troca de conhecimento entre os talentos. Aqui, todo momento pode e deve ser um aprendizado.

Na Vale, também crescemos juntos. Estabelecemos relações sólidas e de valor compartilhado com os nossos empregados e a sociedade. Assim, demonstramos nosso comprometimento com um legado positivo, resultados consistentes e com a construção de uma mineração com processos mais inovadores e sustentáveis: a mineração do futuro.

Onde tem futuro, a Vale está. 

Ficou curioso para conhecer um pouco mais da Vale? Acesse www.vale.com

Conheça também nossa Política de diversidade

A Vale não realiza nenhum tipo de cobrança para participação em nenhuma etapa dos seus processos seletivos. Todas as candidaturas devem ser feitas exclusivamente pelo nosso site ou por meio de vagas postadas no perfil da Vale no LinkedIn . 

Obs: Se você já se candidatou a esta vaga anteriormente, o botão para o envio de candidatura não estará disponível. Caso seja selecionado no processo seletivo, entraremos em contato para informar sobre o resultado da sua candidatura. 
Show more Show less","['Technical Knowledge in Mining', 'Technical Knowledge in Geology', 'Drilling for Demolition', 'Topographic Drawing Interpretation', 'Intermediate Office Suite Skills', 'Driving License - CNH B', 'Knowledge of Drilling Resources', 'Team Direction', 'Safety Compliance', 'Performance Indicators Monitoring', 'Report Writing', '5S Methodology', 'Quality Tools', 'GPS Usage', 'Drilling Hole Location', 'Availability for Shift Work']",Geología,2025-08-22T23:08:12,https://br.linkedin.com/jobs/view/t%C3%A9cnica-o-de-mina-e-geologia-i-%E2%80%93-perfura%C3%A7%C3%A3o-para-desmonte-%E2%80%93-minera%C3%A7%C3%A3o-vaga-preferencial-para-mulheres-at-vale-4289580151,,[],2025-08-28
dc71e4d531781e857d111e6acc219869,rapidapi2,Operador(a) B Geologia (Preferencial para Mulheres e/ou PCD),Nexa Resources,"Vazante, Minas Gerais, Brazil","Descrição da vaga

Faça parte da Mineração que Muda com o Mundo! Venha para a Nexa! 🧡

De acordo com o nosso compromisso com a diversidade e a inclusão, estamos encorajados a receber candidaturas de mulheres para esta posição. Por isso, encorajamos todas as pessoas qualificadas a se candidatarem, independentemente de gênero, identidade ou qualquer outra caraterística, e se juntarem ao nosso time para a vaga de Operador(a) B para atuar na área de Geologia da Nexa, na unidade de Vazante-MG.

Gostou do que viu até aqui?

Dê uma olhada nos desafios dessa vaga!

Responsabilidades e atribuições

Responsabilidades



Auxiliar a equipe técnica de geologia na execução de levantamentos geológicos em campo;
Realizar marcações e amostragem de canais, garantindo a precisão e qualidade das amostras coletadas;
Realizar atividades de amostragem geológica e mapeamento de frentes de lavra;
Auxiliar na preparação e organização de amostras geológicas para análise;
Monitorar a qualidade e precisão dos dados coletados e manter registros detalhados das atividades realizadas;
Colaborar com a equipe de geologia para cumprir os objetivos de produção e qualidade;
Seguir as normas de segurança e procedimentos internos da Nexa

Requisitos e qualificações

Qualificações Necessárias

Ensino Médio Completo;
Carteira Nacional de Habilitação (CNH) categoria B;
Idade acima de 21 anos;
Experiência anterior na área de geologia será um diferencial;
Adaptabilidade e flexibilidade para trabalhar em regime de turno;
Disponibilidade de atuar presencialmente em Vazante-MG.

Desejável

Proatividade e disposição para aprender;
Organização e atenção;
Capacidade de trabalhar em equipe;
Pontualidade e comprometimento.

Informações adicionais

Benefícios

Salário compatível com o mercado;
Plano de saúde e odontológico;
Vale-alimentação;
Transporte fretado;
Oportunidades de crescimento e desenvolvimento profissional.

A Nexa acredita na promoção de um ambiente plural para que todos se sintam à vontade e confortáveis para serem do jeito que são.

Nós somos a Nexa

Somos uma das maiores produtoras de zinco do mundo!

Temos mais de 60 anos de experiência operando e desenvolvendo ativos de mineração e metalurgia. Nosso propósito é integrar a mineração a um mundo em constante mudança como uma oportunidade para o desenvolvimento sustentável.

Contamos com 8 operações distribuídas entre Brasil e Peru – sendo 3 refinarias e 5 minas -, incluindo a maior mina subterrânea de zinco no Peru (Cerro Lindo) e a maior refinaria de zinco das Américas (Cajamarquilla). Com isso, respondemos por 4% da produção mundial de zinco e somos a única produtora de zinco metálico da América Latina, excluindo o México. Também produzimos cobre, chumbo, prata e ouro como coprodutos.

Nexa, mineração que muda com o mundo. 
Show more Show less","['Geological Surveys', 'Sample Collection', 'Data Monitoring', 'Team Collaboration', 'Safety Compliance', 'Adaptability', 'Flexibility', 'Organization', 'Attention to Detail', 'Proactivity', 'Commitment']",Geología,2025-08-22T13:26:25,https://br.linkedin.com/jobs/view/operador-a-b-geologia-preferencial-para-mulheres-e-ou-pcd-at-nexa-resources-4287120570,,[],2025-08-28
18df5cd799716482ed0e49ddfad622ea,rapidapi2,Mina TZ – Superintendente de Geologia de Mina,G Mining Ventures Corp.,"Belo Horizonte, Minas Gerais, Brazil","Resumo Das Responsabilidades

O Superintendente de Geologia de Mina é responsável por liderar a equipe de geologia, definir estratégias e assegurar que as atividades geológicas apoiem os objetivos de produção da empresa. Atua de forma integrada com as áreas de planejamento de mina, perfuração e desmonte, topografia, operação e usina, garantindo previsibilidade de produção, redução de diluição e perdas de minério, além de promover a aderência entre o planejado e o realizado. Este profissional tem papel estratégico na gestão técnica e de pessoas, assegurando as melhores práticas de saúde, segurança e qualidade no ambiente de trabalho.

Atividades a Serem Realizadas

Gestão estratégica: Elaborar e supervisionar o planejamento de sondagens de curto e médio prazos, alinhado à evolução do depósito e estratégia de lavra.
Gestão de pessoas: Liderar, orientar e desenvolver a equipe de geologia de mina, promovendo padrões de trabalho consistentes e melhorias contínuas.
Gestão da qualidade: Garantir a integridade e a qualidade dos dados geológicos, assegurando modelos de blocos precisos para uso no planejamento de lavra e análise de reservas.
Gestão de custos: Conduzir a gestão financeira do setor, análise de custos e construção de orçamentos, otimizando recursos.
Segurança e conformidade: Assegurar que todas as atividades estejam em conformidade com normas e práticas de saúde e segurança.
Modelagem geológica: Gerenciar modelos geológicos no Leapfrog, aplicar melhores práticas em modelagem e atualização, além de análises QAQC.
Relatórios e auditorias: Preparar documentação técnica para relatórios públicos conforme padrões internacionais (NI 43-101, JORC 2012) e acompanhar auditorias internas e externas.
Integração operacional: Apoiar perfuração, desmonte e operação de mina, orientando para minimizar diluição e perdas.
Reconciliação e estoques: Realizar reconciliação de lavra, inventário de estoques e balanço de massa.
Controle de banco de dados: Garantir organização, atualização e confiabilidade das informações geológicas.

Requisitos Necessários

Graduação em Geologia, Engenharia Geológica ou áreas correlatas;
Experiência mínima de 10 anos em geologia aplicada à mineração (curto e médio prazos), preferencialmente em ouro, cobre, níquel e metais base;
Vivência em mina a céu aberto;
Experiência em modelagem e estimativa de recursos;
Domínio de softwares como Leapfrog, Datamine, Vulcan ou Surpac (modelagem) e Deswik ou MinePlan (planejamento);
Inglês intermediário a avançado;
Excel avançado e Power BI para análises e relatórios;
CNH categoria B.

Requisitos Desejáveis

Pós-graduação ou MBA em Geometalurgia, Lavra ou Gestão de Projetos;
Experiência em operações remotas ou regime FIFO;
Conhecimentos em geoestatística, geometalurgia e exploração mineral;
Inglês avançado ou fluente.

Competências Comportamentais Requeridas

Comprometimento com saúde e segurança;
Proatividade e senso de urgência;
Capacidade de decisão sob pressão;
Comunicação clara em todos os níveis;
Organização, adaptabilidade e trabalho em equipe;
Visão sistêmica mina–planta;
Orientação para resultados e inteligência emocional;
Liderança inspiradora e desenvolvimento de talentos.

Informações Adicionais

Regime de trabalho: 14 x 14 (Fly in Fly Out);
Transporte, acomodações e refeições fornecidos pela empresa.

Sobre a Empresa

A G Mining Ventures (GMIN) é uma empresa de mineração de ouro com foco na aquisição, desenvolvimento e operação de projetos de metais preciosos. Atualmente opera a Mina Tocantinzinho (TZ), no Pará, Brasil, que iniciou produção comercial em 2024. A companhia se destaca por sua abordagem eficiente na execução de projetos e por entregar empreendimentos dentro do prazo e do orçamento. Com um portfólio em expansão, incluindo os projetos Oko West (Guiana) e Gurupi (Maranhão), a G Mining reforça sua posição como um futuro líder na produção intermediária de ouro nas Américas.

Valorizamos a diversidade e estamos comprometidos com a inclusão!

Se você é uma pessoa com deficiência e busca uma oportunidade para se desenvolver profissionalmente, queremos te conhecer! 
Show more Show less","['Geology', 'Leadership', 'Data Management', 'Financial Management', 'Health and Safety Compliance', 'Geological Modeling', 'Reporting', 'Operational Integration', 'Reconciliation', 'Database Management', 'Project Management', 'Communication', 'Teamwork', 'Adaptability', 'Decision Making', 'Proactivity']",Geología,2025-08-22T12:22:51,https://br.linkedin.com/jobs/view/mina-tz-%E2%80%93-superintendente-de-geologia-de-mina-at-g-mining-ventures-corp-4287110793,,[],2025-08-28
ecd13ef95c459dc896bf60ee664dc955,rapidapi2,AUXILIAR DE GEOLOGIA I,AngloGold Ashanti North America,"Crixás, Goiás, Brazil","A mineradora é a indústria mais longeva do país, com 190 anos de atuação, e uma das maiores produtoras de ouro do Brasil. Com cerca de 3 mil empregados diretos, as operações brasileiras estão entre as mais avançadas do mundo no campo da tecnologia de mineração, pela excelência dos equipamentos e processos utilizados e pelo desenvolvimento de soluções de engenharia foco em segurança e na prática de uma mineração responsável no subsolo.

Na AngloGold Ashanti, nosso propósito é impulsionar o desenvolvimento das pessoas e da sociedade.

Se você se identifica com os valores de Segurança, Respeito, Integridade, Excelência, Sustentabilidade e Colaboração, venha construir o futuro com a gente.

Transforme sua carreira, transforme a mineração!

Confira Os Detalhes Dessa Oportunidade

PROPOSITO

Responsável por apoiar as operações de sondagem, com foco em qualidade e estrito cumprimento das normas de segurança. A posição exige proatividade, trabalho em equipe e atenção aos procedimentos técnicos operacionais.

RESPONSABILIDADES E ATRIBUIÇÕES

Cumprir as normas de segurança, Regras de Trabalho e Práticas-Padrão/PGR, estabelecidas pela empresa; 
Participar de reuniões de Diálogo Semanais de Segurança (DDS); 
Executar as atividades conforme as orientações e prioridades dos serviços determinados por seu superior imediato, utilizando adequadamente os uniformes e equipamentos de proteção individual (EPI’s) necessários, obedecendo às normas, procedimentos, aspectos de segurança e saúde ocupacional, meio ambiente, qualidade e responsabilidade social; 
Manter a qualidade do relacionamento pessoal e profissional dentro da equipe e entre as outras áreas; 
Manuseio manual de caixas de testemunhos de sondagem; 
Auxiliar no processo de instalação e desinstalação de sonda; 
Auxiliar em todo o processo da sondagem. 

REQUISITOS E QUALIFICAÇÕES

Ensino médio completo 

Desejável

CNH B

Local de trabalho: Mineração Serra Grande - Crixás, Goiás

Benefícios

Aqui, Quem Faz Nosso Presente e Futuro Conta Com Benefícios Que Cuidam Da Saúde, Bem-estar e Qualidade De Vida

Assistência Médica e Odontológica
Seguro de Vida
Auxílio Funeral
Vale Alimentação
Cesta de Natal
Transporte Fretado (unidades operacionais)
Vale Transporte
Previdência Privada
PPR – Participação nos Resultados
Auxílio Creche
Material Escolar
Programa Mais Viver
Vacina
Saúde Mental
Wellhub
Auxílio Autismo e Síndrome de Down

Inscrição e processo seletivo

Empregados(as) AGA: inscrição pela intranet (se tiver acesso) ou pelo site da empresa, marcando que já trabalha conosco.
Empregados(as) próprios(as) ou prestadores(as) de serviço: é obrigatório informar sua liderança imediata sobre a candidatura.
Nosso processo inclui: Inscrição, Triagem de currículos, Dinâmicas/Entrevistas, Avaliações técnicas e comportamentais e Exames médicos.
As comunicações são feitas por e-mail, telefone e WhatsApp. Fique atento(a)!

Diversidade, equidade e inclusão

Estamos transformando a mineração com uma cultura de equidade, inclusão e respeito. Valorizamos cada pessoa e acreditamos que a diversidade de histórias, ideias e perspectivas impulsiona nosso crescimento.

Todas as vagas são abertas a pessoas de diferentes raças, idades, identidades de gênero, orientações sexuais, pessoas com deficiência e reabilitados do INSS. Temos orgulho de iniciativas como o Programa Mulheres de Ouro, que fortalece a presença e liderança feminina em todas as áreas, contribuindo para transformar a empresa e a sociedade.

Desenvolvimento

Na AngloGold Ashanti, investimos continuamente no desenvolvimento de nossas pessoas, com foco em segurança, excelência e crescimento profissional. Oferecemos capacitações técnicas, treinamentos normativos e programas como Kaizen, Full People Potential e Zero Harm, que colocam os empregados no centro da transformação, estimulando aprendizado, inovação e desenvolvimento de competências no dia a dia.

A ANGLOGOLD ASHANTI

O grupo AngloGold Ashanti tem sede em Londres (Reino Unido), e atuação em nove países, com 10 operações. Empresa de capital aberto, suas ações são negociadas nas bolsas de Johannesburgo, Nova York, Austrália e Gana. No Brasil, a empresa possui minas e plantas metalúrgicas e de beneficiamento nos estados de Minas Gerais e Goiás.

Somos exemplo de cuidado ativo e de segurança, nosso primeiro valor. Trabalhamos com disciplina e excelência operacional, buscando a inovação e a melhoria contínua para manter nossas operações entre as mais avançadas no setor da mineração. O nosso trabalho é pautado na mineração responsável e no compromisso com as pessoas, com o meio ambiente e com o desenvolvimento sustentável.

Temos responsabilidade e orgulho de valorizar a multiplicidade de perspectivas e experiências que a diversidade proporciona, seja ela baseada em gênero, etnia, orientação sexual, deficiência, formação cultural, religião ou idade.

Acreditamos que podemos desenvolver, juntos, o potencial individual e coletivo.

Para saber mais sobre a AngloGold Ashanti, acesse www.anglogoldashanti.com.br. 
Show more Show less","['Safety Compliance', 'Teamwork', 'Attention to Detail', 'Operational Procedures', 'Manual Handling', 'Equipment Installation', 'Drilling Assistance']",Geología,2025-08-21T21:04:44,https://br.linkedin.com/jobs/view/auxiliar-de-geologia-i-at-anglogold-ashanti-north-america-4289357598,,[],2025-08-28
