job_id,source,job_title,company,location,description,skills,careers_required,date_posted,url,career_tag,soft_skills_detected,extraction_date
2950f12932c9268fc3d3c6e308445793,rapidapi2,NEOLAURATO/A INGEGNERIA CIVILE - GEOLOGIA,Comacchio SpA,"Riese Pio X, Veneto, Italy","Per una nuova divisione legata allo sviluppo di prodotti destinati all’esplorazione mineraria siamo alla ricerca di una figura di Ingegnere Civile/Geologo.
Il ruolo sarà principalmente incentrato a dare supporto alla divisione attraverso la gestione di varie attività di back-office e all’assistenza nella creazione e nella gestione della documentazione tecnica.
La figura ricoprirà un ruolo chiave nel posizionare Comacchio come punto di riferimento nel settore della perforazione per l’esplorazione, contribuendo a plasmare la percezione del marchio da parte dei clienti e a guidare il successo sul mercato.

In particolare, si occuperà di:
Partecipare attivamente alla formazione e all’organizzazione della nuova divisione con il coinvolgimento nella definizione degli obiettivi, della struttura, dei processi e dell’indirizzo strategico generale della divisione, man mano che il team crescerà.
Supportare lo sviluppo di materiali di marketing e presentazioni tecniche per comunicare l’esperienza di Comacchio nel settore della perforazione per l’esplorazione.
Collaborare strettamente con altri dipartimenti, tra cui vendite, marketing e tecnico, per allineare le esigenze dei clienti ai nostri prodotti e garantire un miglioramento continuo dei nostri prodotti e servizi.
Lavorare a stretto contatto con il top management per sviluppare e implementare la nuova divisione.

Il/la candidato/a ideale possiede:
formazione in geologia;
buone capacità organizzative e comunicative, oltre alla capacità di gestire efficacemente più attività contemporaneamente;
è fondamentale una buona conoscenza della lingua inglese

Il presente annuncio è rivolto ad entrambi i sessi, ai sensi delle leggi 903/77 e 125/91 e a persone di tutte le età e tutte le nazionalità, ai sensi dei decreti legislativi 215/03 e 216/03.
La Società, in qualità di Titolare del trattamento, raccoglie i dati personali per le finalità connesse o strumentali allo svolgimento dell’attività di ricerca e selezione del personale.
L’interessato ha il diritto di chiedere al Titolare di accedere ai propri dati personali e di rettificarli se inesatti nonché, al ricorrere dei rispettivi presupposti, di cancellarli, limitarne il trattamento ed opporsi allo stesso. Per esercitare i propri diritti, l’Interessato può contattare il Titolare all’indirizzo e-mail sales@comacchio.com. L’Interessato ha anche il diritto di proporre reclamo all’autorità di controllo competente in materia, Garante per la protezione dei dati personali (www.garanteprivacy.it).
Show more Show less","['Geology', 'Organizational Skills', 'Communication Skills', 'Technical Documentation', 'Marketing Materials', 'Collaboration', 'Customer Alignment', 'Process Improvement']",Geología,2025-08-26T11:27:38,https://it.linkedin.com/jobs/view/neolaurato-a-ingegneria-civile-geologia-at-comacchio-spa-4288892700,,[],2025-08-28
cadb486d2cf9266cf2a9737c3e8e6dea,rapidapi2,"téc. sup. de obras púb. de N1, espec. de geologia, hidrogeologia (m/f) - 1 vaga",CONTACT Moçambique,"Maputo, Cabo Delgado Province, Mozambique","No âmbito da implementação do Programa Regional de Resiliência Climática para a África Oriental e Austral (PRRC-180171), o nosso Cliente pretende recrutar.

FUNÇÃO

Será responsável por realizar levantamentos geológicos e hidrogeológicos para avaliação de potencial aquífero e identificação de pontos de captação; apoiar a DNGRH na implementação de acções do PRRC relacionadas com a gestão sustentável de aquíferos e recursos hídricos subterrâneos; elaborar relatórios técnicos sobre a viabilidade hidrogeológica de intervenções propostas; monitorar e avaliar a qualidade e quantidade de recursos hídricos subterrâneos em áreas de intervenção; apoiar na supervisão técnica de estudos e obras hidrogeológicas realizadas por terceiros; contribuir na elaboração de planos de gestão e proteção de recursos hídricos subterrâneos; promover acções de capacitação e sensibilização das comunidades locais sobre a gestão de água subterrânea; participar na recolha, processamento e sistematização de dados hidrogeológicos para a base de dados nacional; apoiar na elaboração de termos de referência para contractação de serviços especializados.

Requirements

Licenciatura em Geologia, Hidrogeologia, Engenharia Geológica ou áreas afins;
Mínimo de experiência em estudos hidrogeológicos, gestão de recursos hídricos ou áreas correlatas;
Experiência comprovada em Investigação e avaliação de recursos hídricos subterrâneos;
Idade mínima de 18 anos;
Conhecimentos sólidos em Sistemas de Informação Geográfica (SIG/GIS) e software de modelação hidrogeológica (ex.: MODFLOW, Surfer);
Capacidade de elaborar e analisar relatórios técnicos e mapas hidrogeológicos;
Boa comunicação oral e escrita em Português. Conhecimentos de Inglês constituem uma vantagem;
Disponibilidade para viagens e trabalho de campo em zonas remotas;
Nacionalidade Moçambicana

DOCUMENTOS OBRIGATÓRIOS:

Curriculum Vitae actualizado;
Certidão de Nascimento ou Bilhete de Identidade;
Possuir o número único de identificação tributária (NUIT);
Fotocópia do Certificado de Habilitações Literárias;
Declaração de compromisso de honra, que mostra que nunca foi expulso do aparelho de Estado, aposentado ou reformado

Benefits

A possibilidade de trabalhar num projecto que oferece condições salariais de acordo com a tabela em vigor na função pública, bem como oportunidades de desenvolvimento pessoal.

ENCORAJAM-SE CANDIDATURAS DO SEXO FEMININO

DATA LIMITE DE CANDIDATURA: 09 de Setembro de 2025. 
Show more Show less","['Geology', 'Hydrogeology', 'Water Resource Management', 'Technical Reporting', 'GIS', 'Hydrogeological Modeling', 'Field Work', 'Community Engagement']",Geología,2025-08-26T07:11:43,https://mz.linkedin.com/jobs/view/t%C3%A9c-sup-de-obras-p%C3%BAb-de-n1-espec-de-geologia-hidrogeologia-m-f-1-vaga-at-contact-mo%C3%A7ambique-4291243829,,[],2025-08-28
e872239138936507b8c371e000acbfa1,rapidapi2,Estagio de Geotecnia - Engenharia Civil e Geologia,Torres Geotecnia,Brazil,"Você irá oferecer uporte ao etor, realizando atividade como: - Confecção de perfi de ondagem. - Elaboração de relatório de ondagen. - Acompanhamento e organização do fluo de informaçõe proveniente de campo. - Apoio ao divero etore da emprea. Curando Engenharia Civil ou Geologia.

Formação Acadêmica

Não informado

Salário

A combinar

Cargo

Estágio em engenharia civil

Empresa

Torres Geotecnia

Perfurações e sondagens.

Ramo

Construção Civil / Engenharia Civil

(FJ) 
Show more Show less","['Geotechnics', 'Civil Engineering', 'Geology', 'Report Writing', 'Field Data Management', 'Support', 'Organization']",Geología,2025-08-26T02:38:26,https://br.linkedin.com/jobs/view/estagio-de-geotecnia-engenharia-civil-e-geologia-at-torres-geotecnia-4288843719,,[],2025-08-28
639d05e7af56f6fc9f73a22748b3c315,rapidapi2,AUXILIAR DE GEOLOGIA,IEL Empregos,"Várzea Grande, Mato Grosso, Brazil","Horário: 3 Turnos disponíveis - 4X4 / 6X3 /12X6

Contratação: Tenured - CLT labor code

Nível: Not Informed

Descrição e Responsabilidades

Auxílio à equipe de geologia no manuseio de amostras vindas do campo; Separação, pesagem e identificação de lotes de amostras; carregamento e descarregamento de amostras; organização de lotes de polpas e britados; apoio em serviços de campo sempre que solicitado.

Requisitos

Ensino Médio Completo. 
Capacidade para realizar atividades em campo (incluindo trabalhos ao ar livre, em diferentes condições climáticas). 
Proatividade e disposição para atividades operacionais,Facilidade para seguir orientações e trabalhar em equipe. 

Local: Várzea Grande MT.

Benefícios: Assistência médica, Bonificação por assiduidade, Refeição no local, Seguro de Vida, Vale-alimentação, Vale-transporte 
Show more Show less",,Geología,2025-08-25T20:04:52,https://br.linkedin.com/jobs/view/auxiliar-de-geologia-at-iel-empregos-4288822036,,[],2025-08-28
579a7f08af9e019f44594bf576aa77e6,rapidapi2,"GERENTE DE GEOLOGIA, PLANEJAMENTO DE MINA E LABORATÓRIO NIQUEL– GERÊNCIA DE SERVIÇOS TÉCNICOS DE ONÇA PUMA – VALE METAIS BÁSICOS",Vale,"Ourilândia do Norte, Pará, Brazil","Atenção: é necessário anexar seu currículo no ato da inscrição. 

Onde tem evolução, a Vale está. 

A Vale Metais Básicos é uma empresa autônoma do Grupo Vale com operações no Brasil, Canadá, Reino Unido e Japão. O foco é a produção dos minerais essenciais para a transição energética.

Nossa transformação cultural: 

A Vale Metais Básicos é uma mineradora que busca acelerar a transição para um mundo mais sustentável, que coloca a segurança no centro de tudo o que faz e trabalha para construir soluções para os desafios da humanidade - transformando, hoje, o futuro. Aprendemos juntos, e seguimos comprometidos com a nossa transformação cultural para gerar, com as pessoas, valor e impacto positivo por meio das nossas atividades. Avançando a cada dia, nos sentimos prontos para cultivar relações sólidas e estabelecer sempre o diálogo aberto com a sociedade.

# vemcomavale #ValeMetaisBásicos 

Conheça mais do nosso propósito: 

https://www.youtube.com/watch?v=MUpLjGKLmSc 

https://www.vale.com/pt/home 

Quer conhecer nossa oportunidade? 

N° do CD (Cargo disponível): 1085709

N° de Vagas: 01

Formação: Ensino Superior Completo em Engenharia de Minas ou em Geologia

Localidade: Ourilândia do Norte, Pará, Brasil

Horário de Trabalho: Administrativo

Modalidade de Trabalho: Onsite (presencial)

Tipo de contrato: Indeterminado

Período de inscrição: de 24/08/2025 a 01/09/2025

Requisitos necessários: 

Disponibilidade para residir em Ourilândia do Norte ou em Tucumã 
Ensino Superior Completo em Engenharia de Minas ou em Geologia 
CREA Ativa 
Sólida experiência com Planejamento de Mina e Geologia 
Experiência com gestão de equipe 
Conhecimento em Geotecnia 
CNH categoria B definitiva 
Inglês intermediário 
Pacote Office Avançado 

Requisitos desejáveis :

Experiência com Operação de Níquel ou com Minas Lateritas 
Inglês avançado 

Responsabilidades e atividades do cargo: 

Ser responsável pela definição da estratégia do negócio, no que tange à planejamento de lavra de Curto e médio prazos, alinhado ao Master Plan e a estratégia do negócio atual e futura; 
Garantir as premissas e indicadores operacionais e de manutenção para suportar o Life Of Mine Plan e Reserva Mineral, Plano de mina de médio Prazo, governança de plano de mina de curto prazo e geologia de curto e médio prazo; 
Realizar estudos técnicos de Mineração (Frota, Perfuração, Desmonte e infraestrutura de mina e controle de qualidade); Estudos de fechamento de mina, Desenvolvimento de Processos Minerais; 
Garantir a gestão e os estudos de projetos minerais bem como o suporte às operações em Tecnologia Mineral; 
Garantir as execuções dos padrões Geotécnicos, inspeções e reporte para o C-level das condições geotécnicas da unidade; Gestão de Barragens e Rejeitos, Hidrogeologia Geotecnia de Cavas e Pilhas de minério e estéril; Geomecânica de Rochas e solos, Suporte técnico e monitoramento Geotécnico; Ensaios e diagnósticos Geotécnicos; 
Ser responsável pelas inspeções e Declarações de Condição de estabilidade das barragens e diques (RTFR); 
Manter e operacionalizar o Centro de Monitoramento Geotécnico local; Programa de garantia de qualidade/controle de qualidade (GQ/CQ) de construção e manutenção de registros; Cumprimento dos requisitos de regulação, das normas HSEC e orientações pertinentes; 
Garantir a execução da normatização, governança e check do VPS; Iniciativa de estabilidade e melhoria operacional; Otimização de processos e eliminação de desperdícios (Lean); Coordenação de Melhoria Contínua; Estratégia de Manutenção; Academia VPS; Fomento de uma cultura de Excelência Operacional; 
Liderar e direcionar o Planejamento Integrado de Negócios para a unidade; 
Garantir engajamento, colaboração e integração entre todos os envolvidos no processo de Planejamento Integrado de Negócios (incluindo Operações, Vendas e Marketing e Finanças) e processos adjacentes; 
Apoiar o desenvolvimento e implementação de ferramentas de otimização para as decisões estratégicas de otimização de valor da cadeia do negócio; 
Ser o interlocutor nos órgãos regulatórios nacionais, tal como a Agência Nacional de Mineração – ANM, CREA e SEMAS. 

Um pouco do que a Vale Metais Básicos oferece para você 

Previdência Privada: garantia de um futuro tranquilo, com segurança financeira para a aposentadoria. 
PLR - Programa de Participação nos Lucros e Resultados: reconhecimento pelos esforços de todos, com participação nos lucros da empresa 
Assistência Médica e Hospitalar, Odontológica: Cuidados de saúde completos para empregados e seus dependentes, prezando por aquilo que é prioritário em garantir: Saúde e qualidade de vida; 
Reembolso Creche ou Auxílio Babá: apoio para conciliar o retorno ao trabalho com a chegada de um filho - até os 6 anos dos dependentes; 
PASA - Planos de saúde para familiares ou para o próprio empregado, em caso de aposentadoria ou desligamento; 
Vale alimentação: suporte financeiro para compras de itens de mercado; 
Vale refeição ou Refeições no trabalho: benefício para facilitar a rotina e promover hábitos saudáveis na alimentação diária; 
Apoiar - Programa de Assistência ao Empregado e Dependentes: suporte emocional e social especializados para empregados e suas famílias; 
Cartão Presente de Natal para Dependentes: um gesto de carinho no final do ano - para dependentes até 10 anos; 
Transporte fretado ou Vale transporte: garantia de deslocamento diário de nossos empregados para o ambiente de trabalho; 
Incentivo à atividade física - Wellhub: promoção de saúde física e bem-estar com programas de atividade física; 
Programa Bem-Estar: cuidados integrais para melhorar a qualidade de vida dos empregados; 
Clube de Vantagens: Descontos e benefícios exclusivos para compras em estabelecimentos parceiros. 

Como é trabalhar na Vale Metais Básicos? 

Na Vale Metais Básicos, contribuímos para a formação de futuros. Da mineração, do planeta e o seu. Oferecemos oportunidades para diversas áreas e objetivos profissionais.

Aqui, nossos talentos constroem juntos um ambiente colaborativo e inclusivo que valoriza a pessoa como ela é: sua individualidade, seu protagonismo e comprometimento.

Na Vale Metais Básicos, aprendemos juntos. Acreditamos na riqueza das experiências do dia a dia e na troca de conhecimento entre os talentos. Aqui, todo momento pode e deve ser um aprendizado.

Na Vale Metais Básicos, também crescemos juntos. Estabelecemos relações sólidas e de valor compartilhado com os nossos empregados e a sociedade. Assim, demonstramos nosso comprometimento com um legado positivo, resultados consistentes e com a construção de uma mineração com processos mais inovadores e sustentáveis: a mineração do futuro.

Onde tem futuro, o Grupo Vale está. 

Ficou curioso para conhecer um pouco mais do Grupo Vale? Acesse www.vale.com e https://vale.com/pt/basemetals

Conheça também nossa Política de diversidade

A Vale e a Vale Metais Básicos não realizam nenhum tipo de cobrança para participação em nenhuma etapa dos seus processos seletivos. Todas as candidaturas devem ser feitas exclusivamente pelo nosso site ou por meio de vagas postadas no perfil da Vale no LinkedIn . 

Obs: Se você já se candidatou a esta vaga anteriormente, o botão para o envio de candidatura não estará disponível. Caso seja selecionado no processo seletivo, entraremos em contato para informar sobre o resultado da seleção. 
Show more Show less","['Mining Engineering', 'Geology', 'Team Management', 'Geotechnics', 'Intermediate English', 'Advanced Office Suite', 'Nickel Operation Experience', 'Laterite Mines Experience']",Geología,2025-08-24T05:07:55,https://br.linkedin.com/jobs/view/gerente-de-geologia-planejamento-de-mina-e-laborat%C3%B3rio-niquel%E2%80%93-ger%C3%AAncia-de-servi%C3%A7os-t%C3%A9cnicos-de-on%C3%A7a-puma-%E2%80%93-vale-metais-b%C3%A1sicos-at-vale-4290129673,,[],2025-08-28
da7379b80a6260c25d1496a46efc9e61,rapidapi2,Estagiario a geologia,Netvagas,"Belo Horizonte, Minas Gerais, Brazil","Estamos em busca de um(a) estagiário(a) proativo(a), comprometido(a) e com interesse em desenvolver seus conhecimentos na área de Geologia. O(A) estagiário(a) irá atuar em conjunto com a equipe técnica, participando das atividades de campo e de escritório, com foco no mapeamento geológico, amostragem, controle de qualidade e banco de dados, estimativa de recursos e análise estatística de dados.

Como estagiário(a) de Geologia, você terá a chance de participar de diversas atividades, incluindo:

Acompanhar na coleta e análise de amostras de solo, rocha e água;
Acompanhar atividades de campo, como mapeamento geológico e sondagens;
Realizar pesquisas e levantamentos bibliográficos sobre temas relacionados à Geologia;
Participar da elaboração de relatórios e laudos;
Contribuir com ideias e sugestões para a melhoria dos processos e atividades.

Requisitos

Estar cursando Geologia a partir do 7° período;
Desejável conhecimento básico dos principais softwares de geologia.
Inglês no nível mínimo intermediário requerido.
Interesse por atividades de campo e prática geológica aplicada;
Organização e atenção a detalhes em registros, classificações e dados técnicos;
Postura responsável, com respeito às normas de segurança e ao meio ambiente;
Facilidade para trabalhar em equipe e comunicar-se com clareza;
Autonomia para executar tarefas sob supervisão e disposição para aprender;
Proatividade para lidar com desafios do trabalho geológico em campo.

Benefícios

Plano de Saúde;
Plano Odontologico;
Seguro de Vida;
Ajuda de custo;

Junte-se a nós nesta jornada de aprendizado e crescimento. Envie seu currículo e venha fazer parte da nossa equipe! 
Show more Show less",,Geología,2025-08-23T13:35:17,https://br.linkedin.com/jobs/view/estagiario-a-geologia-at-netvagas-4290400498,,[],2025-08-28
37abe5151cd276bdf65c60846cf3e775,rapidapi2,Estagio de Geotecnia - Engenharia Civil e Geologia - MG,Torres Geotecnia,Brazil,"Você irá oferecer uporte ao etor, realizando atividade como: - Confecção de perfi de ondagem. - Elaboração de relatório de ondagen. - Acompanhamento e organização do fluo de informaçõe proveniente de campo. - Apoio ao divero etore da emprea. Curando Engenharia Civil ou Geologia.

Formação Acadêmica

Não informado

Salário

A combinar

Cargo

Estágio em engenharia civil

Empresa

Torres Geotecnia

Perfurações e sondagens.

Ramo

Construção Civil / Engenharia Civil

(EI) 
Show more Show less","['Geotechnics', 'Civil Engineering', 'Geology', 'Report Writing', 'Field Data Management', 'Support', 'Organization']",Geología,2025-08-23T02:37:02,https://br.linkedin.com/jobs/view/estagio-de-geotecnia-engenharia-civil-e-geologia-mg-at-torres-geotecnia-4287190984,,[],2025-08-28
