job_id,source,job_title,company,location,description,skills,careers_required,date_posted,url,career_tag,soft_skills_detected,extraction_date
eb734ae14ba96a52ed5aa85ebd1d9e90,rapidapi2,256876 - SERTAOZINHO - OP MONTAGEM MECANICA III - AJUDANTE CALDEIRARIA,WEG,"Sertãozinho, São Paulo, Brazil","Descrição da vaga

Responsável por atuar no processo de montagem mecânica; auxiliando em atividades de caldeiraria (buscar ferramentas e materiais, rebarbar, limpar , ajudar na pré montagem) e outras atividades similares.

Responsabilidades e atribuições

Realizar atividades de acabamento em produtos e ou materiais (rebarbação,limpeza,etc).

Buscar materiais e ferramentas que serão utilizados no trabalho.

Auxiliar na pré montagem de componentes.

Realizar limpeza e conservação de máquinas, equipamentos ou local de trabalho, visando mantê-los em perfeito estado de funcionamento e utilização.

Realizar banho químico em tubulações utilizando ácido com ação decapante, desengraxante e fosfatizante.

Ler e interpretar normas, procedimentos, especificações, desenhos, instrumentos de medição ou orientações gerais a respeito das atividades a serem desenvolvidas.

Exercer o autocontrole em cada operação ou tarefa, observando os parâmetros de qualidade estabelecidos, frequência de inspeção e o resultado esperado, conforme descrito nas normas operacionais, avaliando visualmente ou através de equipamentos de medição, registrando os resultados obtidos.

Executar outras atividades similares as acima descritas, de acordo com solicitação do superior imediato.

Requisitos e qualificações

Grau de Instrução 

Ensino Fundamental Completo

Cursos Obrigatórios

NR-11: OPERADOR DE PONTE ROLANTE NÃO EMBARCADA
NR-35: SEGURANÇA PARA TRABALHOS EM ALTURA

Venha ser WEG você também

A WEG cresce a cada dia e abre oportunidades para pessoas que criam, inovam e buscam o desenvolvimento para crescer com ela. Se você é uma dessas pessoas e quer fortalecer sua carreira numa empresa sólida, de presença global, escolha aqui o seu lugar.

Valorizamos a geração de oportunidades de desenvolvimento profissional e pessoal, os direitos humanos, a diversidade e o meio ambiente. Investimos nas soluções para redução de emissões e na promoção social em comunidades onde estamos inseridos com foco na saúde e educação.

Trabalhamos em equipe, com ambiente aberto e propício ao debate e troca de ideias. Reunimos e compartilhamos conhecimentos e habilidades para aprimorar constantemente nosso processo de decisão.

Promovemos, através de um sistema estruturado de governança em todos os níveis, a transparência, integridade, ética e segurança em tudo o que fazemos, respeitando os direitos de todas as partes interessadas.

Priorizamos a simplicidade em nossas relações e perseguimos o aumento da eficiência e competitividade tornando nossos produtos e processos cada vez melhores. Buscamos permanentemente fazer mais com menos, com excelência na execução.

Investimos em pesquisa, desenvolvimento, inovação e qualidade, buscando formas de melhor atender a sociedade em transformação. Constantemente nos adaptamos, com flexibilidade, para atender as necessidades dos nossos clientes.

Desenvolvemos pessoas para exercerem com excelência o seu papel no desdobramento da estratégia e na manutenção e disseminação da cultura da empresa. 
Show more Show less","['Mechanical Assembly', 'Metalworking', 'Tool Handling', 'Cleaning', 'Component Pre-assembly', 'Machine Maintenance', 'Chemical Bath Application', 'Quality Control', 'Norm Interpretation', 'Self-control', 'Safety Procedures', 'Teamwork', 'Problem Solving', 'Adaptability', 'Innovation', 'Development']",Mecánica,2025-08-25T19:18:51,https://br.linkedin.com/jobs/view/256876-sertaozinho-op-montagem-mecanica-iii-ajudante-caldeiraria-at-weg-4290840857,,[],2025-08-28
c6e4a1ffa95b74cfe615241a13cf6a57,rapidapi2,256874 - SERTAOZINHO - OP MONTAGEM MECANICA III - AJUDANTE CALDEIRARIA,WEG,"Sertãozinho, São Paulo, Brazil","Descrição da vaga

Responsável por atuar no processo de montagem mecânica; auxiliando em atividades de caldeiraria (buscar ferramentas e materiais, rebarbar, limpar , ajudar na pré montagem) e outras atividades similares.

Responsabilidades e atribuições

Realizar atividades de acabamento em produtos e ou materiais (rebarbação,limpeza,etc).

Buscar materiais e ferramentas que serão utilizados no trabalho.

Auxiliar na pré montagem de componentes.

Realizar limpeza e conservação de máquinas, equipamentos ou local de trabalho, visando mantê-los em perfeito estado de funcionamento e utilização.

Realizar banho químico em tubulações utilizando ácido com ação decapante, desengraxante e fosfatizante.

Ler e interpretar normas, procedimentos, especificações, desenhos, instrumentos de medição ou orientações gerais a respeito das atividades a serem desenvolvidas.

Exercer o autocontrole em cada operação ou tarefa, observando os parâmetros de qualidade estabelecidos, frequência de inspeção e o resultado esperado, conforme descrito nas normas operacionais, avaliando visualmente ou através de equipamentos de medição, registrando os resultados obtidos.

Executar outras atividades similares as acima descritas, de acordo com solicitação do superior imediato.

Requisitos e qualificações

Grau de Instrução 

Ensino Fundamental Completo

Cursos Obrigatórios

NR-11: OPERADOR DE PONTE ROLANTE NÃO EMBARCADA
NR-35: SEGURANÇA PARA TRABALHOS EM ALTURA

Venha ser WEG você também

A WEG cresce a cada dia e abre oportunidades para pessoas que criam, inovam e buscam o desenvolvimento para crescer com ela. Se você é uma dessas pessoas e quer fortalecer sua carreira numa empresa sólida, de presença global, escolha aqui o seu lugar.

Valorizamos a geração de oportunidades de desenvolvimento profissional e pessoal, os direitos humanos, a diversidade e o meio ambiente. Investimos nas soluções para redução de emissões e na promoção social em comunidades onde estamos inseridos com foco na saúde e educação.

Trabalhamos em equipe, com ambiente aberto e propício ao debate e troca de ideias. Reunimos e compartilhamos conhecimentos e habilidades para aprimorar constantemente nosso processo de decisão.

Promovemos, através de um sistema estruturado de governança em todos os níveis, a transparência, integridade, ética e segurança em tudo o que fazemos, respeitando os direitos de todas as partes interessadas.

Priorizamos a simplicidade em nossas relações e perseguimos o aumento da eficiência e competitividade tornando nossos produtos e processos cada vez melhores. Buscamos permanentemente fazer mais com menos, com excelência na execução.

Investimos em pesquisa, desenvolvimento, inovação e qualidade, buscando formas de melhor atender a sociedade em transformação. Constantemente nos adaptamos, com flexibilidade, para atender as necessidades dos nossos clientes.

Desenvolvemos pessoas para exercerem com excelência o seu papel no desdobramento da estratégia e na manutenção e disseminação da cultura da empresa. 
Show more Show less","['Mechanical Assembly', 'Metalworking', 'Tool Handling', 'Cleaning', 'Component Pre-assembly', 'Chemical Bath', 'Quality Control', 'Norm Interpretation']",Mecánica,2025-08-25T19:03:51,https://br.linkedin.com/jobs/view/256874-sertaozinho-op-montagem-mecanica-iii-ajudante-caldeiraria-at-weg-4290839929,,[],2025-08-28
8fe73f8f2fcea8d72aef5168c309a246,rapidapi2,Tecnico de projetos mecanica e usinagem,Netvagas,"Sete Lagoas, Minas Gerais, Brazil","Técnico de Projetos - Mecânica e Usinagem

Principais Responsabilidades

Elaborar projetos de sistemas mecânicos, analisando especificações técnicas, dimensionamentos e selecionar os componentes adequados;
Desenvolver desenhos técnicos, diagramas e documentação de suporte para os projetos;
Acompanhar a fabricação, montagem e testes dos protótipos e produtos finais;
Identificar oportunidades de melhoria nos processos e propor soluções eficientes;
Realizar a interface entre as áreas de Engenharia, Produção e Qualidade, garantindo a execução dos projetos dentro dos prazos e especificações;
Prestar suporte técnico à equipe de Produção, quando necessário.

Requisitos

Requisitos:

Ensino Superior completo em Engenharia Mecânica, Mecatrônica ou áreas afins;
Experiência comprovada de 3 a 5 anos na elaboração de projetos mecânicos e usinagem;
Conhecimento sólido em desenho técnico, CAD (AutoCAD, SolidWorks), cálculos de mecânica e dimensionamento de componentes;
Familiaridade com normas técnicas, processos de fabricação e ferramentas de usinagem;
Boa comunicação, proatividade e capacidade de trabalhar em equipe.
Show more Show less",,Mecánica,2025-08-25T14:16:50,https://br.linkedin.com/jobs/view/tecnico-de-projetos-mecanica-e-usinagem-at-netvagas-4290900995,,[],2025-08-28
029a64aa5099e598244d61136a2d1cf7,rapidapi2,Auxiliar De Engenharia Mecanica - Recrutamento Aberto,NUTEP S/A Indústria Metalúrgica,"Betim, Minas Gerais, Brazil","Área: Mecânica

Local: Betim-MG

Atribuições:  Controle de esboço e atualização de desenhos/ projetos;  Controle e monitoramento de desenhos de produto e processo;  Cadastro de produto;  Desenvolver cálculo do processo;  Atualização de desenhos conforme demanda;  Responsável por organizar o cronograma e programar as manutenções preventivas e corretivas.  Indicadores de manutenção;  Auxiliar no desenvolvimento de projetos de ferramentas;

Requisitos: AutoCAD Cursando Engenharia Mecanica

Escolaridade: Ensino Médio 
Show more Show less","['AutoCAD', 'Mechanical Engineering', 'Project Management', 'Maintenance', 'Product Development', 'Process Calculation', 'Drawing Control', 'Preventive Maintenance', 'Corrective Maintenance', 'Tool Development']",Mecánica,2025-08-25T07:46:30,https://br.linkedin.com/jobs/view/auxiliar-de-engenharia-mecanica-recrutamento-aberto-at-nutep-s-a-ind%C3%BAstria-metal%C3%BArgica-4288537433,,[],2025-08-28
db61ee9d2eb5507253fd137f74483789,rapidapi2,Auxiliar De Engenharia Mecanica - Vagas Disponíveis,NUTEP S/A Indústria Metalúrgica,"Betim, Minas Gerais, Brazil","Área: Mecânica

Local: Betim-MG

Atribuições:  Controle de esboço e atualização de desenhos/ projetos;  Controle e monitoramento de desenhos de produto e processo;  Cadastro de produto;  Desenvolver cálculo do processo;  Atualização de desenhos conforme demanda;  Responsável por organizar o cronograma e programar as manutenções preventivas e corretivas.  Indicadores de manutenção;  Auxiliar no desenvolvimento de projetos de ferramentas;

Requisitos: AutoCAD Cursando Engenharia Mecanica

Escolaridade: Ensino Médio 
Show more Show less","['AutoCAD', 'Mechanical Engineering', 'Project Management', 'Maintenance', 'Product Development', 'Process Calculation', 'Drawing Control', 'Preventive Maintenance', 'Corrective Maintenance', 'Tool Development']",Mecánica,2025-08-25T07:46:30,https://br.linkedin.com/jobs/view/auxiliar-de-engenharia-mecanica-vagas-dispon%C3%ADveis-at-nutep-s-a-ind%C3%BAstria-metal%C3%BArgica-4288537433,,[],2025-08-28
2e5ced0d75e157ac51e3b1f20314930f,rapidapi2,Tecnico de desenvolvimento de produto mecanica e usinagem,Netvagas,"Sete Lagoas, Minas Gerais, Brazil","Técnico de Desenvolvimento de Produto - Mecânica e Usinagem

Como Técnico de Desenvolvimento de Produto - Mecânica e Usinagem, suas responsabilidades incluirão:

Participar ativamente do processo de concepção e desenvolvimento de novos produtos, com foco em soluções mecânicas e de usinagem;
Realizar análises técnicas, testes e validações de protótipos, garantindo a conformidade com as especificações de projeto;
Colaborar com a equipe de engenharia no aprimoramento contínuo dos processos de fabricação, visando maior eficiência e qualidade;
Fornecer suporte técnico e soluções de engenharia para atender às demandas dos clientes;
Documentar e registrar todas as etapas do desenvolvimento de produtos, mantendo um histórico preciso.

Requisitos

Para se qualificar para essa posição, os seguintes requisitos são essenciais:

Formação técnica em Mecânica, Usinagem ou áreas afins;
Experiência comprovada de, no mínimo, 3 anos em projetos de desenvolvimento de produto, com conhecimento em CAD, simulação e processos de fabricação;
Familiaridade com sistemas de controle numérico computadorizado (CNC) e habilidade em interpretação de desenhos técnicos;
Proficiência em ferramentas de modelagem e projeto, como AutoCAD, SolidWorks ou similares;
Capacidade de trabalhar em equipe, com boas habilidades de comunicação e resolução de problemas.
Show more Show less",,Mecánica,2025-08-25T07:26:28,https://br.linkedin.com/jobs/view/tecnico-de-desenvolvimento-de-produto-mecanica-e-usinagem-at-netvagas-4290655806,,[],2025-08-28
3b0292adaa06455d3eb6193fec8171dd,rapidapi2,Analista de projetos engenharia de produto mecanica e usinagem,Netvagas,"Sete Lagoas, Minas Gerais, Brazil","Projetar, planejar e implantar processos de usinagem e de montagem de autopeças capazes de garantir

as especificações de qualidade do produto dentro dos prazos estipulados pelo cliente e dos custos

definidos.

Gestão de Projeto - Projetar o processo:

Conceber as etapas e definir os meios e recursos necessários ao

processo de usinagem e de montagem de autopeça feita em alumínio e

ferro fundido visando atender as especificações do produto dentro dos

custos definidos.

Gestão de Projeto - Planejar as etapas do projeto:

Elaborar o cronograma de atividades para o projeto de introdução de

novos produtos e modificações de produtos considerando os prazos

para instalação dos meios e uso dos recursos necessários para

garantir a qualidade do produto nos prazos estipulados pelo cliente.

Gestão de Projeto - Implantar:

Direcionar a equipe multifuncional do projeto.

Gestão de Projeto - Implantar:

Acompanhar o plano de atividades preparando relatórios gerenciais com

plano de ações para reduzir riscos do projeto. comunicando aos clientes

externos e internos a situação de desenvolvimento do projeto.

Gestão de Projeto - Implantar:

Comunicar aos clientes externos e internos a situação de desenvolvimento

do projeto

Gestão de Projeto - Assistência:

Dar assistência técnica sobre o produto e processo para a equipe de

manufatura.

Gestão de Compliance:

Comprometer-se a aderir ao código de conduta ética, assim como

às políticas, procedimentos e à legislação em vigor.

Requisitos

Conhecimentos Específicos:

Conhecimentos de processos de usinagem de metais e de aplicação de ferramentas de corte;

Conhecimento de desenho técnico mecânico, de hidráulica e pneumática industrial;

Domínio no uso dos softwares SOLIDWORKS e MS-Project modulo básico e das ferramentas de

Informática pacote OFFICE Ambiente WINDOWS (EXCEL, WORD, POWERPOINT);

Conhecimentos sobre a elaboração do APQP conforme norma IATF16949 e nos processos de FMEA,

PPAP, M.S.A., CEP e aplicação das ferramentas básicas da Qualidade;

Conhecimento de análise de tempos e movimentos industriais;

Formação em Gestão de Projetos.

Treinamentos Obrigatórios

TBI
MSA
APQP
PPAP
CEP
PFMEA
DFA/DFM
Ferramentas Básicas da Qualidade
Poka Yoke
DOE
GD&T
Show more Show less",,Mecánica,2025-08-25T01:30:59,https://br.linkedin.com/jobs/view/analista-de-projetos-engenharia-de-produto-mecanica-e-usinagem-at-netvagas-4290622964,,[],2025-08-28
d03a0397488a88d59f9d9cb64b2f632d,rapidapi2,Orcamentista engenharia de produto mecanica e usinagem,Netvagas,"Sete Lagoas, Minas Gerais, Brazil","Elaborar os orçamentos técnicos internos para os novos produtos ou modificações de produto,

analisar a exequibilidade para o novo produto proposto e fazer a previsão de investimento necessária

para o processo de manufatura.

Elaborar orçamentos internos para novos projetos, analisando o desenho

e documentação técnica, preparando o fluxograma do processo, o estudo

de tempo de usinagem, lay out, investimento e previsão orçamentista e

cronograma de instalação, para preparar a documentação para análise

gerencial com solução de usinagem;

Analisar a exequibilidade de novos produtos, analisando a

documentação técnica recebida e propondo um plano de ações, visando

assegurar que todas as informações necessárias sejam esclarecidas e os

recursos necessários previstos;

Fazer a previsão técnica de investimentos participando de reuniões

técnicas com os clientes e propondo processos e mudanças no produto, a

fim de adequar o orçamento técnico a necessidade do cliente.

Comprometer-se a aderir ao código de conduta ética, assim como às

políticas, procedimentos e à legislação em vigor.

Requisitos:

Escolaridade Exigida: Técnico Mecânica ou afins

Escolaridade Desejável: Superior em Engenharia Mecânica

Experiencia exigida: 6 meses

Experiencia desejável: 1 ano

Conhecimentos Específicos:

Idioma (nível do idioma)

Inglês Básico

Conhecimentos Específicos:

Leitura e Interpretação de desenho técnico;

Pacote Office ambiente Windows (Word, Excel, Powerpoint);

Domínio uso software AUTOCAD;

Domínio uso software SOLIDWORKS;

Treinamentos Obrigatórios:

TBI
Domínio uso software CATIA;
Domínio uso software NX;
Custos e formação de preços industriais;
Elaboração de propostas técnicas e comercial
Show more Show less",,Mecánica,2025-08-25T01:30:52,https://br.linkedin.com/jobs/view/orcamentista-engenharia-de-produto-mecanica-e-usinagem-at-netvagas-4290622945,,[],2025-08-28
2b0c2cee1581a8a866eb63c5bc6b3c9b,rapidapi2,TECNICO EM MECANICA,G4F,"Fortaleza, Ceará, Brazil","Estamos buscando um talento para a posição de Técnico em Climatização (Presencial)

A G4F é uma empresa com uma trajetória sólida de 15 anos, dedicada a conectar pessoas, ideias e tecnologia para oferecer soluções inovadoras. Somos mais de 8.000 #greaters atuando em todo o Brasil.

Requisitos e Qualificações

Formação Técnica em Mecânica, com registro ativo e regular no conselho profissional da categoria.
Domínio do sistema operacional Windows e ferramentas como: Navegadores de internet;
Correio eletrônico;
Editores de texto, apresentações e planilhas eletrônicas (Pacote Office ou similar).
Leitura e interpretação de projetos técnicos.
Conhecimento em softwares de desenho técnico como AutoCAD, ZWcad, entre outros da área.
Sólida experiência em: Manutenção predial;
Instalações elétricas;
Manutenção de sistemas de ar-condicionado, grupos geradores e/ou elevadores.
Executar manutenções preventivas e corretivas em sistemas de climatização.
Diagnosticar e solucionar falhas técnicas, realizando ajustes conforme especificações do fabricante.
Elaborar relatórios técnicos detalhados sobre as atividades realizadas.
Acompanhar o desempenho dos sistemas e propor melhorias contínuas na operação e manutenção.

Informações Adicionais

🏡Atuação presencial - Passaré

🚀Oportunidades de desenvolvimento profissional

🍔Vale Alimentação/Refeição | Wiipo Flex

🏋️‍♀️TotalPass | Bem-estar para todos os colaboradores, todos os dias

👓Parceria SESC | Saúde, Lazer, Turismo & Esportes, Assistência Social e Alimentação

📕Parcerias Educacionais

🤍Seguro de vida

#VemSerGreater

Valorizamos a diversidade, equidade e a inclusão, independentemente de gênero, raça, etnia, orientação sexual, deficiência ou religião, portanto, todas as nossas vagas são afirmativas.

Junte-se à nossa equipe e contribua para o crescimento sustentável da G4F!💙

Show more Show less","['Mechanical Engineering', 'Windows Operating System', 'Technical Project Interpretation', 'Technical Drawing Software', 'Building Maintenance', 'Electrical Installations', 'Air Conditioning Maintenance', 'Generator Maintenance', 'Elevator Maintenance', 'Preventive Maintenance', 'Corrective Maintenance', 'Technical Reporting', 'System Performance Monitoring', 'Continuous Improvement']",Mecánica,2025-08-25T01:08:28,https://br.linkedin.com/jobs/view/tecnico-em-mecanica-at-g4f-4290518590,,[],2025-08-28
b9a5b12e7a04b231ae4a303ef2e1af6c,rapidapi2,Chefe de mecanica luis eduardo magalhaes ba,Netvagas,"Luís Eduardo Magalhães, Bahia, Brazil","Sobre a Empresa

Nosso cliente é uma empresa que atua no agronegócio com foco em culturas como soja, algodão e milho, e possui operações altamente mecanizadas, pois acredita que o investimento constante em tecnologia proporciona melhor aproveitamento do tempo e da terra, gerando mais frutos e retorno dos recursos investidos.

Principais Atividades Ou Funções

Realizar manutenções corretivas e preventivas em máquinas agrícolas;

Gerenciar os recursos técnicos e humanos, promovendo o desenvolvimento da equipe.

Planejar e acompanhar execução das atividades de manutenção com foco em segurança, agilidade e qualidade.

Requisitos

Formação técnica em Mecânica ou Eletromecânica;

Graduação na área será um diferencial;

Experiência sólida em manutenções corretivas e preventivas de máquinas de plantio, colheitadeiras de soja, milho e algodão, tratores de linha pesada e pulverizadores.

CNH categoria AB;

Benefícios

PPR;

Plano de saúde;

Seguro de vida;

Auxílio mobilidade;

Refeitório na fazenda;

Alojamento no local. 
Show more Show less",,Mecánica,2025-08-24T19:25:37,https://br.linkedin.com/jobs/view/chefe-de-mecanica-luis-eduardo-magalhaes-ba-at-netvagas-4290493978,,[],2025-08-28
8c98c495fcd0da2e9b23f061ca11dcfc,rapidapi2,Gerente de oficina mecanica de veiculos,Netvagas,Brazil,"Venha se juntar a nossa equipe e assumir o cargo de Gerente de Oficina Mecânica de Veículos de nível Pleno! Aqui, você terá a oportunidade de liderar uma equipe dedicada e implementar soluções inovadoras para garantir a excelência no atendimento aos nossos clientes.

Como Gerente De Oficina, Você Será Responsável Por

Gerenciar a equipe de mecânicos, supervisionar suas atividades e garantir a qualidade dos serviços prestados.
Planejar e organizar a rotina da oficina, garantindo a eficiência dos processos e o cumprimento de prazos.
Analisar relatórios e indicadores de desempenho para identificar oportunidades de melhoria.
Manter contato com fornecedores e clientes, negociando prazos, preços e condições de atendimento.
Participar ativamente do desenvolvimento de novos procedimentos e protocolos de manutenção.
Supervisionar a manutenção preventiva e corretiva dos veículos.
Garantir o cumprimento de normas de segurança e de procedimentos internos.

Requisitos

Para assumir essa posição, você deve possuir:

Experiência comprovada de no mínimo 1 anos atuando como Gerente de Oficina Mecânica de Veículos.
Conhecimento técnico sólido em mecânica automotiva e elétrica.
Habilidades de liderança, comunicação e relacionamento interpessoal.
Conhecimento em gestão de equipes, processos e indicadores.
Familiaridade com normas e legislações do setor automotivo.
Disponibilidade para trabalhar em regime de escala.

Benefícios

Oferecemos Um Pacote De Benefícios Que Inclui

Salário compatível com o mercado
Vale Transporte
Bonificação por Produtividade
Programa de desenvolvimento profissional
Estacionamento gratuito

Junte-se a nós e seja parte de uma equipe comprometida em oferecer a melhor experiência para nossos clientes. Envie seu currículo e venha fazer parte desse time vencedor! 
Show more Show less",,Mecánica,2025-08-24T19:24:43,https://br.linkedin.com/jobs/view/gerente-de-oficina-mecanica-de-veiculos-at-netvagas-4290496766,,[],2025-08-28
