job_id,source,job_title,company,location,description,skills,careers_required,date_posted,url,career_tag,soft_skills_detected,extraction_date
a768df945c5db4646f90f49e4492e984,rapidapi2,Ingeniero Mecánico Proyectos de Infraestructura e Interventoría Electromecánica,Banco de la República - Colombia,"Bogota, Capital District, RAP (Especial) Central, Colombia","El Banco de la República, comprometido con el crecimiento del país y con los principios de igualdad, diversidad e inclusión, invita a participar en esta nueva oportunidad laboral que promueve el desarrollo del talento y ofrece desafíos y experiencias retadoras:

¿Te apasiona el diseño y la supervisión de sistemas mecánicos en proyectos de alto impacto? ¿Te interesa trabajar en una entidad que promueve la sostenibilidad, la innovación y el desarrollo institucional del país? Esta es tu oportunidad para formar parte del equipo técnico del Banco de la República, donde podrás aplicar tus conocimientos en ingeniería mecánica en proyectos que transforman espacios y mejoran la infraestructura institucional.

Cargo: Ingeniero Mecánico Proyectos de Infraestructura e Interventoría Electromecánica

Misión del Cargo
Diseñar, coordinar y supervisar redes técnicas y sistemas electromecánicos en proyectos de construcción institucional, asegurando eficiencia operativa, sostenibilidad y cumplimiento técnico en todas las fases del proyecto. Este rol integra conocimientos en diseño, interventoría, contratación y tecnologías aplicadas, con un enfoque en soluciones innovadoras y sostenibles para edificaciones institucionales.

Esta oferta está dirigida a:

Personas tituladas en:
Ingeniería Mecánica. También se aceptan Ingenierías Mecatrónica o Electromecánica como áreas afines.
Se valora positivamente: Diplomados en BIM, acondicionamiento de aire, sistemas contra incendio, certificación en trabajo en alturas.

Experiencia:
Mínimo 1 año en ejecución de obras o interventoría en edificaciones institucionales, comerciales, culturales u otras similares.
Debe incluir al menos una de las siguientes actividades:
Montaje de redes de aire acondicionado, ventilación mecánica, hidrosanitarias, red contra incendio o transporte vertical.
Evaluación técnica de proyectos con relación a recursos financieros, contractuales y administrativos.

Conocimientos
Perfiles que cuenten con conocimientos en:
Diseño y seguimiento de obras de ingeniería
Contratación de proyectos.
Manejo de AutoCAD, Revit y herramientas de planeación como MS Project.
Office 365 nivel medio-avanzado.
Se valora positivamente: metodologías BIM

Condiciones de contratación

Modalidad de trabajo: Teletrabajo 4 dias casa x 1 día presencial (disponibilidad de viajes por comisión a otras sedes en promedio 2 veces al mes/ viajes cortos)

Ciudad de la vacante: Esta oferta debe ser desempeñada desde la ciudad de Bogotá o la Sabana de Bogotá tanto los dias de teletrabajo como los dias presenciales.

Tipo de Contrato: Término indefinido

Algunos beneficios: Primas extralegales, medicina prepagada, rutas entre otros.

Postúlate hasta el: miércoles 3 de septiembre.

Si cumples con los requisitos del perfil y esta oportunidad laboral es de tu interés, te invitamos a inscribirte en esta convocatoria. Si eres una persona con discapacidad y deseas participar, informa esta condición a nuestro equipo con el fin de brindarte el acompañamiento necesario. En el Banco de la República nos complacerá contar con tu participación en el proceso.

“Importante: Las ofertas de empleo del Banco de la República son completamente gratuitas y no se requiere de intermediarios para acceder o participar en las mismas.”
Show more Show less","['Mechanical Engineering', 'Project Design', 'Supervision', 'BIM', 'Air Conditioning Systems', 'Fire Protection Systems', 'AutoCAD', 'Revit', 'MS Project', 'Office 365']",Ingeniería Civil,2025-08-25T21:02:45,https://co.linkedin.com/jobs/view/ingeniero-mec%C3%A1nico-proyectos-de-infraestructura-e-interventor%C3%ADa-electromec%C3%A1nica-at-banco-de-la-rep%C3%BAblica-colombia-4290953399,,[],2025-08-28
76cfa0eea8eaa7dc507246e51a57cd84,rapidapi2,Profesional de Proyectos de Infraestructura Educacional - Calama,DRS Ingeniería y Gestión,"Calama, Antofagasta Region, Chile","En DRS Ingeniería y Gestión estamos en búsqueda de Profesional de Proyectos para proyecto de Construcción de Centro Educacional en Calama, II Región de Antofagasta. Jornada 5x2.

Requisitos:
Formación Ingeniería en Construcción o Construcción Civil
Al menos 3 años de experiencia en proyectos de edificación y/o infraestructura educacional.
Residencia en Calama

Se ofrece al profesional incorporarse en una empresa con trayectoria de más de 33 años en el mercado, con posibilidades de desarrollo profesional, en un grato ambiente laboral.
Show more Show less","['Project Management', 'Construction Engineering', 'Educational Infrastructure', 'Building Projects', 'Team Collaboration', 'Problem Solving', 'Time Management', 'Communication']",Ingeniería Civil,2025-08-25T13:18:21,https://cl.linkedin.com/jobs/view/profesional-de-proyectos-de-infraestructura-educacional-calama-at-drs-ingenier%C3%ADa-y-gesti%C3%B3n-4290695222,,[],2025-08-28
7994054e12df03119bd5cb4b8cbef62d,rapidapi2,Profesional de Proyectos de Infraestructura Educacional- Calama,DRS Ingeniería y Gestión,"Calama, Antofagasta Region, Chile","Company Description: DRS Ingeniería y Gestión

Job Description: En DRS Ingeniería y Gestión estamos en búsqueda de Profesional de Proyectos para proyecto de Construcción de Centro Educacional en Calama, II Región de Antofagasta. Jornada 5x2.

Requisitos

Formación Ingeniería en Construcción o Construcción Civil
Al menos 3 años de experiencia en proyectos de edificación y/o infraestructura educacional.
Residencia en Calama

Se ofrece al profesional incorporarse en una empresa con trayectoria de más de 33 años en el mercado, con posibilidades de desarrollo profesional, en un grato ambiente laboral. 
Show more Show less","['Project Management', 'Construction Engineering', 'Civil Engineering', 'Educational Infrastructure', 'Building Projects', 'Team Collaboration', 'Problem Solving', 'Communication', 'Planning', 'Budgeting', 'Quality Control', 'Safety Management', 'Regulatory Compliance', 'Client Relations', 'Time Management', 'Technical Skills']",Ingeniería Civil,2025-08-22T20:08:55,https://cl.linkedin.com/jobs/view/profesional-de-proyectos-de-infraestructura-educacional-calama-at-drs-ingenier%C3%ADa-y-gesti%C3%B3n-4289973622,,[],2025-08-28
