job_id,source,job_title,company,location,description,skills,careers_required,date_posted,url,career_tag,soft_skills_detected,extraction_date
0a38d1eec402cbdfbe1ef13fad3e0fa9,rapidapi2,Vendedor de material de construccion a empresas,Sodimac,"Zapopan, Jalisco, Mexico","Misi贸n Del Cargo

EXPERIENCIA EN TIENDAS ESPECIALIZADAS EN MATERIALES PARA LA CONSTRUCCIN, PISO CERMICO, BAOS Y COCINAS

Funciones Del Cargo

Ventas especializadas en construccion

Experiencia el 谩rea de Atenci贸n al Cliente, Servicio al Cliente, trabajar bajo presi贸n y objetivos, manejo de cartera de clientes,

Lograr la rentabilidad de operaciones

Coordinaci贸n de personal

Cierre de ventas con altos proveedores

Proponer estrategias para cumplir los KPIS de la compa帽铆a.

Ofrecemos

Sueldo $12,000

Apoyo para transporte $700

Vales de despensa $1200

Pago quincenal

Prestaciones de ley y superiores

Aguinaldo 30 dias

Seguro de vida

Descuento de empleados

Convenio con gym y universidades

SI ESTAS INTERESADO Y CUBRES AL 100% EL PERFIL, PROGRAMA TU CITA AL: 56 6227 7604

Por favor si estas seguro de pertenecer a esta familia Sodimac y programaste tu cita, por respeto, te pido ACUDAS. Si no estas seguro, no te postules y dale la oportunidad a alguien m谩s. Muchas gracias

Requisitos

EXPERIENCIA EN VENTAS
EXPERIENCIA EN RETAIL
EXPERIENCIA EN CONSTRUCCION

Condiciones Oferta

Sueldo neto mensual:: 12000

Descripci贸n Proceso De Selecci贸n

El proceso de selecci贸n se realiza a trav茅s de AIRA - plataforma de reclutamiento dise帽ado para mejorar tu experiencia de postulaci贸n.

Para Postular Solo Necesitas

Postular a la oferta
Revisar tu mail
Ingresar a AIRA y contestar las preguntas y/o pruebas solicitadas

Luego, si vemos que tu perfil se ajusta a lo que estamos buscando, te contactaremos por mail (a trav茅s de AIRA) para seguir a la etapa presencial. 
Show more Show less","['Sales', 'Customer Service', 'Retail', 'Construction', 'Pressure Handling', 'Client Portfolio Management', 'Sales Closing', 'Strategy Proposal', 'KPI Achievement', 'Team Coordination']",Ingenier铆a Civil,2025-08-22T00:04:06,https://mx.linkedin.com/jobs/view/vendedor-de-material-de-construccion-a-empresas-at-sodimac-4289385336,,[],2025-08-28
ca612bd7a10cafd54d41d63f5cf09622,rapidapi2,TECNICO EN CONSTRUCCION O CONSTRUCTOR CIVIL,Constructora,"Santiago, Santiago Metropolitan Region, Chile","Company Description: CONSTRUCTORA

Job Description: Estamos en b煤squeda de Constructor Civil o T茅cnico en Construcci贸n con experiencia comprobable en obras de retail, para integrarse a nuestro equipo de Oficina T茅cnica en obra ubicada en San Bernardo.

Requisitos

Formaci贸n como Constructor Civil o T茅cnico en Construcci贸n.
Experiencia m铆nima de 2 a帽os en obras de retail (excluyente).
Manejo de AutoCad, Project, Excel, documentaci贸n t茅cnica, cubicaciones, apoyo en terreno.
Disponibilidad inmediata.

Interesados enviar CV

Indicar pretensiones de renta. 
Show more Show less",,Ingenier铆a Civil,2025-08-21T20:06:17,https://cl.linkedin.com/jobs/view/tecnico-en-construccion-o-constructor-civil-at-constructora-4289349719,,[],2025-08-28
f90af27ff7345273a7f450bf116e9095,rapidapi2,OFERTA PARA PROFESIONAL DE LA CONSTRUCCION CON LICENCIA DE CONDUCIR Y EXPERIENCI,Constructora,"Concepcion, Biobio Region, Chile","Company Description: CONSTRUCTORA

Job Description: SE REQUIERE CONTRATAR PROFESIONAL DE LA CONSTRUCCIN SOLO CON LICENCIA DE CONDUCIR Y CON EXPERIENCIA PRINCIPALMENTE EN PROYECTOS PDA, MAVE Y DS 10, POR UN PERIODO DE 7 MESES, ENVIAR CURRICULUM CON PRETENSION DE SUELDO AL CORREO SEALADO EN LA OFERTA. 
Show more Show less",,Ingenier铆a Civil,2025-08-21T20:05:51,https://cl.linkedin.com/jobs/view/oferta-para-profesional-de-la-construccion-con-licencia-de-conducir-y-experienci-at-constructora-4289351358,,[],2025-08-28
a7903eb70aae109b7d64424be6fc12ec,rapidapi2,ING.EN CONSTRUCCION O CONSTRUCTOR CIVIL PARA CHILOE,STP Group of Companies,"Castro, Los Lagos Region, Chile","Company Description: STP

Job Description: Empresa del rubro de la construcci贸n busca profesional t茅cnico o ingeniero en construcci贸n, reci茅n titulado o con poca expriencia, para integrar nuestro equipo de trabajo en Chilo茅 en la ciudad de Quell贸n.

Requisitos

Disponibilidad inmediata.

Titulo de T茅cnico o Ingeniero en Contrucci贸n o Constructor civil.

Proactividad, responsabilidad y disposicion a aprender.

Computador propio

Licencia de conducir

Ofrecemos

Alojamiento

Estabilidad laboral y oporunidades de desarrollo profesional

Buen ambiente de trabajo. 
Show more Show less","['Proactivity', 'Responsibility', 'Willingness to Learn', 'Driving License']",Ingenier铆a Civil,2025-08-21T20:05:48,https://cl.linkedin.com/jobs/view/ing-en-construccion-o-constructor-civil-para-chiloe-at-stp-group-of-companies-4289350384,,[],2025-08-28
585f2dc559003b3a9ba8458ed79b1618,rapidapi2,"PROFESIONAL AREA DE LA CONSTRUCCION,",Entidad Financiera Ra铆z,"Chill谩n Viejo, Nuble Region, Chile","Company Description: ENTIDAD PATROCINANTE

Job Description: Necesitamos profesional del 谩rea de la construcci贸n para trabajar en oficina entidad patrocinante, deber谩 realizar inspecciones con trabajo de oficina, que sepa regularizar viviendas, ojala con experiencia en el 谩rea. 
Show more Show less","['Construction', 'Inspection', 'Office Work', 'Housing Regularization', 'Experience']",Ingenier铆a Civil,2025-08-21T20:05:43,https://cl.linkedin.com/jobs/view/profesional-area-de-la-construccion-at-entidad-financiera-ra%C3%ADz-4289350353,,[],2025-08-28
9bd246d8fda1016f7ce0421b107ee8fe,rapidapi2,INGENIERO CIVIL Y/O CONSTRUCCION,Empresas Rivera,"Concepcion, Biobio Region, Chile","Company Description: EMPRESAS RIVERA

Job Description: Empresas Rivera pertenece a un grupo empresarial innovador, l铆der y referente en ridos, Demolici贸n, Montaje de Estructuras, Movimiento de Tierra, Obras Civiles, Obras Viales, Reciclaje de Residuos de Construcci贸n y Demolici贸n, Transporte de Carga en Volumen Local, as铆 como Alquiler de Maquinaria Pesada y Servicios de Transporte de Residuos S贸lidos Industriales No Peligrosos. Fomentando as铆 el desarrollo de una econom铆a circular, estatal y nacional, ofreciendo calidad total en sus servicios y compromisos, trabajando con sistemas de punta y procesos certificados en calidad, brindado as铆 una satisfacci贸n garantizada a todos sus clientes.

Profesional Residente: Deber谩 contar con el t铆tulo profesional de Ingeniero Civil del 谩rea de construcci贸n o

Ingeniero Constructor o Constructor Civil, en todos los casos con a lo menos 5 a帽os de experiencia en

construcci贸n de puentes y/o conservaci贸n de estructuras de puentes desde la obtenci贸n del t铆tulo, cuya

permanencia ser谩 desde el inicio hasta t茅rmino del contrato, con dedicaci贸n exclusiva.

Buscamos Experto En Prevenci贸n De Riesgos

T茅cnico o Ingeniero.
Con experiencia en 谩reas de Construcci贸n
Renta acorde al mercado.
Show more Show less","['Civil Engineering', 'Construction', 'Risk Prevention', 'Bridge Construction', 'Structural Conservation', 'Heavy Machinery', 'Quality Assurance', 'Project Management']",Ingenier铆a Civil,2025-08-21T20:05:15,https://cl.linkedin.com/jobs/view/ingeniero-civil-y-o-construccion-at-empresas-rivera-4289350181,,[],2025-08-28
fb9de7e3827a37ada4026edb12df9d0d,rapidapi2,COORDINADOR DE CONSTRUCCION,SGS,"Piura, Peru","Descripci贸n de la empresa

Somos la empresa l铆der mundial en ensayos, inspecci贸n y certificaci贸n.

Somos reconocidos como referencia mundial en calidad e integridad. Nuestros 99,600 empleados trabajan en una red de 2,600 oficinas y laboratorios ubicados alrededor del mundo.

Descripci贸n del empleo

Coordinador Del Servicio a Cargo Del Personal De

Redes externas.

Redes internas, tuber铆a de conexi贸n.

Otros que el cliente solicite.

Coordinador con conocimientos en la Normativa Legal en Seguridad, Salud Ocupacional, Medio Ambiente, Planes de emergencias (Sistemas y t茅cnicas Contraincendios), An谩lisis de Riesgos, Conocimiento en los Est谩ndares OHSAS 18001, ISO-14001, ISO-9001, ISO 31000, NTP, ANSI OSHAS y NTP aplicables, Gesti贸n de Residuos peligrosos y programas ambientales asociados.

8 a帽os de experiencia en general, de los cuales 5 a帽os deben ser en el sector de hidrocarburos acreditados a trav茅s de cargos como residente de obra, supervisor, inspector.

Requisitos

Titulado en Ingenier铆a mec谩nica, mec谩nico-electricista, electricista, ambiental, civil, qu铆mico, arquitecto y/o industrial.
Colegiado indispensable.
Registrado en la categor铆a IG-3 (Deseable). En caso de contar con este requisito, deber谩 presentar copia del carnet.
Diplomado y/o especializaci贸n relacionada con gas natural:
NTP 111.021 (Sistema de Distribuci贸n de Gas Natural en tuber铆as de polietileno).
NTP 111.010 (Sistema de tuber铆as par instalaciones industriales).
NTP.111.011 (sistema de tuber铆a para instalaciones internas y residenciales).
RNE. G050 (Seguridad durante la construcci贸n).
ASME B31.8 dise帽o operaci贸n mantenimientos y reparaci贸n de ductos de distribuci贸n gas natural.
Postgrado y/o Diplomado en gesti贸n de proyectos (Deseable).

Informaci贸n adicional

Coordinaci贸n estrecha con el cliente y el contratista, para el control del proceso constructivo de las partidas del expediente t茅cnico, especificaciones t茅cnicas y con la ingenier铆a detallada del proyecto, considerando el cronograma de ejecuci贸n.
Coordinaci贸n en informaci贸n oportuna con el de fin de que las soluciones que se adopten ante cualquier problem谩tica sean oportunas y no generen ampliaciones de plazo y mayores gastos generales a la Contratista.
Elaborar presentaciones semanales en el comit茅 de Interventor铆a, detallando el avance de los proyectos, desviaciones de los mismos y solicitar las aprobaciones necesarias para la correcta ejecuci贸n de los contratos.
Revisar y validar las Mayores Cantidades de Obra que se den durante la ejecuci贸n de los proyectos.
Dar aprobaci贸n a las valorizaciones (firma)
Profesional deber谩 revisar y aprobar los proyectos industriales que se presenten durante el periodo del contrato en todas las ciudades de la concesi贸n.
Coordinar con LOS CONTRATISTAS el requerimiento de informaci贸n solicitado por GDP, para la absoluci贸n de las observaciones presentadas por Osinergmin.
Coordinar con el ente fiscalizador y otras entidades la ejecuci贸n de la obra.
Realizar el seguimiento mensual de la ejecuci贸n del CAPEX de acuerdo a lo propuesto a inicio de cada mes (deber谩 presentar un estatus en el comit茅 de interventor铆a).
Seguimiento y verificaci贸n de la implementaci贸n de los requisitos para las obtenciones de las licencias y permisos municipales y/o entidades del estado que apliquen.
Participar en la elaboraci贸n de las actas de liquidaci贸n de los contratos supervisados.
Show more Show less","['Construction Coordination', 'Safety Regulations', 'Occupational Health', 'Environmental Management', 'Risk Analysis', 'Project Management', 'Gas Distribution Systems', 'Technical Specifications', 'Client Coordination', 'Contract Management', 'Regulatory Compliance', 'Waste Management', 'Emergency Planning', 'Quality Standards', 'Inspection', 'Supervision']",Ingenier铆a Civil,2025-08-21T06:09:50,https://pe.linkedin.com/jobs/view/coordinador-de-construccion-at-sgs-4288741921,,[],2025-08-28
b5bb1bdc8458268cfc701c62523efa16,rapidapi2,COORDINADOR DE CONSTRUCCION,SGS,"La Victoria, Lima, Peru","Descripci贸n de la empresa

Somos la empresa l铆der mundial en ensayos, inspecci贸n y certificaci贸n.

Somos reconocidos como referencia mundial en calidad e integridad. Nuestros 99,600 empleados trabajan en una red de 2,600 oficinas y laboratorios ubicados alrededor del mundo.

Descripci贸n del empleo

Coordinador con conocimientos en la Normativa Legal en Seguridad, Salud Ocupacional, Medio Ambiente, Planes de emergencias (Sistemas y t茅cnicas Contraincendios), An谩lisis de Riesgos, Conocimiento en los Est谩ndares OHSAS 18001, ISO-14001, ISO-9001, ISO 31000, NTP, ANSI OSHAS y NTP aplicables, Gesti贸n de Residuos peligrosos y programas ambientales asociados.

8 a帽os de experiencia en general, de los cuales 5 a帽os deben ser en el sector de hidrocarburos acreditados a trav茅s de cargos como residente de obra, supervisor, inspector.

Requisitos

Titulado en Ingenier铆a mec谩nica, mec谩nico-electricista, electricista, ambiental, civil, qu铆mico, arquitecto y/o industrial.
Colegiado indispensable.
Registrado en la categor铆a IG-3 (Deseable). En caso de contar con este requisito, deber谩 presentar copia del carnet.
Diplomado y/o especializaci贸n relacionada con gas natural:
NTP 111.021 (Sistema de Distribuci贸n de Gas Natural en tuber铆as de polietileno).
NTP 111.010 (Sistema de tuber铆as par instalaciones industriales).
NTP.111.011 (sistema de tuber铆a para instalaciones internas y residenciales).
RNE. G050 (Seguridad durante la construcci贸n).
ASME B31.8 dise帽o operaci贸n mantenimientos y reparaci贸n de ductos de distribuci贸n gas natural.
Postgrado y/o Diplomado en gesti贸n de proyectos (Deseable).

Informaci贸n adicional

Coordinaci贸n estrecha con el cliente y el contratista, para el control del proceso constructivo de las partidas del expediente t茅cnico, especificaciones t茅cnicas y con la ingenier铆a detallada del proyecto, considerando el cronograma de ejecuci贸n.
Coordinaci贸n en informaci贸n oportuna con el de fin de que las soluciones que se adopten ante cualquier problem谩tica sean oportunas y no generen ampliaciones de plazo y mayores gastos generales a la Contratista.
Elaborar presentaciones semanales en el comit茅 de Interventor铆a, detallando el avance de los proyectos, desviaciones de los mismos y solicitar las aprobaciones necesarias para la correcta ejecuci贸n de los contratos.
Revisar y validar las Mayores Cantidades de Obra que se den durante la ejecuci贸n de los proyectos.
Dar aprobaci贸n a las valorizaciones (firma)
Profesional deber谩 revisar y aprobar los proyectos industriales que se presenten durante el periodo del contrato en todas las ciudades de la concesi贸n.
Coordinar con LOS CONTRATISTAS el requerimiento de informaci贸n solicitado por GDP, para la absoluci贸n de las observaciones presentadas por Osinergmin.
Coordinar con el ente fiscalizador y otras entidades la ejecuci贸n de la obra.
Realizar el seguimiento mensual de la ejecuci贸n del CAPEX de acuerdo a lo propuesto a inicio de cada mes (deber谩 presentar un estatus en el comit茅 de interventor铆a).
Seguimiento y verificaci贸n de la implementaci贸n de los requisitos para las obtenciones de las licencias y permisos municipales y/o entidades del estado que apliquen.
Participar en la elaboraci贸n de las actas de liquidaci贸n de los contratos supervisados.
Show more Show less","['Legal Regulations', 'Occupational Health and Safety', 'Environmental Management', 'Emergency Plans', 'Risk Analysis', 'OHSAS 18001', 'ISO 14001', 'ISO 9001', 'ISO 31000', 'Waste Management', 'Project Management', 'Gas Distribution Systems', 'Construction Safety', 'Coordination', 'Reporting', 'Approval Processes']",Ingenier铆a Civil,2025-08-21T06:09:49,https://pe.linkedin.com/jobs/view/coordinador-de-construccion-at-sgs-4288746604,,[],2025-08-28
