job_id,source,job_title,company,location,description,skills,careers_required,date_posted,url,career_tag,soft_skills_detected,extraction_date
d32caaf69fd7109bc1be60b9a0c1102e,rapidapi2,Jefe de Construccion,Tiendas Neto,"Um谩n, Yucat谩n, Mexico","NETE A NOSOTROS Y CREA TU HISTORIA EN TIENDAS NETO!

TIENDAS NETO PERTENECIENTE A GRUPO SALINAS, UNA EMPRESA 100% MEXICANA ESTAMOS EN BUSQUEDA DE TU TALENTO COMO:

Requisitos

JEFE DE CONSTRUCCION:

Escolaridad: Ing. Civil o Lic. en Arquitectura (Titulado)
Disponibilidad para viajar
Experiencia de m铆nimo 2 a帽os c贸mo responsable de .construcci贸n y mantenimiento
Conocimiento de normas aplicables a la construcci贸n de Tiendas y aplicables para en la contrataci贸n de CFE y UVIE
Garantizar la construcci贸n de tiendas bajo los est谩ndares de calidad, tiempo y costo
Experiencia en construcci贸n de edificaciones o sucursales
Manejo de presupuestos
Manejo de Autocad,Opues,Neodata,etc.

Principales Funciones

Cumplir con el plan de construcci贸n de Tiendas de la compa帽铆a en tiempo y forma, cumpliendo los lineamientos de dise帽o y seguridad.
An谩lisis de levantamiento de infraestructura existente y servicios de locales propuestos para adaptaci贸n a una sucursal
Construcci贸n, Adecuaci贸n y Mantenimiento de infraestructura
Cumplimiento del proceso t茅cnico constructivo y administrativo de las obras asignadas
Control presupuestal

Ofrecemos

Sueldo base 20mil brutos
incentivos trimestrales en base a resultados
Prestaciones de ley (vacaciones, aguinaldo, seguro social)
Becas con universidades
Convenios con Grupo Salinas
Horario de L a V 8am a 5pm, S-9am 2pm
Veh铆culo empresarial.
Requerimientos- Educaci贸n m铆nima: Educaci贸n superior - Licenciatura

2 a帽os de experiencia

Edad: A partir de 28 a帽os

Disponibilidad de viajar: Si

Palabras clave: lider, jefe, gerente, manager, director, chief, lead, jefatura, regente, construction, obra, edificar, edificacion

#J-18808-Ljbffr 
Show more Show less","['Civil Engineering', 'Architecture', 'Construction Management', 'Budget Management', 'Autocad', 'Opus', 'Neodata', 'Quality Assurance', 'Time Management', 'Cost Management', 'Safety Standards', 'Infrastructure Analysis', 'Maintenance', 'Technical Processes', 'Administrative Processes']",Ingenier铆a Civil,2025-08-28T11:46:53,https://mx.linkedin.com/jobs/view/jefe-de-construccion-at-tiendas-neto-4292372868,,[],2025-08-28
7e324bbe71f45c3d44ca1f50238b48ad,rapidapi2,Asesor Comercial Construccion,RIKLARMA,"Per铆metro Urbano Santiago de Cali, Valle del Cauca, Colombia","Asesor Comercial para el Sector Construcci贸n

Estamos en la b煤squeda de un Asesor Comercial para el Sector Construcci贸n con experiencia en el 谩rea de infraestructura y construcci贸n. Esta posici贸n es ideal para un Ejecutivo de Ventas en Construcci贸n que quiera desarrollar su carrera en una empresa l铆der. Buscamos un Consultor de Ventas Constructivas apasionado por cerrar negocios exitosos y que tenga conocimientos t茅cnicos en hormig贸n, cemento y yeso. Nuestra empresa ofrece un contrato inicial a t茅rmino fijo, con la posibilidad de convertirse en indefinido, un atractivo salario b谩sico de $2.000.000 m谩s comisiones del 1.5% por ventas, y un horario flexible de lunes a s谩bado. Esta vacante es para residentes de Cali y alrededores.
Show more Show less","['Sales', 'Construction', 'Infrastructure', 'Concrete', 'Cement', 'Gypsum', 'Technical Knowledge', 'Business Development']",Ingenier铆a Civil,2025-08-27T23:23:27,https://co.linkedin.com/jobs/view/asesor-comercial-construccion-at-riklarma-4292066904,,[],2025-08-28
a982f5944e326a5075b350df9cbbc4d9,rapidapi2,Key Account Executive (sector construccion),ASSA ABLOY Group,"Mexico City, Mexico","Key Account Executive Senior 

MISIN DEL PUESTO DE TRABAJO 

Gestionar y potenciar las cuentas clave de la Compa帽铆a con los principales Despachos y Gerencias del sector construcci贸n o af铆n, asegurando relaciones solidas con los principales tomadores de decisiones, mediante comunicaci贸n constante y efectiva; dando seguimiento a trav茅s del an谩lisis comercial de proyectos en coordinaci贸n con asesores e integradores para asegurar visibilidad brindando propuestas certeras en los tiempos acordados.

FUNCIONES ESPECFICAS 

Gestionar especificaci贸n de proyectos con los principales despachos de arquitectura y firmas de ingenier铆a en Seguridad impulsando la implementaci贸n de herramientas como OPENING STUDIO para generar el pipeline y asegurar la especificaci贸n de proyectos estrat茅gicos, 
Seguimiento mensual con asesores comerciales y especificadores para conocer el pipeline de los proyectos vigentes e integrarnos como fabricantes. 
Controlar y monitorear estatus de pedidos (fechas de entrega, estado de cuenta para que los precios de las facturas est茅n correctos) 
Coordinar procesos y pedidos de producto importado con compras y log铆stica para garantizar entregas oportunas 
Registro y control de proyectos a trav茅s de Salesforce (pipeline) 
An谩lisis de informaci贸n comercial en Excel y/o Power BI 
Elaboraci贸n de presentaciones comerciales t茅cnicas para clientes y Gerencia de Ventas 

PERFIL DEL PUESTO DE TRABAJO 

Licenciatura concluida en Arquitectura, Ingenier铆a mec谩nica, electr贸nica o a fin 
Amplia experiencia, por lo menos 5 a帽os en especificaci贸n de controles de accesos (puertas, herrajes, dispositivos biom茅tricos) 
Gesti贸n de cuentas clave a nivel nacional, contactos solidos con Despachos y firmar de arquitectos 
Dominio de CRM 
Colaboraci贸n 
Orientaci贸n al cliente 
Toma de decisiones efectivas 
Orientaci贸n a la estrategia 

HABILIDADES TCNICAS NECESARIAS 

Herramientas de especificaci贸n digital Openings Studio o similar (es un plus) 
AutoCAD 
Salesforce 
Ingl茅s t茅cnico-comercial 

Somos el Grupo ASSA ABLOY

Nuestra gente nos ha convertido en el l铆der mundial en soluciones de acceso. A cambio, les abrimos las puertas all谩 donde vayan. Con casi 63.000 colegas en m谩s de 70 pa铆ses diferentes, ayudamos a miles de millones de personas a experimentar un mundo m谩s abierto. Nuestras innovaciones hacen que todo tipo de espacios -f铆sicos y virtuales- sean m谩s seguros y de m谩s f谩cil acceso.

Como empleador, valoramos los resultados, no los t铆tulos ni los antecedentes. Permitimos que nuestros empleados construyan su carrera en torno a sus aspiraciones y a las nuestras, apoy谩ndoles con comentarios peri贸dicos, formaci贸n y oportunidades de desarrollo. Nuestros compa帽eros piensan ampliamente en d贸nde pueden tener m谩s impacto, y les animamos a desarrollar su funci贸n a nivel local, regional o incluso internacional.

Al dar la bienvenida a nuevas personas, es importante para nosotros tener equipos diversos e inclusivos, y valoramos las diferentes perspectivas y experiencias. 
Show more Show less","['Account Management', 'Client Relationship', 'Salesforce', 'Excel', 'Power BI', 'AutoCAD', 'Digital Specification Tools', 'Decision Making', 'Collaboration', 'Customer Orientation', 'Strategic Orientation', 'Project Management', 'Communication', 'Technical Presentations', 'Pipeline Management', 'Order Monitoring']",Ingenier铆a Civil,2025-08-27T19:09:58,https://mx.linkedin.com/jobs/view/key-account-executive-sector-construccion-at-assa-abloy-group-4290312424,,[],2025-08-28
38adbe4a55e44264e307b541a8b8477f,rapidapi2,Ingeniero residente de construccion,BLUE POINT REAL STATE DEVELOPMENT,"Tulum, Quintana Roo, Mexico","Ingeniero residente de construcion

驴Te apasiona la construcci贸n, el control de calidad en obra y el liderazgo de equipos en campo?
En BLUE POINT RS, buscamos un(a) Ingeniero residente de construcion comprometido(a) y con visi贸n t茅cnica, que asegure la correcta ejecuci贸n de nuestros desarrollos inmobiliarios en el Caribe Mexicano.

Tu misi贸n ser谩 supervisar en sitio el cumplimiento de los cronogramas, controlar la calidad de los procesos constructivos, coordinar a contratistas y cuadrillas, y garantizar que cada detalle de la obra refleje los est谩ndares de excelencia que distinguen a nuestra marca.
Trabajar谩s de la mano con Direcci贸n de Obra, Administraci贸n de Obra, Coordinadores BIM y Arquitectura, siendo un pilar en la conexi贸n entre el proyecto ejecutivo y su materializaci贸n en campo.

No buscamos solo a un supervisor operativo: buscamos a un profesional que entienda la obra como un producto integral, capaz de anticiparse a problemas, comunicar hallazgos y liderar la ejecuci贸n con disciplina, seguridad y eficiencia.

 RESPONSABILIDADES CLAVE
Supervisar diariamente el avance f铆sico en obra, registrando incidencias y reportes fotogr谩ficos.
Validar el cumplimiento de procesos constructivos conforme a planos, especificaciones y normativas.
Coordinar contratistas, destajistas y cuadrillas en sitio.
Revisar la correcta utilizaci贸n de materiales, insumos y equipo.
Reportar avances y desviaciones a Direcci贸n de Obra y Administraci贸n de Obra.
Apoyar en la validaci贸n de estimaciones y pagos contra avance real.
Garantizar el cumplimiento de medidas de seguridad y uso de EPP en campo.
Anticipar riesgos t茅cnicos y proponer soluciones pr谩cticas en tiempo real.

 REQUISITOS Y PERFIL IDEAL
Formaci贸n:
Ingeniero Civil, Arquitecto o af铆n.
Experiencia:
M铆nimo 3 a帽os en supervisi贸n de obra residencial o vertical.
Experiencia comprobable en coordinaci贸n de contratistas y control de calidad en construcci贸n.
Conocimientos t茅cnicos:
Uso indispensable de Revit (BIM). (Se descartar谩n autom谩ticamente los candidatos que no cumplan con este requisito).
Procesos constructivos, normas de obra y seguridad.
Lectura de planos arquitect贸nicos, estructurales e instalaciones.
Control de estimaciones y presupuestos (deseable).
Manejo de MS Project y Excel (deseable).

Habilidades blandas:
Liderazgo en campo y manejo de personal.
Comunicaci贸n clara y efectiva con m煤ltiples 谩reas.
Organizaci贸n, disciplina y atenci贸n al detalle.
Proactividad para anticipar problemas y resolver con rapidez.
 Lugar: Playa del Carmen y Tulum (trabajo en obra, 100% presencial).
 Horario: Lunes a s谩bado, 08:00 a.m. a 06:00 p.m. (48 horas semanales).

 驴QU OFRECEMOS?
Participar en proyectos inmobiliarios de alto nivel en el Caribe Mexicano.
Oportunidad de crecimiento hacia Coordinador de Obra.
Equipo multidisciplinario con Arquitectura, BIM y Administraci贸n de Obra.
Ambiente profesional y orientado a resultados.
Sueldo competitivo acorde a experiencia.
 Si eres un(a) profesional con disciplina en campo, pasi贸n por la construcci贸n y dominio de Revit (BIM), post煤late enviando tu CV.
Show more Show less","['Civil Engineering', 'Architecture', 'Construction Supervision', 'Quality Control', 'BIM', 'Revit', 'Project Management', 'Safety Compliance', 'Team Coordination', 'Problem Solving', 'Attention to Detail', 'Communication', 'Leadership', 'Organization', 'Discipline', 'Proactivity']",Ingenier铆a Civil,2025-08-26T15:19:18,https://mx.linkedin.com/jobs/view/ingeniero-residente-de-construccion-at-blue-point-real-state-development-4291602436,,[],2025-08-28
0a84ba6a4d45e364a51a972cccfe0827,rapidapi2,COORDINADOR DE COMPRAS MATERIALES DE CONSTRUCCION,MyS Consultores - Headhunters,"General Escobedo, Durango, Mexico","Coordinador de Compras

Ubicaci贸n: Escobedo, Nuevo Le贸n (cerca del Polideportivo)

Salario: $25,000 libres por mes

Empresa dedicada al ramo de la construcci贸n de obras p煤blicas, se encuentra en b煤squeda de un Coordinador de Compras con una s贸lida trayectoria en el 谩rea. Si tienes al menos 4 a帽os de experiencia en compras, espec铆ficamente en el giro de la construcci贸n, y deseas unirte a un equipo din谩mico y en crecimiento, esta es tu oportunidad.

Actividades Principales

Como Coordinador de Compras, ser谩s responsable de diversas actividades clave que aseguran el buen funcionamiento de nuestro proceso de adquisici贸n:

Cotizaciones: Realizar y gestionar cotizaciones con proveedores, evaluando la calidad y costo de los materiales necesarios para la ejecuci贸n de nuestras obras.
Control de Presupuesto: Monitorear y controlar el presupuesto asignado para cada proyecto, garantizando que se mantenga dentro de los m谩rgenes establecidos.
Generar rdenes de Compra: Emitir 贸rdenes de compra de manera eficiente y oportuna, asegurando la disponibilidad de materiales en el momento requerido.
Recepci贸n y Atenci贸n a Requisiciones de Material: Atender las solicitudes de materiales de los diferentes equipos de trabajo, asegurando la correcta recepci贸n y distribuci贸n de los mismos.
Manejo de Sistema Odoo: Utilizar el software Odoo para la gesti贸n de compras y control de inventarios, facilitando as铆 un seguimiento efectivo de los insumos adquiridos.

Requisitos

Experiencia: M铆nimo 4 a帽os de experiencia en la adquisici贸n de materiales espec铆ficamente para obras p煤blicas, con un enfoque en la construcci贸n.
Educaci贸n: Licenciatura concluida a fin

Ofrecemos

$25,000 LIBRES MENSUALES
PRESTACIONES DE LEY
OPORTUNIDAD DE CRECIMIENTO

隆Esperamos conocerte pronto y que puedas contribuir al crecimiento de nuestra empresa como nuestro nuevo Coordinador de Compras! 
Show more Show less",,Ingenier铆a Civil,2025-08-25T23:49:54,https://mx.linkedin.com/jobs/view/coordinador-de-compras-materiales-de-construccion-at-mys-consultores-headhunters-4290880491,,[],2025-08-28
7cb2d864d9491d80255abf1a892e1ad5,rapidapi2,Ejecutivo de venta de material de construccion a empresas,Sodimac,"Zapopan, Jalisco, Mexico","Descripci贸n Empresa

Somos m谩s de 90 mil personas que cada d铆a trabajamos por el firme Prop贸sito - Simplificar y Disfrutar m谩s la Vida. Estamos presentes en 9 pa铆ses y compuestos por grandes marcas posicionadas de diversas industrias. Falabella Retail, Sodimac, Banco Falabella, Tottus, Mallplaza, Falabella.com, Falabella Inmobiliario. Cada una de 茅stas nos hace ser quienes somos, y es entre todos, como Un Solo Equipo, que buscamos diariamente reinventarnos y superar las experiencias de nuestros clientes.

Si eres trabajador de Falabella, revisa todos los cursos disponibles en la Academia Falabella, que te ayudar谩n a seguir impulsando tu desarrollo y preparar tu pr贸xima aventura con nosotros!

Misi贸n Del Cargo

Impulsar ventas B2B de materiales de construcci贸n, generando relaciones s贸lidas con empresas del sector.

Funciones Del Cargo

隆Forma parte de Sodimac La Cima!

Estamos buscando un/a Ejecutivo/a Comercial para fortalecer nuestro equipo de Venta a Empresas.

Requisitos

Experiencia de 1 - 3 a帽os en el puesto
Disponibilidad de horario
Licencia de conducir vigente

Beneficios

Condiciones oferta:

30 dias de aguinaldo, vales de despensa, vales de gasolina, prestaciones, comisiones sin tope, descuento de empleados, seguro de vida

Descripci贸n Proceso De Selecci贸n

S煤mate a nuestro equipo y se parte de la transformaci贸n de Falabella:

Postula a la oferta.
Revisa tu email.
Show more Show less","['Sales', 'B2B Sales', 'Relationship Building', 'Communication', 'Negotiation', 'Customer Service', 'Time Management', 'Problem Solving']",Ingenier铆a Civil,2025-08-25T18:09:34,https://mx.linkedin.com/jobs/view/ejecutivo-de-venta-de-material-de-construccion-a-empresas-at-sodimac-4290942219,,[],2025-08-28
563b5949b82cc6ae48abfbd733a9b989,rapidapi2,Ejecutivo de venta de material de construccion a empresas,Sodimac,"Zapopan, Jalisco, Mexico","Descripci贸n Empresa

Somos m谩s de 90 mil personas que cada d铆a trabajamos por el firme Prop贸sito - Simplificar y Disfrutar m谩s la Vida. Estamos presentes en 9 pa铆ses y compuestos por grandes marcas posicionadas de diversas industrias. Falabella Retail, Sodimac, Banco Falabella, Tottus, Mallplaza, Falabella.com, Falabella Inmobiliario. Cada una de 茅stas nos hace ser quienes somos, y es entre todos, como Un Solo Equipo, que buscamos diariamente reinventarnos y superar las experiencias de nuestros clientes.

Si eres trabajador de Falabella, revisa todos los cursos disponibles en la Academia Falabella, que te ayudar谩n a seguir impulsando tu desarrollo y preparar tu pr贸xima aventura con nosotros!

Misi贸n Del Cargo

Impulsar ventas B2B de materiales de construcci贸n, generando relaciones s贸lidas con empresas del sector.

Funciones Del Cargo

隆Forma parte de Sodimac La Cima!

Estamos buscando un/a Ejecutivo/a Comercial para fortalecer nuestro equipo de Venta a Empresas.

Requisitos

Experiencia de 1 - 3 a帽os en el puesto
Disponibilidad de horario
Licencia de conducir vigente

Beneficios

Condiciones oferta:

30 dias de aguinaldo, vales de despensa, vales de gasolina, prestaciones, comisiones sin tope, descuento de empleados, seguro de vida

Descripci贸n Proceso De Selecci贸n

S煤mate a nuestro equipo y se parte de la transformaci贸n de Falabella:

Postula a la oferta.
Revisa tu email.
Show more Show less","['Sales', 'B2B Sales', 'Relationship Building', 'Communication', 'Negotiation', 'Customer Service', 'Time Management', 'Teamwork']",Ingenier铆a Civil,2025-08-25T18:09:34,https://mx.linkedin.com/jobs/view/ejecutivo-de-venta-de-material-de-construccion-a-empresas-at-sodimac-4290939481,,[],2025-08-28
eb83e5be2e3a50156f24f152969685ea,rapidapi2,PEON CONSTRUCCION,Marein,"Marbella, Andalusia, Spain","Empresa especializada en proyectos residenciales de edificaci贸n y construcci贸n, precisa incorporar en su equipo de trabajo Peones ordinarios para la ejecuci贸n de varias obras en construcci贸n en Marbella (M谩laga).

Tareas
Realizaci贸n de tareas en la edificaci贸n de obra nueva y de mantenimiento y reforma, bajo la supervisi贸n de la persona encargada de la obra. - Cargar y transportar materiales para abastecer las zonas de trabajo. Limpiar los tajos, retirar los escombros y desechos y depositarlos en los contenedores.

Preparar cemento, controlar maquinaria, y utilizar equipos, tales como hormigoneras, taladros y m谩quinas de bombeo, para mover, cargar y descargar materiales.

Requisitos
Formaci贸n en prevenci贸n riesgos laborales

Beneficios
Empresa profesional, muy atractiva, puesto estable, carrera profesional y remuneraci贸n acorde
Show more Show less","['Construction', 'Material Handling', 'Machinery Operation', 'Cement Preparation', 'Site Cleaning', 'Teamwork']",Ingenier铆a Civil,2025-08-25T16:02:46,https://es.linkedin.com/jobs/view/peon-construccion-at-marein-4288583881,,[],2025-08-28
f69e16e1b9a06da402ec376dc57a6c5f,rapidapi2,Comercial construccion,Riwega,"Alacant / Alicante, Valencian Community, Spain","En Riwega, una empresa destacada en el sector de la construcci贸n, como fabricante de productos para la impermeabilizacion, hermeticidad y construccion sostenible. Estamos buscando un Comercial altamente motivado para unirse a nuestro equipo din谩mico. Con una plantilla de entre 51 y 200 empleados, ofrecemos un ambiente de trabajo colaborativo donde cada miembro tiene la oportunidad de marcar la diferencia. El candidato ideal tendr谩 una fuerte habilidad para construir relaciones con clientes potenciales. En Riwega, valoramos la innovaci贸n y la dedicaci贸n, y proporcionamos recursos excepcionales para que nuestros empleados prosperen. Esta es una oportunidad 煤nica para formar parte de una empresa en crecimiento y contribuir al 茅xito continuo en el sector de la construcci贸n . Si tienes pasi贸n por las ventas y deseas desarrollar tu carrera en una empresa l铆der, nos encantar铆a conocerte.

Tareas

Identificar y desarrollar nuevas oportunidades de negocio en el sector de la construcci贸n .

Mantener y fortalecer las relaciones con clientes existentes, asegurando su satisfacci贸n y fidelizaci贸n.

Colaborar con el equipo de ventas para dise帽ar estrategias efectivas que impulsen el crecimiento de las ventas.

Realizar presentaciones de productos y servicios a clientes potenciales y actuales.

Analizar las tendencias del mercado y la competencia para ajustar las estrategias comerciales seg煤n sea necesario.


Requisitos

Experiencia previa en el sector de la construcci贸n. no indispensable

Habilidades sobresalientes de comunicaci贸n y negociaci贸n.

Capacidad para desarrollar y mantener relaciones comerciales efectivas.

Conocimiento profundo de productos y servicios de construcci贸n.

Disponibilidad para viajar seg煤n sea necesario.


Beneficios
Sueldo seg煤n convenio, comisiones y premios trimestrales. Coche de empresa.

nete a Riwega, l铆der en Construcci贸n . S茅 parte de un equipo innovador y din谩mico. 隆Impulsa tu carrera con nosotros como Comercial construcci贸n!
Show more Show less","['Communication', 'Negotiation', 'Relationship Building', 'Market Analysis', 'Sales Strategy', 'Product Presentation']",Ingenier铆a Civil,2025-08-24T18:32:11,https://es.linkedin.com/jobs/view/comercial-construccion-at-riwega-4288508475,,[],2025-08-28
f8aa8758175a555ebed6778c3e24b0a5,rapidapi2,OBREROS DE LA CONSTRUCCION - LUJAN,Felanix construcciones,"Luj谩n, San Luis, Argentina","Buscamos Obrero de la construccion para Lujan, Provincia de Buenos Aires

Descripci贸n del puesto Como Obrero de la Construcci贸n en Felanix Construcciones, ser谩s responsable de realizar diversas tareas relacionadas con la construcci贸n y renovaci贸n de edificios. Las actividades diarias incluir谩n trabajos de alba帽iler铆a, pintura, instalaci贸n de suelos, manejo de materiales de construcci贸n y tareas generales. Este es un puesto de tiempo completo y se realizar谩 de manera presencial en el Lujan, Provincia de Buenos Aires.


Requisitos
Experiencia en alba帽iler铆a y pintura.
Habilidades en la construcci贸n y renovaci贸n de edificios.
Aptitudes adicionales como trabajo en equipo, buena comunicaci贸n y actitud proactiva ser谩n altamente valoradas.
Experiencia en conservacion de patrimonio y fachadas ser谩n valoradas.

Remuneraci贸n acorde a convenio UOCRA-
Enviar CV en el siguiente formulario: https://forms.gle/H3opJXQfmctdJXUF6
Show more Show less","['Masonry', 'Painting', 'Construction', 'Building Renovation', 'Teamwork', 'Communication', 'Proactive Attitude', 'Heritage Conservation', 'Facade Restoration']",Ingenier铆a Civil,2025-08-22T18:47:31,https://ar.linkedin.com/jobs/view/obreros-de-la-construccion-lujan-at-felanix-construcciones-4287149706,,[],2025-08-28
9392c015551a014ba24804c3b46ce830,rapidapi2,Vendedor de material de construccion a empresas,Sodimac,"Zapopan, Jalisco, Mexico","Misi贸n Del Cargo

EXPERIENCIA EN TIENDAS ESPECIALIZADAS EN MATERIALES PARA LA CONSTRUCCIN, PISO CERMICO, BAOS Y COCINAS

Funciones Del Cargo

Ventas especializadas en construccion

Experiencia el 谩rea de Atenci贸n al Cliente, Servicio al Cliente, trabajar bajo presi贸n y objetivos, manejo de cartera de clientes,

Lograr la rentabilidad de operaciones

Coordinaci贸n de personal

Cierre de ventas con altos proveedores

Proponer estrategias para cumplir los KPIS de la compa帽铆a.

Ofrecemos

Sueldo $12,000

Apoyo para transporte $700

Vales de despensa $1200

Pago quincenal

Prestaciones de ley y superiores

Aguinaldo 30 dias

Seguro de vida

Descuento de empleados

Convenio con gym y universidades

SI ESTAS INTERESADO Y CUBRES AL 100% EL PERFIL, PROGRAMA TU CITA AL: 56 6227 7604

Por favor si estas seguro de pertenecer a esta familia Sodimac y programaste tu cita, por respeto, te pido ACUDAS. Si no estas seguro, no te postules y dale la oportunidad a alguien m谩s. Muchas gracias

Requisitos

EXPERIENCIA EN VENTAS
EXPERIENCIA EN RETAIL
EXPERIENCIA EN CONSTRUCCION

Condiciones Oferta

Sueldo neto mensual:: 12000

Descripci贸n Proceso De Selecci贸n

El proceso de selecci贸n se realiza a trav茅s de AIRA - plataforma de reclutamiento dise帽ado para mejorar tu experiencia de postulaci贸n.

Para Postular Solo Necesitas

Postular a la oferta
Revisar tu mail
Ingresar a AIRA y contestar las preguntas y/o pruebas solicitadas

Luego, si vemos que tu perfil se ajusta a lo que estamos buscando, te contactaremos por mail (a trav茅s de AIRA) para seguir a la etapa presencial. 
Show more Show less","['Sales', 'Customer Service', 'Retail Experience', 'Construction Knowledge', 'Pressure Management', 'Client Portfolio Management', 'Profitability', 'Team Coordination', 'Sales Closure', 'Strategy Proposal', 'KPI Achievement']",Ingenier铆a Civil,2025-08-22T00:04:07,https://mx.linkedin.com/jobs/view/vendedor-de-material-de-construccion-a-empresas-at-sodimac-4289382626,,[],2025-08-28
